cellLineId,organ,tissue,donorId,originYear,strProfile,cellLineManifestation,resistance,cellLineCategory,contaminatedMisidentified,cellLineGeneticDisorder,populationDoublingTime,_cellLineName,_pmid,_doi,_publicationTitle,_foundIn,_confidence,_contextSnippet,_whyMissed,_reasoning,_source,_completenessScore,_criticalFieldsScore,_missingCriticalFields,_hasMinimumFields
56b83774-c89f-41d0-9dce-9e6c1dfe1735,,,,,,,,,,,,Nf1-/- cells,PMID:11080503,,Neurofibromin GTPase-activating protein-related domains restore normal growth in Nf1-/- cells.,abstract,0.9,...Neurofibromin GTPase-activating protein-related domains restore normal growth in Nf1-/- cells...,Cell line with knockout notation (Nf1-/-) not caught - may need pattern for knockout cell line nomenclature,,AI validation - Sonnet 4.5,0,0,,True
c74c4ef0-c4c9-4f81-ba51-5ba7fca71d8e,,,,,,,,,,,,primary Nf1-deficient cells,PMID:11080503,,Neurofibromin GTPase-activating protein-related domains restore normal growth in Nf1-/- cells.,abstract,0.85,"...expression of neurofibromin GRD, but not the p120GAP GRD, restores normal growth and cytokine signaling in three lineages of primary Nf1-deficient cells...",Primary cell cultures not caught - may need pattern for 'primary [gene]-deficient cells',,AI validation - Sonnet 4.5,0,0,,True
a42cf74e-ed9d-4004-8460-5c5592c5d836,,,,,,,,,,,,MDCK,PMID:11756419,,Structural basis for neurofibromatosis type 2. Crystal structure of the merlin FERM domain.,methods,0.95,"MDCK (ATCC Cat# CCL-34, RRID:CVCL_0422) and HEK293T cells were cultured in DMEM",Standard cell line with ATCC catalog number and RRID,,AI validation - Sonnet 4.5,0,0,,True
2f0c38d1-bc52-475f-a4aa-6847d06133dc,,,,,,,,,,,,S2R+,PMID:11756419,,Structural basis for neurofibromatosis type 2. Crystal structure of the merlin FERM domain.,methods,0.95,"Drosophila S2R+ cells (Drosophila Genomic Resource Center, Cat#150, RRID:CVCL_Z831)",Drosophila cell line with catalog number and RRID,,AI validation - Sonnet 4.5,0,0,,True
97dd72bf-3a89-44b3-be1d-91d416d1eaa6,,,,,,,,,,,,hamster-human somatic cell hybrids,PMID:1427886,,A radiation hybrid map of the region on human chromosome 22 containing the neurofibromatosis type 2 locus.,abstract,0.95,Eighty-five hamster-human somatic cell hybrids generated by X-irradiation and cell fusion were used to generate the radiation hybrid map.,This is a specific type of cell line (radiation hybrid panel) used for genetic mapping. The term 'somatic cell hybrids' may not have been in the cell line pattern dictionary.,,AI validation - Sonnet 4.5,0,0,,True
4da0d2df-544a-4c8d-a766-bc4775c1fd9d,,,,,,,,,,,,radiation hybrids,PMID:1427886,,A radiation hybrid map of the region on human chromosome 22 containing the neurofibromatosis type 2 locus.,abstract,0.9,Sixteen of the 18 markers were distinguishable by X-ray breakage in the radiation hybrids.,Alternative name for the same cell line system. 'Radiation hybrids' is standard terminology for this type of mapping panel.,,AI validation - Sonnet 4.5,0,0,,True
c1cbb9b8-06a0-45da-8f14-a1ce3e8f999d,,,,,,,,,,,,fibroblast cell cultures,PMID:15681480,,Sensitive detection of deletions of one or more exons in the neurofibromatosis type 2 (NF2) gene by multiplexed gene dosage polymerase chain reaction.,abstract,0.85,This finding was validated by reverse transcriptase-PCR on fibroblast and schwannoma cell cultures of this patient and cDNA sequencing.,Cell culture mentioned in validation experiments but not captured by mining patterns,,AI validation - Sonnet 4.5,0,0,,True
b23e9c3e-9b6a-45d3-bde1-f2778e7934bd,,,,,,,,,,,,schwannoma cell cultures,PMID:15681480,,Sensitive detection of deletions of one or more exons in the neurofibromatosis type 2 (NF2) gene by multiplexed gene dosage polymerase chain reaction.,abstract,0.85,This finding was validated by reverse transcriptase-PCR on fibroblast and schwannoma cell cultures of this patient and cDNA sequencing.,Cell culture mentioned in validation experiments but not captured by mining patterns,,AI validation - Sonnet 4.5,0,0,,True
aec260cf-8ff2-4c7c-a7e4-4f9c1705f8b6,,,,,,,,,,,,Nf1+/- mast cells,PMID:16835260,,Nf1+/- mast cells induce neurofibroma like phenotypes through secreted TGF-beta signaling.,abstract,0.85,...Nf1+/- mast cells induce neurofibroma like phenotypes through secreted TGF-beta signaling...Nf1+/- mast cells secrete elevated concentrations...,"Primary cell type derived from Nf1+/- mice, represents a specific cellular tool used in experiments",,AI validation - Sonnet 4.5,0,0,,True
c433eaca-aed1-4f95-8db8-4cf56afda0a9,,,,,,,,,,,,Nf1+/- fibroblasts,PMID:16835260,,Nf1+/- mast cells induce neurofibroma like phenotypes through secreted TGF-beta signaling.,abstract,0.85,"...In response to TGF-beta, both murine Nf1+/- fibroblasts and fibroblasts from human neurofibromas proliferate and synthesize excessive collagen...","Primary fibroblast cells derived from Nf1+/- mice, specific cellular tool for studying fibroblast responses",,AI validation - Sonnet 4.5,0,0,,True
383f722d-6ff2-433d-84af-e3aaa2e3c8ba,,,,,,,,,,,,human neurofibroma fibroblasts,PMID:16835260,,Nf1+/- mast cells induce neurofibroma like phenotypes through secreted TGF-beta signaling.,abstract,0.8,...both murine Nf1+/- fibroblasts and fibroblasts from human neurofibromas proliferate and synthesize excessive collagen...,"Primary human cells derived from patient neurofibromas, represents patient-derived cellular material",,AI validation - Sonnet 4.5,0,0,,True
bd5d3733-5c23-4a91-acc1-e7c659624f62,,,,,,,,,,,,HAP1 MTAP-isogenic cell line pair,PMID:18242512,,Induction of abnormal proliferation by nonmyelinating schwann cells triggers neurofibroma formation.,methods,1.0,The HAP1 MTAP-isogenic cell line pair was purchased from Horizon Discovery (HZGHC004894c005) and maintained in DMEM,Specific cell line with catalog number and vendor - should be easily detectable,,AI validation - Sonnet 4.5,0,0,,True
b1520598-a844-457e-9613-97ce494d6625,,,,,,,,,,,,JH-2-079,PMID:18242512,,Induction of abnormal proliferation by nonmyelinating schwann cells triggers neurofibroma formation.,methods,1.0,"Human JH-2-079, JH-2-002, JH-2-009, and JH-2-031 MPNST cell lines were obtained from the Johns Hopkins NF1 biospecimen repository",Standard cell line nomenclature with institutional source,,AI validation - Sonnet 4.5,0,0,,True
d12305b1-74b6-427d-86be-c9c9da94a090,,,,,,,,,,,,JH-2-002,PMID:18242512,,Induction of abnormal proliferation by nonmyelinating schwann cells triggers neurofibroma formation.,methods,1.0,"Human JH-2-079, JH-2-002, JH-2-009, and JH-2-031 MPNST cell lines were obtained from the Johns Hopkins NF1 biospecimen repository",Standard cell line nomenclature with institutional source,,AI validation - Sonnet 4.5,0,0,,True
6592e0f3-3c9d-41f3-a522-d35b8bfc2d50,,,,,,,,,,,,JH-2-009,PMID:18242512,,Induction of abnormal proliferation by nonmyelinating schwann cells triggers neurofibroma formation.,methods,1.0,"Human JH-2-079, JH-2-002, JH-2-009, and JH-2-031 MPNST cell lines were obtained from the Johns Hopkins NF1 biospecimen repository",Standard cell line nomenclature with institutional source,,AI validation - Sonnet 4.5,0,0,,True
d85f7d41-c99c-4ce3-b3f1-83ce172c8750,,,,,,,,,,,,JH-2-031,PMID:18242512,,Induction of abnormal proliferation by nonmyelinating schwann cells triggers neurofibroma formation.,methods,1.0,"Human JH-2-079, JH-2-002, JH-2-009, and JH-2-031 MPNST cell lines were obtained from the Johns Hopkins NF1 biospecimen repository",Standard cell line nomenclature with institutional source,,AI validation - Sonnet 4.5,0,0,,True
1d94248b-f4dc-4824-beeb-e9c2cc2cb9a9,,,,,,,,,,,,WU-356,PMID:18242512,,Induction of abnormal proliferation by nonmyelinating schwann cells triggers neurofibroma formation.,methods,1.0,WU-356 cells were generated at Washington University in St. Louis. Cell lines are available upon request.,Institutional cell line with clear availability statement,,AI validation - Sonnet 4.5,0,0,,True
9e346fb4-ef28-4351-96c5-7055ea898082,,,,,,,,,,,,NF90-8,PMID:18367665,,Induction of apoptosis in neurofibromatosis type 1 malignant peripheral nerve sheath tumor cell lines by a combination of novel farnesyl transferase inhibitors and lovastatin.,abstract,0.95,"...two NF1 malignant peripheral nerve sheath tumor (MPNST) cell lines, NF90-8 and ST88-14. Single treatments...",Cell line name not recognized by mining patterns - may need specific NF cell line nomenclature patterns,,AI validation - Sonnet 4.5,0,0,,True
3450e90a-5712-404d-8846-0ec444691b30,,,,,,,,,,,,ST88-14,PMID:18367665,,Induction of apoptosis in neurofibromatosis type 1 malignant peripheral nerve sheath tumor cell lines by a combination of novel farnesyl transferase inhibitors and lovastatin.,abstract,0.95,"...two NF1 malignant peripheral nerve sheath tumor (MPNST) cell lines, NF90-8 and ST88-14. Single treatments...",Cell line name not recognized by mining patterns - may need specific NF cell line nomenclature patterns,,AI validation - Sonnet 4.5,0,0,,True
0d8c388d-9005-4e54-99b5-990970a16a7f,,,,,,,,,,,,Nf1-deficient embryonic telencephalic neurospheres,PMID:18371380,,Neurofibromatosis-1 regulates neuronal and glial cell differentiation from neuroglial progenitors in vivo by both cAMP- and Ras-dependent mechanisms.,abstract,0.9,Nf1-deficient embryonic telencephalic neurospheres exhibit increased self-renewal and prolonged survival as explants in vivo,Primary cell culture system with genetic modification not captured by current patterns,,AI validation - Sonnet 4.5,0,0,,True
affcb6db-55d7-4ebb-a5a4-fa55ea79a33b,,,,,,,,,,,,human primary Schwann cells,PMID:18445079,,Altered adhesive structures and their relation to RhoGTPase activation in merlin-deficient Schwannoma.,abstract,0.8,"Using our Schwannoma in vitro model of human primary Schwann and Schwannoma cells, we here show that Schwannoma cells display",Primary cell cultures are research tools but may not have been recognized due to 'primary' descriptor rather than established cell line naming,,AI validation - Sonnet 4.5,0,0,,True
4194dde0-b05e-4650-834e-341be8b3790c,,,,,,,,,,,,human primary Schwannoma cells,PMID:18445079,,Altered adhesive structures and their relation to RhoGTPase activation in merlin-deficient Schwannoma.,abstract,0.8,"The Rac1 guanine exchange factor- beta-Pix, localizes to focal contacts in human primary Schwannoma cells",Primary cell cultures specifically mentioned as experimental system but not captured by mining patterns,,AI validation - Sonnet 4.5,0,0,,True
e58a01b4-7f3e-446e-9201-ec65270e2643,,,,,,,,,,,,NF1-derived MPNST cell lines,PMID:18483311,,Effective in vivo targeting of the mammalian target of rapamycin pathway in malignant peripheral nerve sheath tumors.,abstract,0.85,...decreased growth 19% to 60% after 4 days of treatment in NF1 and sporadic-derived MPNST cell lines...,Descriptive cell line name may not match standard nomenclature patterns,,AI validation - Sonnet 4.5,0,0,,True
141a7b71-6dc2-419d-bc58-01a1f79b50c1,,,,,,,,,,,,sporadic-derived MPNST cell lines,PMID:18483311,,Effective in vivo targeting of the mammalian target of rapamycin pathway in malignant peripheral nerve sheath tumors.,abstract,0.85,...decreased growth 19% to 60% after 4 days of treatment in NF1 and sporadic-derived MPNST cell lines...,Descriptive cell line name may not match standard nomenclature patterns,,AI validation - Sonnet 4.5,0,0,,True
0abe9049-2b26-42c1-b06c-9de82bbe3034,,,,,,,,,,,,CAG cell line,PMID:18503770,,The pathological splicing mutation c.6792C>G in NF1 exon 37 causes a change of tenancy between antagonistic splicing factors.,methods,0.9,Human MM cell lines CAG and OCI-MY5 were cultured in RPMI-1640,Multiple myeloma cell line used in experiments,,AI validation - Sonnet 4.5,0,0,,True
b02f5dc2-d06d-496a-9b30-a5e32247856b,,,,,,,,,,,,OCI-MY5 cell line,PMID:18503770,,The pathological splicing mutation c.6792C>G in NF1 exon 37 causes a change of tenancy between antagonistic splicing factors.,methods,0.9,Human MM cell lines CAG and OCI-MY5 were cultured in RPMI-1640,Multiple myeloma cell line used in experiments,,AI validation - Sonnet 4.5,0,0,,True
a71d8895-b510-4269-a87b-f3de54b545c5,,,,,,,,,,,,Nf1(+/-) mast cells,PMID:18768391,,Pak1 regulates multiple c-Kit mediated Ras-MAPK gain-in-function phenotypes in Nf1+/- mast cells.,abstract,0.85,"Pak1 regulates hyperactive Ras-dependent proliferation via a Pak1/Erk pathway, whereas a Pak1/p38 pathway is required for the increased migration in Nf1(+/-) mast cells","Primary cell culture or cell line derived from Nf1 heterozygous mice, represents a specific cellular model system",,AI validation - Sonnet 4.5,0,0,,True
055294f1-5569-4941-9328-ea0063d84715,,,,,,,,,,,,NF1 malignant peripheral nerve sheath tumor cell lines,PMID:18927496,,Suppression of proliferation of two independent NF1 malignant peripheral nerve sheath tumor cell lines by the pan-ErbB inhibitor CI-1033.,abstract,0.9,Suppression of proliferation of two independent NF1 malignant peripheral nerve sheath tumor cell lines by the pan-ErbB inhibitor CI-1033,Cell line mining patterns may not capture descriptive phrases like 'two independent NF1 malignant peripheral nerve sheath tumor cell lines' rather than specific cell line names,,AI validation - Sonnet 4.5,0,0,,True
0a0b11ca-3cd8-4396-bc6f-f6e1ce1717ab,,,,,,,,,,,,human meningioma cell lines,PMID:18953429,,"The neurofibromatosis 2 tumor suppressor gene product, merlin, regulates human meningioma cell growth by signaling through YAP.",abstract,0.9,...we developed human meningioma cell lines matched for merlin expression to evaluate merlin growth regulation...,Cell line development is explicitly mentioned but may not have been caught by generic cell line patterns,,AI validation - Sonnet 4.5,0,0,,True
711fcf79-0614-4470-bf9d-8166fc30851f,,,,,,,,,,,,NF2-deficient meningioma cells,PMID:18953429,,"The neurofibromatosis 2 tumor suppressor gene product, merlin, regulates human meningioma cell growth by signaling through YAP.",abstract,0.85,...siRNA-mediated reduction of YAP in NF2-deficient meningioma cells rescued the effects...,Specific cell line variant mentioned but may be missed due to disease gene reference patterns,,AI validation - Sonnet 4.5,0,0,,True
6b0a1dc7-7f68-4afa-8f9c-0acf0e8540ae,,,,,,,,,,,,EGFR(+);P75(+) neurofibroma cells,PMID:19041782,,Nf1 mutation expands an EGFR-dependent peripheral nerve progenitor that confers neurofibroma tumorigenic potential.,abstract,0.8,Prospective identification of human EGFR(+);P75(+) neurofibroma cells enriched EGF-dependent sphere-forming cells,Specific cell population characterized by surface markers - represents isolated/enriched cell line,,AI validation - Sonnet 4.5,0,0,,True
a71413ef-9c0e-4887-94e9-e2dcc0f6a8de,,,,,,,,,,,,Nf2(-/-) glial cells,PMID:19103750,,"The neurofibromatosis 2 protein, merlin, regulates glial cell growth in an ErbB2- and Src-dependent manner.",abstract,0.85,pharmacologic or genetic inhibition of Src activation reduces Nf2(-/-) glial cell growth to wild-type levels,"These are derivative glial cells from the knockout mice, representing a cell line tool. The notation 'Nf2(-/-)' indicates genetically modified cells.",,AI validation - Sonnet 4.5,0,0,,True
fffe29b9-fb85-4450-96d8-3d1fdbd462de,,,,,,,,,,,,NF1 cells culture,PMID:19282654,,"Tranilast, an anti-allergic drug, down-regulates the growth of cultured neurofibroma cells derived from neurofibromatosis type 1.",abstract,0.85,"...using a new cell culture system obtained from patients with neurofibromas. We called this culture system with the mixture of Schwann cells and fibroblasts ""NF1 cells culture""...",This is described as a 'new cell culture system' developed by the authors - a primary culture system from NF1 patients that should be captured as a cell line/culture system,,AI validation - Sonnet 4.5,0,0,,True
cbe22017-a370-4da1-b416-9ace1feffc83,,,,,,,,,,,,CD34+ peripheral blood mononuclear cells,PMID:19282654,,"Tranilast, an anti-allergic drug, down-regulates the growth of cultured neurofibroma cells derived from neurofibromatosis type 1.",abstract,0.8,"...Mast cells were differentiated from CD34(+) peripheral blood mononuclear cells of normal healthy subjects, and were co-cultured with NF1 cells...",CD34+ cells represent a specific cell population used for mast cell differentiation - this is a defined cell type used as starting material for experiments,,AI validation - Sonnet 4.5,0,0,,True
6baac72c-a13d-4fd8-b83d-c85610d54465,,,,,,,,,,,,human meningioma cells,PMID:19451225,,"NF2/merlin is a novel negative regulator of mTOR complex 1, and activation of mTORC1 is associated with meningioma and schwannoma growth.",abstract,0.85,"Merlin-deficient human meningioma cells and merlin knockdown arachnoidal cells, the nonneoplastic cell counterparts of meningiomas, exhibit rapamycin-sensitive constitutive mTORC1 activation",Cell line mentioned without specific naming convention - described as 'merlin-deficient human meningioma cells' rather than standard cell line nomenclature,,AI validation - Sonnet 4.5,0,0,,True
4b9422e2-053a-41c0-9e03-6aa5004ded48,,,,,,,,,,,,arachnoidal cells,PMID:19451225,,"NF2/merlin is a novel negative regulator of mTOR complex 1, and activation of mTORC1 is associated with meningioma and schwannoma growth.",abstract,0.8,"Merlin-deficient human meningioma cells and merlin knockdown arachnoidal cells, the nonneoplastic cell counterparts of meningiomas, exhibit rapamycin-sensitive constitutive mTORC1 activation",Cell type mentioned with genetic modification (merlin knockdown) indicating experimental cell line usage,,AI validation - Sonnet 4.5,0,0,,True
410be00b-28e8-4a0b-8e08-9232d303072e,,,,,,,,,,,,Nf2-deficient mouse embryonic fibroblasts,PMID:19451225,,"NF2/merlin is a novel negative regulator of mTOR complex 1, and activation of mTORC1 is associated with meningioma and schwannoma growth.",abstract,0.9,NF2 patient tumors and Nf2-deficient mouse embryonic fibroblasts demonstrate elevated mTORC1 signaling,Primary cell line derived from genetically modified mice - clear research tool but not caught by standard cell line patterns,,AI validation - Sonnet 4.5,0,0,,True
60e08ff4-b95b-49b1-b139-bf40da9093b4,,,,,,,,,,,,ST88-14,PMID:20049725,,Integrative genomic analyses of neurofibromatosis tumours identify SOX9 as a biomarker and survival gene.,methods,1.0,"We maintained MPNST cell lines ST88-14, STS26T, S520, S462, 88-3, 90-8 and YST1 as described previously",MPNST cell line names not recognized by mining patterns,,AI validation - Sonnet 4.5,0,0,,True
329c9fa0-c788-4671-9d3c-3a7274223271,,,,,,,,,,,,STS26T,PMID:20049725,,Integrative genomic analyses of neurofibromatosis tumours identify SOX9 as a biomarker and survival gene.,methods,1.0,"We maintained MPNST cell lines ST88-14, STS26T, S520, S462, 88-3, 90-8 and YST1 as described previously",MPNST cell line names not recognized by mining patterns,,AI validation - Sonnet 4.5,0,0,,True
d839b5c3-8750-4ffe-b358-c3afc900f1c3,,,,,,,,,,,,S520,PMID:20049725,,Integrative genomic analyses of neurofibromatosis tumours identify SOX9 as a biomarker and survival gene.,methods,1.0,"We maintained MPNST cell lines ST88-14, STS26T, S520, S462, 88-3, 90-8 and YST1 as described previously",MPNST cell line names not recognized by mining patterns,,AI validation - Sonnet 4.5,0,0,,True
4976e39c-6f6f-4364-97c6-e6a159b15572,,,,,,,,,,,,S462,PMID:20049725,,Integrative genomic analyses of neurofibromatosis tumours identify SOX9 as a biomarker and survival gene.,methods,1.0,"We maintained MPNST cell lines ST88-14, STS26T, S520, S462, 88-3, 90-8 and YST1 as described previously",MPNST cell line names not recognized by mining patterns,,AI validation - Sonnet 4.5,0,0,,True
2992dc31-30e5-465f-82fd-97e1a62a3ec6,,,,,,,,,,,,88-3,PMID:20049725,,Integrative genomic analyses of neurofibromatosis tumours identify SOX9 as a biomarker and survival gene.,methods,1.0,"We maintained MPNST cell lines ST88-14, STS26T, S520, S462, 88-3, 90-8 and YST1 as described previously",MPNST cell line names not recognized by mining patterns,,AI validation - Sonnet 4.5,0,0,,True
af603346-ef28-4b1d-bad2-df54d26a3ab2,,,,,,,,,,,,90-8,PMID:20049725,,Integrative genomic analyses of neurofibromatosis tumours identify SOX9 as a biomarker and survival gene.,methods,1.0,"We maintained MPNST cell lines ST88-14, STS26T, S520, S462, 88-3, 90-8 and YST1 as described previously",MPNST cell line names not recognized by mining patterns,,AI validation - Sonnet 4.5,0,0,,True
282dfb5c-cb4e-4dd6-a42c-0416de55040e,,,,,,,,,,,,YST1,PMID:20049725,,Integrative genomic analyses of neurofibromatosis tumours identify SOX9 as a biomarker and survival gene.,methods,1.0,"We maintained MPNST cell lines ST88-14, STS26T, S520, S462, 88-3, 90-8 and YST1 as described previously",MPNST cell line names not recognized by mining patterns,,AI validation - Sonnet 4.5,0,0,,True
544a191b-510e-48d4-9fe1-04ce122c1d2e,,,,,,,,,,,,human Schwann cell primary cultures,PMID:20195187,,Merlin knockdown in human Schwann cells: clues to vestibular schwannoma tumorigenesis.,methods,0.9,Merlin knockdown was performed using small interfering RNA transfection into human Schwann cell primary cultures.,Primary cell cultures are legitimate cell-based research tools but may not have been captured by standard cell line naming patterns,,AI validation - Sonnet 4.5,0,0,,True
c561829d-5a61-4f2f-811f-b5b7cc0f6457,,,,,,,,,,,,calvaria osteoblasts,PMID:20200958,,Local low-dose lovastatin delivery improves the bone-healing defect caused by Nf1 loss of function in osteoblasts.,methods,0.9,...Calvaria osteoblasts were extracted by multiple collagenase/trypsine digestion from 4-day-old Nf1 flox/flox pups...,Primary cell culture system not recognized as research tool,,AI validation - Sonnet 4.5,0,0,,True
a35aeae9-17e8-4034-9d2f-ee57c3b2caef,,,,,,,,,,,,MPNST cell lines,PMID:20739432,,Gene expression analysis identifies potential biomarkers of neurofibromatosis type 1 including adrenomedullin.,methods,0.85,"MPNST cell conditioned medium, containing ADM and hepatocyte growth factor",MPNST cells mentioned in functional context but specific cell line names not provided,,AI validation - Sonnet 4.5,0,0,,True
d93d1a1d-e591-450f-94a7-00cf7f633a93,,,,,,,,,,,,φNX packaging cell line,PMID:21072183,,p21-Activated kinases are required for transformation in a cell-based model of neurofibromatosis type 2.,methods,0.9,The φNX packaging cell line (Orbigen) was transfected using Lipofectamine 2000,Specialized packaging cell line with vendor - needs pattern for Greek letters and packaging cell terminology,,AI validation - Sonnet 4.5,0,0,,True
462f3254-78f8-4e2d-824a-986e50eb0506,,,,,,,,,,,,HEI-193,PMID:21111000,,A novel imaging-compatible sciatic nerve schwannoma model.,abstract,0.95,"...an immortalized human schwannoma cell line, HEI-193, established from an neurofibromatosis type 2 patient, has been stably transduced...",Cell line name not detected by mining patterns - may need pattern for immortalized cell line nomenclature,,AI validation - Sonnet 4.5,0,0,,True
7f7c0c85-414b-48f9-b533-1aced2e91d56,,,,,,,,,,,,Nf1-deficient glial cells,PMID:21216928,,Interpreting mammalian target of rapamycin and cell growth inhibition in a genetically engineered mouse model of Nf1-deficient astrocytes.,abstract,0.85,"...mechanism underlying this dose-dependent effect, we used Nf1-deficient glial cells in vitro and in vivo. First, there was...",Cell line/culture system mentioned but may not match standard cell line naming patterns,,AI validation - Sonnet 4.5,0,0,,True
92ffcd07-c57e-4776-9d74-a87113de0521,,,,,,,,,,,,ST88-14,PMID:21460792,,Orthotopic xenografting of human luciferase-tagged malignant peripheral nerve sheath tumor cells for in vivo testing of candidate therapeutic agents.,abstract,1.0,"...detailed orthotopic xenografting method presented here is one that we developed using ST88-14 MPNST cells, a line which is widely used in studies of these NF1-associated peripheral nerve sheath tumors...",Cell line name not captured by mining patterns - may need pattern for alphanumeric cell line nomenclature,,AI validation - Sonnet 4.5,0,0,,True
9c5ead53-4781-4cd1-bada-d7d2941cc45c,,,,,,,,,,,,T265-2c,PMID:21460792,,Orthotopic xenografting of human luciferase-tagged malignant peripheral nerve sheath tumor cells for in vivo testing of candidate therapeutic agents.,discussion,1.0,"...and T265-2c 11 cells, which are derived from a NF1-associated MPNST, with success similar to that we observed with ST88-14 cells...",Cell line name with complex alphanumeric pattern not captured,,AI validation - Sonnet 4.5,0,0,,True
e54512a2-30ac-432c-be3d-25096f33ae03,,,,,,,,,,,,NF1(+/+) MPNST cell lines,PMID:21697395,,Discovery of a small molecule targeting IRA2 deletion in budding yeast and neurofibromin loss in malignant peripheral nerve sheath tumor cells.,abstract,0.9,...we developed assays in NF1(+/+) and NF1(-/-) MPNST cell lines and in budding yeast...,Cell line naming pattern may not have been recognized - NF1(+/+) indicates wild-type neurofibromin expression,,AI validation - Sonnet 4.5,0,0,,True
d24cfee2-502b-48e5-ba83-9eab9a0cdf16,,,,,,,,,,,,NF1(-/-) MPNST cell lines,PMID:21697395,,Discovery of a small molecule targeting IRA2 deletion in budding yeast and neurofibromin loss in malignant peripheral nerve sheath tumor cells.,abstract,0.9,...we developed assays in NF1(+/+) and NF1(-/-) MPNST cell lines and in budding yeast...,Cell line naming pattern may not have been recognized - NF1(-/-) indicates neurofibromin knockout,,AI validation - Sonnet 4.5,0,0,,True
d364b1a7-a031-433e-b0eb-d80d4bf864be,,,,,,,,,,,,Skin-derived precursor cells (SKPs),PMID:22550514,,Skin-derived precursor cells as an in vitro modelling tool for the study of type 1 neurofibromatosis.,abstract,0.85,...it has been recently suggested that skin-derived precursor cells (SKPs) could be the cell of origin of dermal neurofibromas...,Primary focus of the paper - SKPs are described as both a research tool and biological entity,,AI validation - Sonnet 4.5,0,0,,True
