pmid,doi,publicationTitle,year,journal,novel_animal_models,novel_antibodies,novel_cell_lines,novel_genetic_reagents,novel_computational_tools,novel_advanced_cellular_models,novel_patient_derived_models,novel_clinical_assessment_tools,existing_tools,total_novel_tools,nf_specific_count,max_priority
PMID:35741605 | PMID:33934112 | PMID:33442015 | PMID:38136356,10.3390/brainsci12060720 | 10.1038/s41419-021-03716-6 | 10.1038/s41591-020-01193-6 | 10.3390/cancers15245811,Integrated Drug Mining Reveals Actionable Strategies Inhibiting Plexiform Neurofibromas. | HIF1α-dependent induction of the mitochondrial chaperone TRAP1 regulates bioenergetic adaptations to hypoxia. | Cabozantinib for neurofibromatosis type 1-related plexiform neurofibromas: a phase 2 trial. | Drug Responses in Plexiform Neurofibroma Type I (PNF1) Cell Lines Using High-Throughput Data and Combined Effectiveness and Potency.,,,,,ipNF95.6,,,,,,,1,1,High
PMID:35741605 | PMID:39129390 | PMID:38136356 | PMID:40723243,10.3390/brainsci12060720 | 10.1002/1878-0261.13704 | 10.3390/cancers15245811 | 10.3390/cancers17142359,Integrated Drug Mining Reveals Actionable Strategies Inhibiting Plexiform Neurofibromas. | Inhibition of autophagy as a novel treatment for neurofibromatosis type 1 tumors. | Drug Responses in Plexiform Neurofibroma Type I (PNF1) Cell Lines Using High-Throughput Data and Combined Effectiveness and Potency. | The Combination of HSP90 Inhibitors and Selumetinib Reinforces the Inhibitory Effects on Plexiform Neurofibromas.,,,,,ipnNF95.11c,,,,,,,1,1,High
PMID:35741605 | PMID:39129390 | PMID:40862755 | PMID:36689660 | PMID:39061138 | PMID:40723243,10.3390/brainsci12060720 | 10.1002/1878-0261.13704 | 10.3390/cells14161276 | 10.1073/pnas.2208960120 | 10.3390/cancers16142498 | 10.3390/cancers17142359,Integrated Drug Mining Reveals Actionable Strategies Inhibiting Plexiform Neurofibromas. | Inhibition of autophagy as a novel treatment for neurofibromatosis type 1 tumors. | Fibroblasts Attenuate Anti-Tumor Drug Efficacy in Tumor Cells via Paracrine Interactions with Tumor Cells in 3D Plexiform Neurofibroma Cultures. | Destabilizing NF1 variants act in a dominant negative manner through neurofibromin dimerization. | A Fibroblast-Derived Secretome Stimulates the Growth and Invasiveness of 3D Plexiform Neurofibroma Spheroids. | The Combination of HSP90 Inhibitors and Selumetinib Reinforces the Inhibitory Effects on Plexiform Neurofibromas.,,,,,ipNF95.11bC,,,,,,,1,1,High
PMID:35741605 | PMID:40723243,10.3390/brainsci12060720 | 10.3390/cancers17142359,Integrated Drug Mining Reveals Actionable Strategies Inhibiting Plexiform Neurofibromas. | The Combination of HSP90 Inhibitors and Selumetinib Reinforces the Inhibitory Effects on Plexiform Neurofibromas.,,,,,ipNF05.5 (single clone),,,,,,,1,1,High
PMID:36322658 | PMID:37164978 | PMID:24681606 | PMID:23685747 | PMID:30055648 | PMID:41001593 | PMID:38203448 | PMID:32948135 | PMID:23535903,10.1126/sciadv.abo5442 | 10.1038/s41467-023-38432-6 | 10.18632/oncotarget.1609 | 10.1038/ng.2641 | 10.1186/s13104-018-3630-0 | 10.1080/23723556.2025.2561292 | 10.3390/ijms25010277 | 10.1186/s12885-020-07397-w | 10.1158/2159-8290.CD-13-0081,"Single-cell multiomics identifies clinically relevant mesenchymal stem-like cells and key regulators for MPNST malignancy. | Multiplatform molecular profiling uncovers two subgroups of malignant peripheral nerve sheath tumors with distinct therapeutic vulnerabilities. | Co-targeting the MAPK and PI3K/AKT/mTOR pathways in two genetically engineered mouse models of schwann cell tumors reduces tumor grade and multiplicity. | Forward genetic screen for malignant peripheral nerve sheath tumor formation identifies new genes and pathways driving tumorigenesis. | Testing ATRA and MEK inhibitor PD0325901 effectiveness in a nude mouse model for human MPNST xenografts. | Loss of Schwann cell's normal rhythmic core clock gene expression and gain of rhythmic expression of oncogenic driver genes in malignant NF1-associated peripheral nerve sheath tumor. | FT895 Impairs Mitochondrial Function in Malignant Peripheral Nerve Sheath Tumor Cells. | Anti-cancer agent 3-bromopyruvate reduces growth of MPNST and inhibits metabolic pathways in a representative in-vitro model. | Canonical Wnt/β-catenin signaling drives human schwann cell transformation, progression, and tumor maintenance.",,,,,T265,,,,,,,1,1,High
PMID:36890585 | PMID:40684195 | PMID:19191334 | PMID:21439418 | PMID:34935315 | PMID:25772366 | PMID:29847659 | PMID:29787563 | PMID:28525381 | PMID:25535838 | PMID:20200958,10.1186/s40478-023-01525-w | 10.1186/s40478-025-02075-z | 10.1002/glia.20845 | 10.1016/j.bone.2011.03.760 | 10.1117/1.JBO.26.12.125001 | 10.1016/j.celrep.2015.02.041 | 10.1167/iovs.17-22588 | 10.1371/journal.pone.0190001 | 10.18632/oncotarget.17589 | 10.7554/eLife.05151 | 10.1002/jbmr.42,Neurofibromatosis type 1-dependent alterations in mouse microglia function are not cell-intrinsic. | Unraveling the development of cutaneous neurofibromas in neurofibromatosis type 1. | Microarray analyses reveal regional astrocyte heterogeneity with implications for neurofibromatosis type 1 (NF1)-regulated glial proliferation. | Primary osteopathy of vertebrae in a neurofibromatosis type 1 murine model. | Analysis of muscle tissue in vivo using fiber-optic autofluorescence and diffuse reflectance spectroscopy. | Mouse low-grade gliomas contain cancer stem cells with unique molecular and functional properties. | Neurofibromin Deficiency Induces Endothelial Cell Proliferation and Retinal Neovascularization. | Graph complexity analysis identifies an ETV5 tumor-specific network in human and murine low-grade glioma. | The cell of origin dictates the temporal course of neurofibromatosis-1 (Nf1) low-grade glioma formation. | Transient inhibition of the ERK pathway prevents cerebellar developmental defects and improves long-term motor functions in murine models of neurofibromatosis type 1. | Local low-dose lovastatin delivery improves the bone-healing defect caused by Nf1 loss of function in osteoblasts.,,,Nf1 flox/flox,,,,,,,,,1,1,High
PMID:37164978 | PMID:38136356,10.1038/s41467-023-38432-6 | 10.3390/cancers15245811,Multiplatform molecular profiling uncovers two subgroups of malignant peripheral nerve sheath tumors with distinct therapeutic vulnerabilities. | Drug Responses in Plexiform Neurofibroma Type I (PNF1) Cell Lines Using High-Throughput Data and Combined Effectiveness and Potency.,,,,,ipNF06.2A,,,,,,,1,1,High
PMID:37681415 | PMID:24375753,10.1172/jci.insight.168445 | 10.1002/ana.24093,Structural and functional analyses of a germline KRAS T50I mutation provide insights into Raf activation. | Sex Is a major determinant of neuronal dysfunction in neurofibromatosis type 1.,,,,p-ERK1/2,,,,,,,,1,1,High
PMID:38201517 | PMID:18367665 | PMID:18413802 | PMID:36689660,10.3390/cancers16010089 | 10.1124/jpet.107.135830 | 10.1158/1535-7163.MCT-07-0518 | 10.1073/pnas.2208960120,Synergistic Suppression of NF1 Malignant Peripheral Nerve Sheath Tumor Cell Growth in Culture and Orthotopic Xenografts by Combinational Treatment with Statin and Prodrug Farnesyltransferase Inhibitor PAMAM G4 Dendrimers. | Induction of apoptosis in neurofibromatosis type 1 malignant peripheral nerve sheath tumor cell lines by a combination of novel farnesyl transferase inhibitors and lovastatin. | Sorafenib inhibits growth and mitogen-activated protein kinase signaling in malignant peripheral nerve sheath cells. | Destabilizing NF1 variants act in a dominant negative manner through neurofibromin dimerization.,,,,RAS,,,,,,,,1,1,High
PMID:38201517 | PMID:37164978 | PMID:24681606 | PMID:23685747 | PMID:41036607 | PMID:38203448 | PMID:23535903,10.3390/cancers16010089 | 10.1038/s41467-023-38432-6 | 10.18632/oncotarget.1609 | 10.1038/ng.2641 | 10.1158/1535-7163.MCT-24-1053 | 10.3390/ijms25010277 | 10.1158/2159-8290.CD-13-0081,"Synergistic Suppression of NF1 Malignant Peripheral Nerve Sheath Tumor Cell Growth in Culture and Orthotopic Xenografts by Combinational Treatment with Statin and Prodrug Farnesyltransferase Inhibitor PAMAM G4 Dendrimers. | Multiplatform molecular profiling uncovers two subgroups of malignant peripheral nerve sheath tumors with distinct therapeutic vulnerabilities. | Co-targeting the MAPK and PI3K/AKT/mTOR pathways in two genetically engineered mouse models of schwann cell tumors reduces tumor grade and multiplicity. | Forward genetic screen for malignant peripheral nerve sheath tumor formation identifies new genes and pathways driving tumorigenesis. | Pharmacogenomic Synthetic Lethal Screens Reveal Hidden Vulnerabilities and New Therapeutic Approaches for Treatment of NF1-Associated Tumors. | FT895 Impairs Mitochondrial Function in Malignant Peripheral Nerve Sheath Tumor Cells. | Canonical Wnt/β-catenin signaling drives human schwann cell transformation, progression, and tumor maintenance.",,,,,S462TY,,,,,,,1,1,High
PMID:38201517 | PMID:41022755 | PMID:39269317 | PMID:18367665 | PMID:37246765 | PMID:33658640 | PMID:24824755 | PMID:39129390 | PMID:18413802 | PMID:24681606 | PMID:23685747 | PMID:20049725 | PMID:32642733 | PMID:18483311 | PMID:38127282 | PMID:38216572 | PMID:38203448 | PMID:23535903 | PMID:41036607 | PMID:33032988,10.3390/cancers16010089 | 10.1038/s41467-025-63619-4 | 10.1158/1078-0432.CCR-24-1750 | 10.1124/jpet.107.135830 | 10.1093/neuonc/noad097 | 10.1038/s41416-021-01270-8 | 10.1371/journal.pone.0096733 | 10.1002/1878-0261.13704 | 10.1158/1535-7163.MCT-07-0518 | 10.18632/oncotarget.1609 | 10.1038/ng.2641 | 10.1002/emmm.200900027 | 10.1093/noajnl/vdz061 | 10.1158/1535-7163.MCT-07-2335 | 10.1158/1078-0432.CCR-23-2548 | 10.1038/s41467-024-44755-9 | 10.3390/ijms25010277 | 10.1158/2159-8290.CD-13-0081 | 10.1158/1535-7163.MCT-24-1053 | 10.1158/0008-5472.CAN-20-1365,"Synergistic Suppression of NF1 Malignant Peripheral Nerve Sheath Tumor Cell Growth in Culture and Orthotopic Xenografts by Combinational Treatment with Statin and Prodrug Farnesyltransferase Inhibitor PAMAM G4 Dendrimers. | Development of an adeno-associated virus vector for gene replacement therapy of NF1-related tumors. | MEK Inhibitors Lead to PDGFR Pathway Upregulation and Sensitize Tumors to RAF Dimer Inhibitors in NF1-Deficient Malignant Peripheral Nerve Sheath Tumor. | Induction of apoptosis in neurofibromatosis type 1 malignant peripheral nerve sheath tumor cell lines by a combination of novel farnesyl transferase inhibitors and lovastatin. | Ex vivo to in vivo model of malignant peripheral nerve sheath tumors for precision oncology. | Exploring transcriptional regulators Ref-1 and STAT3 as therapeutic targets in malignant peripheral nerve sheath tumours. | BNIP3 regulates AT101 [(-)-gossypol] induced death in malignant peripheral nerve sheath tumor cells. | Inhibition of autophagy as a novel treatment for neurofibromatosis type 1 tumors. | Sorafenib inhibits growth and mitogen-activated protein kinase signaling in malignant peripheral nerve sheath cells. | Co-targeting the MAPK and PI3K/AKT/mTOR pathways in two genetically engineered mouse models of schwann cell tumors reduces tumor grade and multiplicity. | Forward genetic screen for malignant peripheral nerve sheath tumor formation identifies new genes and pathways driving tumorigenesis. | Integrative genomic analyses of neurofibromatosis tumours identify SOX9 as a biomarker and survival gene. | KIF11 and KIF15 mitotic kinesins are potential therapeutic vulnerabilities for malignant peripheral nerve sheath tumors. | Effective in vivo targeting of the mammalian target of rapamycin pathway in malignant peripheral nerve sheath tumors. | Spatial Gene-Expression Profiling Unveils Immuno-oncogenic Programs of NF1-Associated Peripheral Nerve Sheath Tumor Progression. | Functional interactions between neurofibromatosis tumor suppressors underlie Schwann cell tumor de-differentiation and treatment resistance. | FT895 Impairs Mitochondrial Function in Malignant Peripheral Nerve Sheath Tumor Cells. | Canonical Wnt/β-catenin signaling drives human schwann cell transformation, progression, and tumor maintenance. | Pharmacogenomic Synthetic Lethal Screens Reveal Hidden Vulnerabilities and New Therapeutic Approaches for Treatment of NF1-Associated Tumors. | Combined Inhibition of SHP2 and MEK Is Effective in Models of NF1-Deficient Malignant Peripheral Nerve Sheath Tumors.",,,,,ST88-14,,,,,,,1,1,High
PMID:38502231 | PMID:34010628,10.1172/JCI176748 | 10.1016/j.stem.2021.04.029,STING activation reprograms the microenvironment to sensitize NF1-related malignant peripheral nerve sheath tumors for immunotherapy. | Stem-like cells drive NF1-associated MPNST functional heterogeneity and tumor progression.,,,cisNP,,,,,,,,,1,1,High
PMID:38502231 | PMID:35393510,10.1172/JCI176748 | 10.1038/s41418-022-00991-4,STING activation reprograms the microenvironment to sensitize NF1-related malignant peripheral nerve sheath tumors for immunotherapy. | Tumor growth of neurofibromin-deficient cells is driven by decreased respiration and hampered by NAD,,,,,cis MPNST cell line,,,,,,,1,1,High
PMID:38811427,10.1186/s41687-024-00732-w,Quality of life in individuals with neurofibromatosis type 1 associated cutaneous neurofibromas: validation of the Dutch cNF-Skindex.,2024,Journal of patient-reported outcomes,,,,,,,,cNF-Skindex,,1,1,High
PMID:39129390 | PMID:40862755 | PMID:39061138 | PMID:33658640,10.1002/1878-0261.13704 | 10.3390/cells14161276 | 10.3390/cancers16142498 | 10.1038/s41416-021-01270-8,Inhibition of autophagy as a novel treatment for neurofibromatosis type 1 tumors. | Fibroblasts Attenuate Anti-Tumor Drug Efficacy in Tumor Cells via Paracrine Interactions with Tumor Cells in 3D Plexiform Neurofibroma Cultures. | A Fibroblast-Derived Secretome Stimulates the Growth and Invasiveness of 3D Plexiform Neurofibroma Spheroids. | Exploring transcriptional regulators Ref-1 and STAT3 as therapeutic targets in malignant peripheral nerve sheath tumours.,,,,,"ipNF05.5 (hTERT NF1 ipNF05.5, RRID: CVCL_UI71)",,,,,,,1,1,High
PMID:39269317 | PMID:23175151 | PMID:29438698 | PMID:40025578 | PMID:36322658 | PMID:35511749 | PMID:32642733 | PMID:38216572,10.1158/1078-0432.CCR-24-1750 | 10.1038/bjc.2012.518 | 10.1016/j.ccell.2018.01.005 | 10.1186/s40478-025-01965-6 | 10.1126/sciadv.abo5442 | 10.1158/1535-7163.MCT-21-0947 | 10.1093/noajnl/vdz061 | 10.1038/s41467-024-44755-9,MEK Inhibitors Lead to PDGFR Pathway Upregulation and Sensitize Tumors to RAF Dimer Inhibitors in NF1-Deficient Malignant Peripheral Nerve Sheath Tumor. | MicroRNA profiling of peripheral nerve sheath tumours identifies miR-29c as a tumour suppressor gene involved in tumour progression. | Programming of Schwann Cells by Lats1/2-TAZ/YAP Signaling Drives Malignant Peripheral Nerve Sheath Tumorigenesis. | Development of CAR-T cell therapy for NF1/SWN-related nerve sheath tumor treatment. | Single-cell multiomics identifies clinically relevant mesenchymal stem-like cells and key regulators for MPNST malignancy. | A High-Throughput Screening Platform Identifies Novel Combination Treatments for Malignant Peripheral Nerve Sheath Tumors. | KIF11 and KIF15 mitotic kinesins are potential therapeutic vulnerabilities for malignant peripheral nerve sheath tumors. | Functional interactions between neurofibromatosis tumor suppressors underlie Schwann cell tumor de-differentiation and treatment resistance.,,,,,SNF96.2,,,,,,,1,1,High
PMID:40394150 | PMID:32699356 | PMID:32948135 | PMID:32642734 | PMID:35589737 | PMID:19191334 | PMID:32461556 | PMID:29715273 | PMID:34040258 | PMID:35945463 | PMID:29941005 | PMID:29438698 | PMID:24681606 | PMID:30055648 | PMID:33032988 | PMID:26904939 | PMID:40684195 | PMID:32642733 | PMID:36148553 | PMID:33356508 | PMID:37246765 | PMID:24371224 | PMID:25535838 | PMID:33591953 | PMID:38945076 | PMID:34930951 | PMID:39996452 | PMID:21216928,10.1038/s41416-025-03055-9 | 10.1038/s41467-020-17382-3 | 10.1186/s12885-020-07397-w | 10.1093/noajnl/vdz026 | 10.1038/s41467-022-30466-6 | 10.1002/glia.20845 | 10.1038/s41467-020-16432-0 | 10.1371/journal.pone.0196726 | 10.1038/s41586-021-03580-6 | 10.1007/s00401-022-02478-5 | 10.1186/s13023-018-0843-1 | 10.1016/j.ccell.2018.01.005 | 10.18632/oncotarget.1609 | 10.1186/s13104-018-3630-0 | 10.1158/0008-5472.CAN-20-1365 | 10.1016/j.celrep.2016.01.074 | 10.1186/s40478-025-02075-z | 10.1093/noajnl/vdz061 | 10.1093/brain/awac342 | 10.1177/0963689720964383 | 10.1093/neuonc/noad097 | 10.1158/0008-5472.CAN-13-2062 | 10.7554/eLife.05151 | 10.1172/jci.insight.146351 | 10.1016/j.redox.2024.103249 | 10.1038/s41536-021-00195-3 | 10.1111/cns.70287 | 10.1158/1535-7163.MCT-10-0654,Mass spectrometric insights into the protein composition of human cutaneous neurofibromas: comparison of neurofibromas with the overlying skin. | Murine models of IDH-wild-type glioblastoma exhibit spatial segregation of tumor initiation and manifestation during evolution. | Anti-cancer agent 3-bromopyruvate reduces growth of MPNST and inhibits metabolic pathways in a representative in-vitro model. | Whole exome sequencing reveals the maintained polyclonal nature from primary to metastatic malignant peripheral nerve sheath tumor in two patients with NF1. | Neuronal hyperexcitability drives central and peripheral nervous system tumor progression in models of neurofibromatosis-1. | Microarray analyses reveal regional astrocyte heterogeneity with implications for neurofibromatosis type 1 (NF1)-regulated glial proliferation. | Assessing the origin of high-grade serous ovarian cancer using CRISPR-modification of mouse organoids. | Neurofibromatosis type 2 tumor suppressor protein is expressed in oligodendrocytes and regulates cell proliferation and process formation. | NF1 mutation drives neuronal activity-dependent initiation of optic glioma. | Multiplatform molecular analyses refine classification of gliomas arising in patients with neurofibromatosis type 1. | Increased extracellular matrix deposition during chondrogenic differentiation of dental pulp stem cells from individuals with neurofibromatosis type 1: an in vitro 2D and 3D study. | Programming of Schwann Cells by Lats1/2-TAZ/YAP Signaling Drives Malignant Peripheral Nerve Sheath Tumorigenesis. | Co-targeting the MAPK and PI3K/AKT/mTOR pathways in two genetically engineered mouse models of schwann cell tumors reduces tumor grade and multiplicity. | Testing ATRA and MEK inhibitor PD0325901 effectiveness in a nude mouse model for human MPNST xenografts. | Combined Inhibition of SHP2 and MEK Is Effective in Models of NF1-Deficient Malignant Peripheral Nerve Sheath Tumors. | Insertional Mutagenesis Identifies a STAT3/Arid1b/β-catenin Pathway Driving Neurofibroma Initiation. | Unraveling the development of cutaneous neurofibromas in neurofibromatosis type 1. | KIF11 and KIF15 mitotic kinesins are potential therapeutic vulnerabilities for malignant peripheral nerve sheath tumors. | Inhibition of YAP/TAZ-driven TEAD activity prevents growth of NF2-null schwannoma and meningioma. | C6 Cell Injection into the Optic Nerve of Long-Evans Rats: A Short-Term Model of Optic Pathway Gliomas. | Ex vivo to in vivo model of malignant peripheral nerve sheath tumors for precision oncology. | Tumor suppressor alterations cooperate to drive aggressive mesotheliomas with enriched cancer stem cells via a p53-miR-34a-c-Met axis. | Transient inhibition of the ERK pathway prevents cerebellar developmental defects and improves long-term motor functions in murine models of neurofibromatosis type 1. | Chromosome 8 gain is associated with high-grade transformation in MPNST. | Selective nitration of Hsp90 acts as a metabolic switch promoting tumor cell proliferation. | A bioinspired gelatin-hyaluronic acid-based hybrid interpenetrating network for the enhancement of retinal ganglion cells replacement therapy. | Cas9 Mouse Model of Skull Base Meningioma Driven by Combinational Gene Inactivation in Meningeal Cells. | Interpreting mammalian target of rapamycin and cell growth inhibition in a genetically engineered mouse model of Nf1-deficient astrocytes.,,,,Ki67,,,,,,,,1,1,High
PMID:40737523,10.2196/71728,Clinician Perspectives of a Magnetic Resonance Imaging-Based 3D Volumetric Analysis Tool for Neurofibromatosis Type 2-Related Schwannomatosis: Qualitative Pilot Study.,2025,JMIR human factors,,,,,,,,Likert scale questionnaire,,1,1,High
PMID:40887659,10.1186/s40246-025-00803-z,RENOVO-NF1 accurately predicts NF1 missense variant pathogenicity.,2025,Human genomics,,,,,RENOVO-NF1,,,,,1,1,High
PMID:41001593 | PMID:32948135,10.1080/23723556.2025.2561292 | 10.1186/s12885-020-07397-w,Loss of Schwann cell's normal rhythmic core clock gene expression and gain of rhythmic expression of oncogenic driver genes in malignant NF1-associated peripheral nerve sheath tumor. | Anti-cancer agent 3-bromopyruvate reduces growth of MPNST and inhibits metabolic pathways in a representative in-vitro model.,,,,,NSF1,,,,,,,1,1,High
PMID:41022755 | PMID:24932921 | PMID:33436083 | PMID:33934112 | PMID:29670214 | PMID:25043591 | PMID:20200958,10.1038/s41467-025-63619-4 | 10.1002/jbmr.2298 | 10.1186/s13072-020-00380-6 | 10.1038/s41419-021-03716-6 | 10.1038/s41598-018-24310-5 | 10.1002/jbmr.2316 | 10.1002/jbmr.42,Development of an adeno-associated virus vector for gene replacement therapy of NF1-related tumors. | Neurofibromin deficiency-associated transcriptional dysregulation suggests a novel therapy for tibial pseudoarthrosis in NF1. | Distinctive epigenomic alterations in NF1-deficient cutaneous and plexiform neurofibromas drive differential MKK/p38 signaling. | HIF1α-dependent induction of the mitochondrial chaperone TRAP1 regulates bioenergetic adaptations to hypoxia. | Restoring functional neurofibromin by protein transduction. | Combined MEK inhibition and BMP2 treatment promotes osteoblast differentiation and bone healing in Nf1Osx -/- mice. | Local low-dose lovastatin delivery improves the bone-healing defect caused by Nf1 loss of function in osteoblasts.,,,,phospho-ERK1/2,,,,,,,,1,1,High
PMID:41022755 | PMID:28166733 | PMID:38714355 | PMID:39472976 | PMID:41564118 | PMID:30479396 | PMID:39129390 | PMID:34257279 | PMID:34011935 | PMID:25535838,10.1038/s41467-025-63619-4 | 10.1186/s12864-017-3519-7 | 10.1158/1535-7163.MCT-23-0510 | 10.1186/s40478-024-01875-z | 10.1371/journal.pone.0340183 | 10.1038/s41467-018-07452-y | 10.1002/1878-0261.13704 | 10.1038/s41467-021-24505-x | 10.1038/s41419-021-03802-9 | 10.7554/eLife.05151,Development of an adeno-associated virus vector for gene replacement therapy of NF1-related tumors. | A machine learning classifier trained on cancer transcriptomes detects NF1 inactivation signal in glioblastoma. | MEK Inhibition Enhances the Antitumor Effect of Radiotherapy in NF1-Deficient Glioblastoma. | NF1 expression profiling in IDH-wildtype glioblastoma: genomic associations and survival outcomes. | Immortalization and characterization of Schwann cell lines derived from NF1-associated cutaneous neurofibromas. | NF1 heterozygosity fosters de novo tumorigenesis but impairs malignant transformation. | Inhibition of autophagy as a novel treatment for neurofibromatosis type 1 tumors. | Neurofibromin regulates metabolic rate via neuronal mechanisms in Drosophila. | Metalloproteinase 1 downregulation in neurofibromatosis 1: Therapeutic potential of antimalarial hydroxychloroquine and chloroquine. | Transient inhibition of the ERK pathway prevents cerebellar developmental defects and improves long-term motor functions in murine models of neurofibromatosis type 1.,,,,NF1,,,,,,,,1,1,High
