pmid,doi,publicationTitle,year,journal,novel_animal_models,novel_antibodies,novel_cell_lines,novel_genetic_reagents,novel_computational_tools,novel_advanced_cellular_models,novel_patient_derived_models,novel_clinical_assessment_tools,existing_tools,total_novel_tools,nf_specific_count,max_priority
PMID:41022755 | PMID:32383545 | PMID:33658640 | PMID:38502231 | PMID:23328114 | PMID:37164978 | PMID:24681606 | PMID:23685747 | PMID:30055648 | PMID:20049725 | PMID:32642733 | PMID:18483311 | PMID:38127282 | PMID:41001593 | PMID:32948135 | PMID:37410426 | PMID:23535903 | PMID:35511749,10.1038/s41467-025-63619-4 | 10.15252/embr.201949117 | 10.1038/s41416-021-01270-8 | 10.1172/JCI176748 | 10.18632/oncotarget.793 | 10.1038/s41467-023-38432-6 | 10.18632/oncotarget.1609 | 10.1038/ng.2641 | 10.1186/s13104-018-3630-0 | 10.1002/emmm.200900027 | 10.1093/noajnl/vdz061 | 10.1158/1535-7163.MCT-07-2335 | 10.1158/1078-0432.CCR-23-2548 | 10.1080/23723556.2025.2561292 | 10.1186/s12885-020-07397-w | 10.1158/1078-0432.CCR-23-0749 | 10.1158/2159-8290.CD-13-0081 | 10.1158/1535-7163.MCT-21-0947,"Development of an adeno-associated virus vector for gene replacement therapy of NF1-related tumors. | Hexokinase 2 displacement from mitochondria-associated membranes prompts Ca | Exploring transcriptional regulators Ref-1 and STAT3 as therapeutic targets in malignant peripheral nerve sheath tumours. | STING activation reprograms the microenvironment to sensitize NF1-related malignant peripheral nerve sheath tumors for immunotherapy. | Genomic imbalance of HMMR/RHAMM regulates the sensitivity and response of malignant peripheral nerve sheath tumour cells to aurora kinase inhibition. | Multiplatform molecular profiling uncovers two subgroups of malignant peripheral nerve sheath tumors with distinct therapeutic vulnerabilities. | Co-targeting the MAPK and PI3K/AKT/mTOR pathways in two genetically engineered mouse models of schwann cell tumors reduces tumor grade and multiplicity. | Forward genetic screen for malignant peripheral nerve sheath tumor formation identifies new genes and pathways driving tumorigenesis. | Testing ATRA and MEK inhibitor PD0325901 effectiveness in a nude mouse model for human MPNST xenografts. | Integrative genomic analyses of neurofibromatosis tumours identify SOX9 as a biomarker and survival gene. | KIF11 and KIF15 mitotic kinesins are potential therapeutic vulnerabilities for malignant peripheral nerve sheath tumors. | Effective in vivo targeting of the mammalian target of rapamycin pathway in malignant peripheral nerve sheath tumors. | Spatial Gene-Expression Profiling Unveils Immuno-oncogenic Programs of NF1-Associated Peripheral Nerve Sheath Tumor Progression. | Loss of Schwann cell's normal rhythmic core clock gene expression and gain of rhythmic expression of oncogenic driver genes in malignant NF1-associated peripheral nerve sheath tumor. | Anti-cancer agent 3-bromopyruvate reduces growth of MPNST and inhibits metabolic pathways in a representative in-vitro model. | CDK4/6-MEK Inhibition in MPNSTs Causes Plasma Cell Infiltration, Sensitization to PD-L1 Blockade, and Tumor Regression. | Canonical Wnt/β-catenin signaling drives human schwann cell transformation, progression, and tumor maintenance. | A High-Throughput Screening Platform Identifies Novel Combination Treatments for Malignant Peripheral Nerve Sheath Tumors.",,,,,S462,,,,,,,1,1,High
PMID:41022755 | PMID:38175707 | PMID:41444363 | PMID:38216572 | PMID:37246765 | PMID:39110684 | PMID:34646065,10.1038/s41467-025-63619-4 | 10.1172/jci.insight.168826 | 10.1038/s41598-025-32031-9 | 10.1038/s41467-024-44755-9 | 10.1093/neuonc/noad097 | 10.1371/journal.pone.0308207 | 10.1155/2021/9386823,Development of an adeno-associated virus vector for gene replacement therapy of NF1-related tumors. | Unbalancing cAMP and Ras/MAPK pathways as a therapeutic strategy for cutaneous neurofibromas. | Focused ultrasound-mediated drug delivery of bevacizumab in treating NF2-related schwannomatosis in an animal model. | Functional interactions between neurofibromatosis tumor suppressors underlie Schwann cell tumor de-differentiation and treatment resistance. | Ex vivo to in vivo model of malignant peripheral nerve sheath tumors for precision oncology. | Electrical stimulation of Schwann cells on electrospun hyaluronic acid carbon nanotube fibers. | Survival and,,,,S100B,,,,,,,,1,1,High
PMID:41022755 | PMID:38714355,10.1038/s41467-025-63619-4 | 10.1158/1535-7163.MCT-23-0510,Development of an adeno-associated virus vector for gene replacement therapy of NF1-related tumors. | MEK Inhibition Enhances the Antitumor Effect of Radiotherapy in NF1-Deficient Glioblastoma.,,,,,LN229,,,,,,,1,1,High
PMID:41022755 | PMID:40590220 | PMID:21072183 | PMID:29670214 | PMID:37681415 | PMID:25043591 | PMID:20200958 | PMID:24375753,10.1038/s41467-025-63619-4 | 10.1172/JCI188932 | 10.1371/journal.pone.0013791 | 10.1038/s41598-018-24310-5 | 10.1172/jci.insight.168445 | 10.1002/jbmr.2316 | 10.1002/jbmr.42 | 10.1002/ana.24093,Development of an adeno-associated virus vector for gene replacement therapy of NF1-related tumors. | A haploinsufficiency restoration strategy corrects neurobehavioral deficits in Nf1+/- mice. | p21-Activated kinases are required for transformation in a cell-based model of neurofibromatosis type 2. | Restoring functional neurofibromin by protein transduction. | Structural and functional analyses of a germline KRAS T50I mutation provide insights into Raf activation. | Combined MEK inhibition and BMP2 treatment promotes osteoblast differentiation and bone healing in Nf1Osx -/- mice. | Local low-dose lovastatin delivery improves the bone-healing defect caused by Nf1 loss of function in osteoblasts. | Sex Is a major determinant of neuronal dysfunction in neurofibromatosis type 1.,,,,ERK1/2,,,,,,,,1,1,High
PMID:41444363,10.1038/s41598-025-32031-9,Focused ultrasound-mediated drug delivery of bevacizumab in treating NF2-related schwannomatosis in an animal model.,2025,Scientific reports,Postn-Cre; Nf2flox/flox,,,,,,,,,1,1,High
PMID:41444363 | PMID:24817309,10.1038/s41598-025-32031-9 | 10.1371/journal.pone.0097320,Focused ultrasound-mediated drug delivery of bevacizumab in treating NF2-related schwannomatosis in an animal model. | Nf2/Merlin controls spinal cord neural progenitor function in a Rac1/ErbB2-dependent manner.,,,Nf2flox/flox,,,,,,,,,1,1,High
PMID:33078583,10.1002/jcsm.12632,Cell autonomous requirement of neurofibromin (Nf1) for postnatal muscle hypertrophic growth and metabolic homeostasis.,2020,"Journal of cachexia, sarcopenia and muscle",,collagen IV; MyHC type 1; MyHC type 2A; laminin; Pax7; myosin heavy chain; beta III tubulin; perilipin A/B; PPARG; phosphor (pThr172) AMPKa; AMPKα; phosphor (s235/236) S6; MyHC type 2B; phosphor (Ser473) AKT; phospho (Ser1101) IRS-1; phospho (Ser636/639) IRS-1; DIG-Fab,,,,,,,,17,1,Medium
PMID:40025578,10.1186/s40478-025-01965-6,Development of CAR-T cell therapy for NF1/SWN-related nerve sheath tumor treatment.,2025,Acta neuropathologica communications,,HER1; HER2; VEGFR2; B7H3; CD171; EGFRvIII; TGFβ1; CD8a; CD45RO; CCR7,HFFs; NCI-H266,anti-HER1 CAR 806; anti-HER1 CAR E2; anti-HER1 CAR NEC,,,,,,15,5,Medium
PMID:21072183,10.1371/journal.pone.0013791,p21-Activated kinases are required for transformation in a cell-based model of neurofibromatosis type 2.,2010,PloS one,,Pak2; phospho-MEK1 (Ser298); phospho-Erk1/2 (Thr202/Tyr204); phospho-Akt (Thr308); phospho-Pak1–3 (Ser141),NIH-3T3; φNX packaging cell line,GST-PID; Gst-PID L107F,,,,,,9,3,Medium
PMID:38907342,10.1186/s40478-024-01821-z,"snRNA-seq of human cutaneous neurofibromas before and after selumetinib treatment implicates role of altered Schwann cell states, inter-cellular signaling, and extracellular matrix in treatment response.",2024,Acta neuropathologica communications,,Nuclear Pore Complex Proteins,,KCNMA1; PRKCE; OPCML; GRIK2; CADM2; CREB5; CAMK1D; ITGB8,,,,,,9,0,Medium
PMID:18413802,10.1158/1535-7163.MCT-07-0518,Sorafenib inhibits growth and mitogen-activated protein kinase signaling in malignant peripheral nerve sheath cells.,2008,Molecular cancer therapeutics,,MPM-2; B-Raf; phospho-Rb,LS141; DDLS,Ras Binding Domain; B-Raf; C-Raf,,,,,,8,0,Medium
PMID:19191334,10.1002/glia.20845,Microarray analyses reveal regional astrocyte heterogeneity with implications for neurofibromatosis type 1 (NF1)-regulated glial proliferation.,2009,Glia,,AQP4; LHX2; FOXG1; FOXP2; HOXB3; GLAST; NF1GRP-D,,,,,,,,7,1,Medium
PMID:20551058,10.1158/0008-5472.CAN-09-3769,Cyclic AMP suppression is sufficient to induce gliomagenesis in a mouse model of neurofibromatosis-1.,2010,Cancer research,,PDE4A; LCA; phosphorylated protein kinase A substrate,Daoy,PDE4A1; PDE4A1-H229Q; firefly luciferase-eGFP fusion,,,,,,7,0,Medium
PMID:36241865,10.1038/s12276-022-00850-9,Transplanting neurofibromatosis-1 gene knockout neural stem cells improve functional recovery in rats with spinal cord injury by enhancing the mTORC2 pathway.,2022,Experimental & molecular medicine,,NF-200; P-mTOR; Rictor; myelin basic protein,Neural stem cells,Rictor; TUNEL,,,,,,7,2,Medium
PMID:36598417,10.1158/2159-8290.CD-22-0786,Genomic Patterns of Malignant Peripheral Nerve Sheath Tumor (MPNST) Evolution Correlate with Clinical Outcome and Are Detectable in Cell-Free DNA.,2023,Cancer discovery,,MYF-4; HMB45; Melan-A,,truXTRAC FFPE DNA; Kapa HyperPlus; HumanMethylationEPIC; EZ DNA methylation Gold,,,,,,7,0,Medium
PMID:19144871,10.3181/0809-RM-275,Identification of erythrocyte p55/MPP1 as a binding partner of NF2 tumor suppressor protein/Merlin.,2009,"Experimental biology and medicine (Maywood, N.J.)",,p55/MPP1; NF-H; Caspr,DH5α bacteria,MBP fusion; His-p55,,,,,,6,0,Medium
PMID:23685747,10.1038/ng.2641,Forward genetic screen for malignant peripheral nerve sheath tumor formation identifies new genes and pathways driving tumorigenesis.,2013,Nature genetics,,FOXR2,,SB11; T2/Onc15; EGFR; FOXR2; HPRT,,,,,,6,0,Medium
PMID:28126595,10.1016/j.ebiom.2017.01.020,Global Proteome and Phospho-proteome Analysis of Merlin-deficient Meningioma and Schwannoma Identifies PDLIM2 as a Novel Therapeutic Target.,2017,EBioMedicine,,phospho-Merlin; HDAC1; PDLIM2,Human meningeal cells (HMC),PDLIM2 shRNA; λ-phosphatase,,,,,,6,1,Medium
PMID:32642733,10.1093/noajnl/vdz061,KIF11 and KIF15 mitotic kinesins are potential therapeutic vulnerabilities for malignant peripheral nerve sheath tumors.,2020,Neuro-oncology advances,,KIF11; KIF15,CCD-1112Sk,KIF15/KIF23 siRNA; RGS2; ispinesib,,,,,,6,0,Medium
PMID:31462295,10.1186/s40478-019-0792-5,Telomere alterations in neurofibromatosis type 1-associated solid tumors.,2019,Acta neuropathologica communications,,Cy3/Cy5; DAXX,,telomere repeat sequence probe; centromeric DNA repeats probe; 644 cancer gene panel,,,,,,5,0,Medium
PMID:41149489,10.3390/curroncol32100569,Small Extracellular Vesicles Derived from NF2-Associated Schwannoma Cells Modulate Tumor Progression and Immunity via HSP90.,2025,"Current oncology (Toronto, Ont.)",,HLA-DR; CD33; CD9; CD81; TOMM20,,,,,,,,5,2,Medium
PMID:32948135,10.1186/s12885-020-07397-w,Anti-cancer agent 3-bromopyruvate reduces growth of MPNST and inhibits metabolic pathways in a representative in-vitro model.,2020,BMC cancer,,p21; bcl6,B8 fibroblasts,PSME3,,,,,,4,0,Medium
PMID:33591953,10.1172/jci.insight.146351,Chromosome 8 gain is associated with high-grade transformation in MPNST.,2021,JCI insight,,COL4A; histone H3 (tri methyl K27),,CEP 8 (D8Z2); LSI MYC,,,,,,4,0,Medium
PMID:39321200,10.1158/1078-0432.CCR-24-1454,Multidimensional Immunotyping of Human NF1-Associated Peripheral Nerve Sheath Tumors Uncovers Tumor-Associated Macrophages as Key Drivers of Immune Evasion in the Tumor Microenvironment.,2024,Clinical cancer research : an official journal of the American Association for Cancer Research,,CD11c; CD19; CD163; CSF1R,,,,,,,,4,2,Medium
PMID:40225167,10.1155/2023/9628049,Functional Assays Combined with Pre-mRNA-Splicing Analysis Improve Variant Classification and Diagnostics for Individuals with Neurofibromatosis Type 1 and Legius Syndrome.,2023,Human mutation,,,COS-7,H-RAS; SPRED1; RAF-RBD,,,,,,4,0,Medium
PMID:21963652,10.1016/j.expneurol.2011.09.005,PET imaging for attention deficit preclinical drug testing in neurofibromatosis-1 mice.,2011,Experimental neurology,,p-MAPK; total MAPK,,WC-10,,,,,,3,2,Medium
PMID:28392281,10.1016/j.expneurol.2017.04.001,Human stem cell modeling in neurofibromatosis type 1 (NF1).,2018,Experimental neurology,,,tail-tip fibroblasts (TTFs),"reprogramming factors; OCT4, SOX2, MYC, KLF4, NANOG, LIN28",,,,,,3,0,Medium
PMID:30531922,10.1038/s41591-018-0263-8,The molecular landscape of glioma in patients with Neurofibromatosis 1.,2019,Nature medicine,,GZMB,U2OS,Human All Exon capture probes,,,,,,3,0,Medium
PMID:33273014 | PMID:26219339,10.1074/jbc.RA120.014960 | 10.18632/oncotarget.4858,mTOR kinase inhibition disrupts neuregulin 1-ERBB3 autocrine signaling and sensitizes NF2-deficient meningioma cellular models to IGF1R inhibition. | A high-throughput kinome screen reveals serum/glucocorticoid-regulated kinase 1 as a therapeutic target for NF2-deficient meningiomas.,,,,p70S6K; S6; NDRG1,,,,,,,,3,1,Medium
PMID:33442015,10.1038/s41591-020-01193-6,Cabozantinib for neurofibromatosis type 1-related plexiform neurofibromas: a phase 2 trial.,2021,Nature medicine,,AXL; pAXL; pMEK1/2,,,,,,,,3,3,Medium
PMID:40217315,10.1186/s13073-025-01462-4,A single-cell atlas of Schwannoma across genetic backgrounds and anatomic locations.,2025,Genome medicine,,CD44; HLA Class I ABC; MHC Class II,,,,,,,,3,1,Medium
PMID:41001593,10.1080/23723556.2025.2561292,Loss of Schwann cell's normal rhythmic core clock gene expression and gain of rhythmic expression of oncogenic driver genes in malignant NF1-associated peripheral nerve sheath tumor.,2025,Molecular & cellular oncology,,,BRGN; primary human Schwann cells (HSC),Custom gene panel,,,,,,3,0,Medium
PMID:12057013,10.1186/1471-2164-3-13,Complex splicing pattern generates great diversity in human NF1 transcripts.,2002,BMC genomics,,,TOP-10F' cells,pCR2.1-TOPO,,,,,,2,0,Medium
PMID:18367665,10.1124/jpet.107.135830,Induction of apoptosis in neurofibromatosis type 1 malignant peripheral nerve sheath tumor cell lines by a combination of novel farnesyl transferase inhibitors and lovastatin.,2008,The Journal of pharmacology and experimental therapeutics,,Phospho-Rb Ser 780,Primary normal rat Schwann cells,,,,,,,2,1,Medium
PMID:21949590,10.2478/v10134-010-0025-8,ALTERED CALCIUM CURRENTS AND AXONAL GROWTH IN Nf1 HAPLOINSUFFICIENT MICE.,2010,Translational neuroscience,,tau 1,,Lipofectamine,,,,,,2,0,Medium
PMID:24932921,10.1002/jbmr.2298,Neurofibromin deficiency-associated transcriptional dysregulation suggests a novel therapy for tibial pseudoarthrosis in NF1.,2014,Journal of bone and mineral research : the official journal of the American Society for Bone and Mineral Research,,,,Human Exome; pcDNA3.1,,,,,,2,0,Medium
PMID:25003081,10.3389/fonc.2014.00147,An integrative analysis of meningioma tumors reveals the determinant genes and pathways of malignant transformation.,2014,Frontiers in oncology,,,,Human Mapping 100K Set; GeneChip Human Genome U133 Plus 2.0 Arrays,,,,,,2,0,Medium
PMID:25549701,,Exome sequencing on malignant meningiomas identified mutations in neurofibromatosis type 2 (NF2) and meningioma 1 (MN1) genes.,2014,Discovery medicine,,,,Human All Exon; targeted region arrays,,,,,,2,0,Medium
PMID:28256556,10.1038/srep43315,An inflammatory gene signature distinguishes neurofibroma Schwann cells and macrophages from cells in the normal peripheral nervous system.,2017,Scientific reports,,CSF1,,interferon alpha-2b,,,,,,2,0,Medium
PMID:28831766,10.1007/s12104-017-9768-1,NMR resonance assignments of the EVH1 domain of neurofibromin's recruitment factor Spred1.,2017,Biomolecular NMR assignments,,,BL21(DE3) Star,Spred1(EVH1),,,,,,2,0,Medium
PMID:29438698,10.1016/j.ccell.2018.01.005,Programming of Schwann Cells by Lats1/2-TAZ/YAP Signaling Drives Malignant Peripheral Nerve Sheath Tumorigenesis.,2018,Cancer cell,,TAZ/YAP; TEAD1,,,,,,,,2,2,Medium
PMID:29438698 | PMID:36148553,10.1016/j.ccell.2018.01.005 | 10.1093/brain/awac342,Programming of Schwann Cells by Lats1/2-TAZ/YAP Signaling Drives Malignant Peripheral Nerve Sheath Tumorigenesis. | Inhibition of YAP/TAZ-driven TEAD activity prevents growth of NF2-null schwannoma and meningioma.,,,,TAZ; YAP,,,,,,,,2,2,Medium
PMID:33025139,10.1007/s00401-020-02230-x,"Epigenomic, genomic, and transcriptomic landscape of schwannomatosis.",2021,Acta neuropathologica,,,,Microsatellite markers; MLPA probe set,,,,,,2,0,Medium
PMID:34782607,10.1038/s41525-021-00258-w,Pathogenic neurofibromatosis type 1 (NF1) RNA splicing resolved by targeted RNAseq.,2021,NPJ genomic medicine,,,,PHA; IL-2,,,,,,2,0,Medium
PMID:36322658 | PMID:36148553,10.1126/sciadv.abo5442 | 10.1093/brain/awac342,Single-cell multiomics identifies clinically relevant mesenchymal stem-like cells and key regulators for MPNST malignancy. | Inhibition of YAP/TAZ-driven TEAD activity prevents growth of NF2-null schwannoma and meningioma.,,,,ALDH1A1,,ALDH1A1,,,,,,2,0,Medium
PMID:39996452,10.1111/cns.70287,Cas9 Mouse Model of Skull Base Meningioma Driven by Combinational Gene Inactivation in Meningeal Cells.,2025,CNS neuroscience & therapeutics,,EMA,,Cre and gRNAs,,,,,,2,0,Medium
PMID:40862755,10.3390/cells14161276,Fibroblasts Attenuate Anti-Tumor Drug Efficacy in Tumor Cells via Paracrine Interactions with Tumor Cells in 3D Plexiform Neurofibroma Cultures.,2025,Cells,,P-glycoprotein,,,,TAME chips,,,,2,0,Medium
PMID:18451155 | PMID:36322658 | PMID:40684195 | PMID:23328114 | PMID:36241865,10.1158/0008-5472.CAN-07-6867 | 10.1126/sciadv.abo5442 | 10.1186/s40478-025-02075-z | 10.18632/oncotarget.793 | 10.1038/s12276-022-00850-9,Pten haploinsufficiency accelerates formation of high-grade astrocytomas. | Single-cell multiomics identifies clinically relevant mesenchymal stem-like cells and key regulators for MPNST malignancy. | Unraveling the development of cutaneous neurofibromas in neurofibromatosis type 1. | Genomic imbalance of HMMR/RHAMM regulates the sensitivity and response of malignant peripheral nerve sheath tumour cells to aurora kinase inhibition. | Transplanting neurofibromatosis-1 gene knockout neural stem cells improve functional recovery in rats with spinal cord injury by enhancing the mTORC2 pathway.,,,,nestin,,,,,,,,1,1,Medium
PMID:18636037,10.1097/MAO.0b013e31817f7398,The ErbB inhibitors trastuzumab and erlotinib inhibit growth of vestibular schwannoma xenografts in nude mice: a preliminary study.,2008,"Otology & neurotology : official publication of the American Otological Society, American Neurotology Society [and] European Academy of Otology and Neurotology",,,,,,,vestibular schwannoma xenografts,,,1,0,Medium
PMID:18670322,10.1097/MLG.0b013e318177e20b,Vestibular schwannoma quantitative polymerase chain reaction expression of estrogen and progesterone receptors.,2008,The Laryngoscope,,,,oligo-dT,,,,,,1,0,Medium
PMID:18670322 | PMID:21726432,10.1097/MLG.0b013e318177e20b | 10.1186/1741-7015-9-82,Vestibular schwannoma quantitative polymerase chain reaction expression of estrogen and progesterone receptors. | MIA is a potential biomarker for tumour load in neurofibromatosis type 1.,,,,,,PCR master mix,,,,,,1,0,Medium
PMID:20195187 | PMID:28166733 | PMID:25043298,10.1097/MAO.0b013e3181d2777f | 10.1186/s12864-017-3519-7 | 10.1038/onc.2014.185,Merlin knockdown in human Schwann cells: clues to vestibular schwannoma tumorigenesis. | A machine learning classifier trained on cancer transcriptomes detects NF1 inactivation signal in glioblastoma. | Oncogenic role of Merlin/NF2 in glioblastoma.,,,,EGFR,,,,,,,,1,1,Medium
PMID:20195187 | PMID:33032988,10.1097/MAO.0b013e3181d2777f | 10.1158/0008-5472.CAN-20-1365,Merlin knockdown in human Schwann cells: clues to vestibular schwannoma tumorigenesis. | Combined Inhibition of SHP2 and MEK Is Effective in Models of NF1-Deficient Malignant Peripheral Nerve Sheath Tumors.,,,,,,non-targeting control,,,,,,1,0,Medium
PMID:20200958 | PMID:21949590,10.1002/jbmr.42 | 10.2478/v10134-010-0025-8,Local low-dose lovastatin delivery improves the bone-healing defect caused by Nf1 loss of function in osteoblasts. | ALTERED CALCIUM CURRENTS AND AXONAL GROWTH IN Nf1 HAPLOINSUFFICIENT MICE.,,,,,,eGFP,,,,,,1,0,Medium
PMID:21072183 | PMID:34011935,10.1371/journal.pone.0013791 | 10.1038/s41419-021-03802-9,p21-Activated kinases are required for transformation in a cell-based model of neurofibromatosis type 2. | Metalloproteinase 1 downregulation in neurofibromatosis 1: Therapeutic potential of antimalarial hydroxychloroquine and chloroquine.,,,,Mek1/2,,,,,,,,1,1,Medium
PMID:21111000,10.1016/j.jneumeth.2010.10.021,A novel imaging-compatible sciatic nerve schwannoma model.,2011,Journal of neuroscience methods,,,,Fluc and mCherry,,,,,,1,0,Medium
PMID:24040940 | PMID:25851896 | PMID:30479396 | PMID:24681606 | PMID:40025578 | PMID:30055648 | PMID:18636037 | PMID:38744290 | PMID:36148553 | PMID:33356508 | PMID:41001593 | PMID:33591953 | PMID:36598417 | PMID:21111000 | PMID:33767727 | PMID:15255999 | PMID:15240917 | PMID:19144871,10.1186/1479-5876-11-213 | 10.3988/jcn.2015.11.2.172 | 10.1038/s41467-018-07452-y | 10.18632/oncotarget.1609 | 10.1186/s40478-025-01965-6 | 10.1186/s13104-018-3630-0 | 10.1097/MAO.0b013e31817f7398 | 10.1016/j.crmeth.2024.100772 | 10.1093/brain/awac342 | 10.1177/0963689720964383 | 10.1080/23723556.2025.2561292 | 10.1172/jci.insight.146351 | 10.1158/2159-8290.CD-22-0786 | 10.1016/j.jneumeth.2010.10.021 | 10.3389/fgene.2021.603195 | 10.1186/1476-4598-3-20 | 10.1155/S1110724304308107 | 10.3181/0809-RM-275,"Molecular-guided therapy predictions reveal drug resistance phenotypes and treatment alternatives in malignant peripheral nerve sheath tumors. | Preclinical assessment of the anticancer drug response of plexiform neurofibroma tissue using primary cultures. | NF1 heterozygosity fosters de novo tumorigenesis but impairs malignant transformation. | Co-targeting the MAPK and PI3K/AKT/mTOR pathways in two genetically engineered mouse models of schwann cell tumors reduces tumor grade and multiplicity. | Development of CAR-T cell therapy for NF1/SWN-related nerve sheath tumor treatment. | Testing ATRA and MEK inhibitor PD0325901 effectiveness in a nude mouse model for human MPNST xenografts. | The ErbB inhibitors trastuzumab and erlotinib inhibit growth of vestibular schwannoma xenografts in nude mice: a preliminary study. | A platform for rapid patient-derived cutaneous neurofibroma organoid establishment and screening. | Inhibition of YAP/TAZ-driven TEAD activity prevents growth of NF2-null schwannoma and meningioma. | C6 Cell Injection into the Optic Nerve of Long-Evans Rats: A Short-Term Model of Optic Pathway Gliomas. | Loss of Schwann cell's normal rhythmic core clock gene expression and gain of rhythmic expression of oncogenic driver genes in malignant NF1-associated peripheral nerve sheath tumor. | Chromosome 8 gain is associated with high-grade transformation in MPNST. | Genomic Patterns of Malignant Peripheral Nerve Sheath Tumor (MPNST) Evolution Correlate with Clinical Outcome and Are Detectable in Cell-Free DNA. | A novel imaging-compatible sciatic nerve schwannoma model. | Molecular Diagnosis of Neurofibromatosis by Multigene Panel Testing. | Molecular profiling of malignant peripheral nerve sheath tumors associated with neurofibromatosis type 1, based on large-scale real-time RT-PCR. | Survival of Human Neurofibroma in Immunodeficient Mice and Initial Results of Therapy With Pirfenidone. | Identification of erythrocyte p55/MPP1 as a binding partner of NF2 tumor suppressor protein/Merlin.",,,,S100,,,,,,,,1,1,Medium
PMID:24509877 | PMID:21551250 | PMID:34040258 | PMID:40025578 | PMID:26904939 | PMID:40684195 | PMID:20049725,10.1038/onc.2013.506 | 10.1158/0008-5472.CAN-10-4577 | 10.1038/s41586-021-03580-6 | 10.1186/s40478-025-01965-6 | 10.1016/j.celrep.2016.01.074 | 10.1186/s40478-025-02075-z | 10.1002/emmm.200900027,MAF mediates crosstalk between Ras-MAPK and mTOR signaling in NF1. | Susceptible stages in Schwann cells for NF1-associated plexiform neurofibroma development. | NF1 mutation drives neuronal activity-dependent initiation of optic glioma. | Development of CAR-T cell therapy for NF1/SWN-related nerve sheath tumor treatment. | Insertional Mutagenesis Identifies a STAT3/Arid1b/β-catenin Pathway Driving Neurofibroma Initiation. | Unraveling the development of cutaneous neurofibromas in neurofibromatosis type 1. | Integrative genomic analyses of neurofibromatosis tumours identify SOX9 as a biomarker and survival gene.,,,,S100β,,,,,,,,1,1,Medium
PMID:26219339 | PMID:18483311,10.18632/oncotarget.4858 | 10.1158/1535-7163.MCT-07-2335,A high-throughput kinome screen reveals serum/glucocorticoid-regulated kinase 1 as a therapeutic target for NF2-deficient meningiomas. | Effective in vivo targeting of the mammalian target of rapamycin pathway in malignant peripheral nerve sheath tumors.,,,,phospho-Akt (S473),,,,,,,,1,1,Medium
PMID:26883872,10.1016/j.jprot.2016.02.004,3-D imaging mass spectrometry of protein distributions in mouse Neurofibromatosis 1 (NF1)-associated optic glioma.,2016,Journal of proteomics,,S100A10,,,,,,,,1,1,Medium
PMID:27458360,10.3389/fnhum.2016.00334,COMT Val(158)Met Polymorphism Is Associated with Verbal Working Memory in Neurofibromatosis Type 1.,2016,Frontiers in human neuroscience,,,,COMT val158met probe,,,,,,1,0,Medium
PMID:28051113 | PMID:36420221,10.1038/srep39348 | 10.1016/j.omtn.2022.10.026,"A comprehensive custom panel design for routine hereditary cancer testing: preserving control, improving diagnostics and revealing a complex variation landscape. | Antisense oligonucleotides targeting exon 11 are able to partially rescue the NF2-related schwannomatosis phenotype",,,,,,I2HCP panel,,,,,,1,0,Medium
