geneticReagentId,insertName,vectorType,vectorBackbone,promoter,insertSpecies,insertEntrezId,selectableMarker,copyNumber,gRNAshRNASequence,bacterialResistance,hazardous,nTerminalTag,cTerminalTag,totalSize,backboneSize,insertSize,growthStrain,growthTemp,cloningMethod,5primer,3primer,5primeCloningSite,3primeCloningSite,5primeSiteDestroyed,3primeSiteDestroyed,_resourceName,_pmid,_doi,_publicationTitle,_year,_context,_confidence,_verdict,_usageType
31f7668c-a012-593c-8da4-f3cd33132a7f,shNF1,Viral,,,Human,,,,,,,,,,,,,,,,,,,,,shNF1,PMID:35589737,10.1038/s41467-022-30466-6,Neuronal hyperexcitability drives central and peripheral nervous system tumor progression in models of neurofibromatosis-1.,,"were infected with sh NF1 1–3 lentiviral particles (Sigma; 39714, 39715, 39717)",0.95,Accept,Experimental Usage
bca1003e-cc07-5aef-bafa-63c5c19414f9,NF1 gRNA,Other,,,,,,,,,,,,,,,,,,,,,,,,NF1 gRNA,PMID:38216123,10.1016/j.molmet.2024.101876,NF1 deficiency drives metabolic reprogramming in ER+ breast cancer.,,We targeted NF1's RASGAP GRD domain with clustered regularly interspaced short palindromic repeat (CRISPR) guides to the 21st exon,0.85,Accept,Experimental Usage
06cfd3ee-3729-5709-b480-369992a65417,NF1 isoform 2,Plasmid,,,Human,,,,,,,,,,,,,,,,,,,,,NF1 isoform 2,PMID:31836666 | PMID:36689660,10.1074/jbc.RA119.010934 | 10.1073/pnas.2208960120,Biochemical and structural analyses reveal that the tumor suppressor neurofibromin (NF1) forms a high-affinity dimer. | Destabilizing NF1 variants act in a dominant negative manner through neurofibromin dimerization.,,"Entry clones were produced by PCR amplification of portions of the NF1 gene from Addgene construct 70423, which contains a codon-optimized version of human NF1 isoform 2 | Point mutations in NF1 isoform-2 were generated by PCR mutagenesis of Addgene plasmid 70423.",0.9,Accept,Experimental Usage
c732c818-394c-51d3-99d5-c960a3514166,NF2,Viral,CSCW2,,Human,,,,,,,,,,,,,,,,,,,,,NF2,PMID:33273014 | PMID:29715273 | PMID:30274821 | PMID:26219339 | PMID:24595234,10.1074/jbc.RA120.014960 | 10.1371/journal.pone.0196726 | 10.1016/j.ebiom.2018.09.042 | 10.18632/oncotarget.4858 | 10.1371/journal.pone.0090853,mTOR kinase inhibition disrupts neuregulin 1-ERBB3 autocrine signaling and sensitizes NF2-deficient meningioma cellular models to IGF1R inhibition. | Neurofibromatosis type 2 tumor suppressor protein is expressed in oligodendrocytes and regulates cell proliferation and process formation. | Synergistic effect of Nutlin-3 combined with MG-132 on schwannoma cells through restoration of merlin and p53 tumour suppressors. | A high-throughput kinome screen reveals serum/glucocorticoid-regulated kinase 1 as a therapeutic target for NF2-deficient meningiomas. | In vivo functional analysis of the human NF2 tumor suppressor gene in Drosophila.,,"full length cDNA coding sequence of NF2 (isoform 1, NCBI accession # NM_000268) cloned into the lentiviral vector CSCW2 | the plasmid pcNf2hflag containing a CMV promoter and a neomycin resistance cassette was used | The plasmids HA-tagged NF2 (a gift from Dr. Y. J. LU, Tongji University, China) | transfected using program U-023 with lenti-CRISPR-NF2_sg1 expressing a single guide RNA targeting human NF2 exon 8 | Transgenes expressing the indicated NF2 proteins were cloned with N-terminal Flag epitope tags in the pUASt transformation vector.",0.9,Accept,Experimental Usage
c97c2874-6530-5a9f-be63-3228031d0f39,SPRED1,Plasmid,,,,,,,,,,,,,,,,,,,,,,,,SPRED1,PMID:40225167,10.1155/2023/9628049,Functional Assays Combined with Pre-mRNA-Splicing Analysis Improve Variant Classification and Diagnostics for Individuals with Neurofibromatosis Type 1 and Legius Syndrome.,,FLAG-SPRED1 (WT or variant) and NF (WT or variant) were coexpressed in HEK 293 T cells,0.85,Accept,Experimental Usage
182aad93-5fa7-51dc-b298-2c359c28371f,Nf1,Other,,,,,,,CCAGGACATCTCCAAGGATG,,,,,,,,,,,,,,,,,Nf1,PMID:32461556 | PMID:38481529 | PMID:39890807 | PMID:34646065 | PMID:37446790 | PMID:34011935 | PMID:29670214 | PMID:37140985 | PMID:36241865,10.1038/s41467-020-16432-0 | 10.3389/fcell.2024.1359561 | 10.1038/s41598-024-84493-y | 10.1155/2021/9386823 | 10.3390/molecules28135128 | 10.1038/s41419-021-03802-9 | 10.1038/s41598-018-24310-5 | 10.1172/JCI168227 | 10.1038/s12276-022-00850-9,Assessing the origin of high-grade serous ovarian cancer using CRISPR-modification of mouse organoids. | Generation of heterozygous and homozygous NF1 lines from human-induced pluripotent stem cells using CRISPR/Cas9 to investigate bone defects associated with neurofibromatosis type 1. | Global proteomics and affinity mass spectrometry analysis of human Schwann cells indicates that variation in and loss of neurofibromin (NF1) alters protein expression and cellular and mitochondrial metabolism. | Survival and | Icariin Promotes Osteogenic Differentiation in a Cell Model with NF1 Gene Knockout by Activating the cAMP/PKA/CREB Pathway. | Metalloproteinase 1 downregulation in neurofibromatosis 1: Therapeutic potential of antimalarial hydroxychloroquine and chloroquine. | Restoring functional neurofibromin by protein transduction. | Basement membrane proteins in extracellular matrix characterize NF1 neurofibroma development and response to MEK inhibitor. | Transplanting neurofibromatosis-1 gene knockout neural stem cells improve functional recovery in rats with spinal cord injury by enhancing the mTORC2 pathway.,,"Nf1 Exon 8, F CCAGGACATCTCCAAGGATG | sgRNA1 (5′-TAACTGCGCAACCTTCTTTA-3′) and sgRNA2 (5′-GTTAGCAGTTATAAATAGCC-3′) target the exon 6 of NF1 gene | The wild type (WT) mNf1 cDNA plasmid was developed by GeneCopoeia and is commercially available. The full-length, endogenous mouse cDNA (mNf1) containing Nf1 isoform 2 | all samples were screened for large deletions using four TaqMan NF1 copy-number assays across the gene (ThermoFisher; Hs05477010, Hs06413401, Hs05512625, and Hs03960106) | CRISPR/Cas9 single-vector lentivirus was purchased from GeneChem (Shanghai, China) | Small interfering RNA (siRNA) targeting NF1 (s221793) | synthetic gene (GeneArt) encoding the human full-length NF1 (synNF1) | Two predesigned siRNAs against human NF1 were purchased from MilliporeSigma (SASI_Hs01_00129008 and SASI_Hs01_00129006). | cells were transfected with the control lentivirus (LV-vector), NF-1 sgRNA-CAS9 lentivirus (LV-NF-1), Rictor sgRNA-CAS9 lentivirus (LV-Rictor) | synthetic gene (GeneArt) encoding the human full-length NF1 (synNF1) was cloned into the pFastBacHta (Life Technology) vector",0.95,Accept,Experimental Usage
83ecd84b-4ddc-52b4-9b65-26baf7f4e30d,Merlin,Other,,,,,,,5′-CCUCAAAGCUUCGUGUUAA-3′,,,,,,,,,,,,,,,,,Merlin,PMID:32457840,10.3389/fonc.2020.00687,"TGFβ Signaling Increases Net Acid Extrusion, Proliferation and Invasion in Panc-1 Pancreatic Cancer Cells: SMAD4 Dependence and Link to Merlin/NF2 Signaling.",,"Merlin siRNA (SASI_Hs_01_00188862, Sigma) sense sequence 5′-CCUCAAAGCUUCGUGUUAA-3",0.9,Accept,Experimental Usage
6a54cddc-272f-5cfc-b063-48f9969606ab,dNf1,Transposon,,UAS,Drosophila,,,,,,,,,,,,,,,,,,,,,dNf1,PMID:39129390,10.1002/1878-0261.13704,Inhibition of autophagy as a novel treatment for neurofibromatosis type 1 tumors.,,The UAS‐dNf1 transgene encodes full‐length dNf1 cDNA corresponding to the RF isoform,0.9,Accept,Experimental Usage
e38aa0ec-2c20-56e8-a848-a9dc9af01121,NF1-GRD,Viral,Adenovirus,,,,,,,,,,,,,,,,,,,,,,,NF1-GRD,PMID:24509877 | PMID:35393510 | PMID:16835260 | PMID:38000020,10.1038/onc.2013.506 | 10.1038/s41418-022-00991-4 | 10.1093/hmg/ddl165 | 10.1126/sciadv.adg8876,MAF mediates crosstalk between Ras-MAPK and mTOR signaling in NF1. | Tumor growth of neurofibromin-deficient cells is driven by decreased respiration and hampered by NAD | Nf1+/- mast cells induce neurofibroma like phenotypes through secreted TGF-beta signaling. | CDK4/6 inhibition enhances SHP2 inhibitor efficacy and is dependent upon RB function in malignant peripheral nerve sheath tumors.,,"MPNST cells were infected with purified Ad-NF1-GRD or control Ad-GFP, in triplicate, for 2 h in serum-free medium | NF1-GRD sequence was introduced in Nf1−/− MEFs using the pMSCV-GRD vector | a virus expressing the full-length NF1 GTPase-activating related domain (NF1 GRD) and pac (MSCV-NF1 GRD-pac) | The human NF1-GRD was amplified using the genomic deoxyribonucleic acid (gDNA) from HEK293T as polymerase chain reaction template and subcloned into TTIGFP-MLUEX vector",0.9,Accept,Experimental Usage
47c4dd20-2b55-5df4-8b68-67057a9b3504,NF1-targeting TALEN,Other,,,,,,,,,,,,,,,,,,,,,,,,NF1-targeting TALEN,PMID:37520682,10.1016/j.omtn.2023.06.018,Combining nonsense mutation suppression therapy with nonsense-mediated decay inhibition in neurofibromatosis type 1.,,TALENs were designed to flank the region of NF1 in exon 41. Ossabaw minipig fetal fibroblasts isolated from day 38 embryos were transfected with TALENs,0.85,Accept,Experimental Usage
01acf277-b66a-501f-9790-86b8b22e9a4a,NF1 DLR,Plasmid,,,Human,,,,,,,,,,,,,,,,,,,,,NF1 DLR,PMID:37520682,10.1016/j.omtn.2023.06.018,Combining nonsense mutation suppression therapy with nonsense-mediated decay inhibition in neurofibromatosis type 1.,,The NF1 DLR plasmid was kindly provided by David Bedwell at University of Alabama. The R1497X Renilla-NF1-R1947X-Firefly insert contains 30 nucleotides,0.95,Accept,Experimental Usage
fce11210-d4af-59a8-9332-478ee203fab0,Nf1 flox,,,,Mouse,,,,,,,,,,,,,,,,,,,,,Nf1 flox,PMID:22901811,10.1016/j.cell.2012.06.034,ERK inhibition rescues defects in fate specification of Nf1-deficient neural progenitors and brain abnormalities.,,"mice with genotypes of hGFAP-cre-; Nf1 flox/flox , hGFAP-cre-; Nf1 flox/+ , hGFAP-cre+; Nf1 flox/+",0.95,Accept,Experimental Usage
9eac762d-fe39-5dd6-92f3-8ef4b951e1c2,Nf1 KO,,,,Mouse,,,,,,,,,,,,,,,,,,,,,Nf1 KO,PMID:22901811,10.1016/j.cell.2012.06.034,ERK inhibition rescues defects in fate specification of Nf1-deficient neural progenitors and brain abnormalities.,,"hGFAP-cre±; Nf1 KO/+ . The mutant mice ( Nf1 hGFAP CKO) used were of the genotypes, hGFAP-cre+; Nf1 flox/KO",0.9,Accept,Experimental Usage
2af24a58-4a08-5f34-b39a-00372f6d22a8,human neurofibromin,Plasmid,,,Human,,GFP,,,,,,,,,,,,,,,,,,,human neurofibromin,PMID:40590220,10.1172/JCI188932,A haploinsufficiency restoration strategy corrects neurobehavioral deficits in Nf1+/- mice.,,"GFP-tagged human neurofibromin, transcript variant 1 cDNA (RG220425, Origene)",0.95,Accept,Experimental Usage
6aef8f45-05fd-54b2-a19a-73f1688f586e,NF1 capture probes,Other,,,,,,,,,,,,,,,,,,,,,,,,NF1 capture probes,PMID:27999334,10.3390/genes7120133,Hybridization Capture-Based Next-Generation Sequencing to Evaluate Coding Sequence and Deep Intronic Mutations in the NF1 Gene.,,Capture probe set was designed and synthesized by Thermo Fisher Scientific for the Ion TargetSeq Custom Enrichment kit,0.9,Accept,Experimental Usage
a7926f94-fdf4-5cc2-8b55-e3a892f2de94,neurofibromin 2,Other,,,,,,,,,,,,,,,,,,,,,,,,neurofibromin 2,PMID:20195187,10.1097/MAO.0b013e3181d2777f,Merlin knockdown in human Schwann cells: clues to vestibular schwannoma tumorigenesis.,,"Small interfering RNA (siRNA) molecules (neurofibromin 2 ON-TARGETplus SMARTpool; Dharmacon, Lafayette, CO) were diluted in Opti-MEM",0.95,Accept,Experimental Usage
cb62b06d-517e-5577-b058-c6dc50f63e15,NF2 shRNA,Viral,Lentiviral,,,,,,ACTTCAAAGATA CTG ACAT,,,,,,,,,,,,,,,,,NF2 shRNA,PMID:30274821,10.1016/j.ebiom.2018.09.042,Synergistic effect of Nutlin-3 combined with MG-132 on schwannoma cells through restoration of merlin and p53 tumour suppressors.,,Lentiviral shRNA vectors were constructed using target sequences against the expression of NF2,0.9,Accept,Experimental Usage
9762d0c4-3a1e-5b5f-bcb2-68b7de13fc26,Spred1(EVH1),Plasmid,pET,,Human,,,,,,,,,,,,,,,,,,,,,Spred1(EVH1),PMID:28831766,10.1007/s12104-017-9768-1,NMR resonance assignments of the EVH1 domain of neurofibromin's recruitment factor Spred1.,,Construction of pET-Spred1(EVH1) encoding the EVH1 domain of human Spred1 (Ser13–Ser130) preceded by a non-native translation initiating methionine,0.85,Accept,Experimental Usage
31ce5396-5fef-5952-973a-b36931af7123,NF2 TET,Other,,,,,,,,,,,,,,,,,,,,,,,,NF2 TET,PMID:18974932,10.1007/s11060-008-9721-3,A role for the p53 pathway in the pathology of meningiomas with NF2 loss.,,"at markers D22S193 (centromeric to NF2), NF2 TET and D22S929 (intragenic)",0.85,Accept,Experimental Usage
58f25ef1-d11b-59e3-9649-436ff28ce3e7,Merlin isoform 1,Plasmid,pET32a,,Human,,6XHis plus thioredoxin tag,,,,,,,,,,,,,,,,,,,Merlin isoform 1,PMID:24882693,10.1016/j.jmb.2014.05.011,Molecular conformation of the full-length tumor suppressor NF2/Merlin--a small-angle neutron scattering study.,,"The human cDNA encoding the full-length Merlin isoform 1 was subcloned into the pET32a vector (EMD Biosciences, Inc), with a 6XHis plus thioredoxin tag",0.85,Accept,Experimental Usage
35b70a2e-944e-5366-90e3-312dccf7dd9b,Merlin(S518D) and Merlin(S518E) mutants,Other,,,,,,,,,,,,,,,,,,,,,,,,Merlin(S518D) and Merlin(S518E) mutants,PMID:24882693,10.1016/j.jmb.2014.05.011,Molecular conformation of the full-length tumor suppressor NF2/Merlin--a small-angle neutron scattering study.,,The Merlin(S518D) and Merlin(S518E) mutants were generated with the QuikChange II site-directed mutagenesis kit (Agilent Technologies),0.8,Accept,Experimental Usage
cbc093da-7e68-5b32-818b-f5c9fa24b551,Merlin siRNA,Other,,,,,,,,,,,,,,,,,,,,,,,,Merlin siRNA,PMID:25043298,10.1038/onc.2014.185,Oncogenic role of Merlin/NF2 in glioblastoma.,,Merlin knockdown U251-S cells were treated with siRNA SMARTpool (Thermo Scientific) directed to Merlin,0.85,Accept,Experimental Usage
e27b27fb-155e-5921-902e-5e9db24a264a,HA-Merlin,Plasmid,pXJ40,,,,,,,,,,,,,,,,,,,,,,,HA-Merlin,PMID:25043298,10.1038/onc.2014.185,Oncogenic role of Merlin/NF2 in glioblastoma.,,cells were transfected with pXJ40-HA-Merlin and S518A pXJ40- HA-Merlin,0.9,Accept,Experimental Usage
f650c0fa-4167-5038-a70d-c72ac33d2495,S518A HA-Merlin,Plasmid,pXJ40,,,,,,,,,,,,,,,,,,,,,,,S518A HA-Merlin,PMID:25043298,10.1038/onc.2014.185,Oncogenic role of Merlin/NF2 in glioblastoma.,,cells were transfected with pXJ40-HA-Merlin and S518A pXJ40- HA-Merlin,0.9,Accept,Experimental Usage
6f302b53-8c6e-5217-b02e-577bc50d14fe,nf2a/b-4sgRNA,Plasmid,pGGDestTol2LC,,,,,,,,,,,,,,,,,,,,,,,nf2a/b-4sgRNA,PMID:39415595,10.1242/dmm.050862,Generation of a zebrafish neurofibromatosis model via inducible knockout of nf2a/b.,,All four guides were cloned into the final destination vector pGGDestTol2LC-4sgRNA (nf2a/b-4sgRNA),0.85,Accept,Experimental Usage
7efb0f81-781b-508c-8b51-bd1bc42050d0,1276P NF1 GRD,Viral,MSCV,,,,Puromycin,,,,,,,,,,,,,,,,,,,1276P NF1 GRD,PMID:16835260,10.1093/hmg/ddl165,Nf1+/- mast cells induce neurofibroma like phenotypes through secreted TGF-beta signaling.,,a virus expressing a GAP-inactive mutant of the NF1 GRD that harbors a known human mutation in the arginine finger loop (R1276P) and pac (MSCV-1276P NF1 GRD-pac),0.9,Accept,Experimental Usage
3e26c266-237c-50ce-bf42-389a5d88cff1,Cas9 and sgRNAs targeting Nf1+Cdkn2a,Viral,,,Mouse,,,,,,,,,,,,,,,,,,,,,Cas9 and sgRNAs targeting Nf1+Cdkn2a,PMID:37410426,10.1158/1078-0432.CCR-23-0749,"CDK4/6-MEK Inhibition in MPNSTs Causes Plasma Cell Infiltration, Sensitization to PD-L1 Blockade, and Tumor Regression.",,adenovirus containing Cas9 and sgRNAs targeting Nf1+Cdkn2a were produced,0.9,Accept,Experimental Usage
