antibodyId,targetAntigen,hostOrganism,clonality,vendor,catalogNumber,_pmid,_foundIn,_confidence,_contextSnippet,_whyMissed,_reasoning,_source
f1d870d7-20e8-48dd-a730-51b9fac5c678,Ki67,,,,,PMID:32642733,methods,1.0,Ki67 (Ventana Medical Systems),Common proliferation marker antibody not recognized,,AI validation - Sonnet 4.5
e675fc96-9b1a-4348-a3c1-2e38b872e79c,anti-α-tubulin,,,,,PMID:32642733,methods,1.0,with anti-α-tubulin (Sigma-Aldrich) during 1 h at room temperature,Standard loading control antibody not caught,,AI validation - Sonnet 4.5
564123e9-69d2-4401-a446-36d613d2db1b,anti-α-tubulin-Alexa488 antibody,,,,,PMID:32642733,methods,1.0,incubated with 1:100 of anti-α-tubulin-Alexa488 antibody (Life Technologies),Fluorescently conjugated antibody not recognized,,AI validation - Sonnet 4.5
f506ea96-c2a7-44e5-a33c-8ada40b0a25c,Annexin-V-Alexa Fluor 568 antibody,,,,,PMID:32642733,methods,1.0,using the Annexin-V-Alexa Fluor 568 antibody (Roche and Life Technologies),Apoptosis detection antibody not caught,,AI validation - Sonnet 4.5
381becfe-5cfe-4813-b1bf-26e5659bc373,AFH1,,,,,PMID:3280697,abstract,1.0,"The mouse monoclonal antibody AFH1 was produced using formalin-fixed, sham paraffin-embedded human melanoma cell culture line A375 as immunogen. Reactivity of this antibody was assessed by immunohistochemical techniques",Mining system failed to detect this monoclonal antibody despite clear identification as 'mouse monoclonal antibody AFH1' with detailed characterization and usage description,,AI validation - Sonnet 4.5
26784692-5f12-4151-8598-38f29edce42a,Ki67 antibody,,,,,PMID:32948135,methods,1.0,"antigen Ki67, monoclonal mouse anti-human Ki67 antigen, clone MIB1, M7240, DAKO",Antibody with full catalog information not detected - needs pattern for DAKO catalog numbers,,AI validation - Sonnet 4.5
eb90d8ef-3d3b-43b0-9d66-1d6e5dfac6cd,p53 antibody,,,,,PMID:32948135,methods,1.0,"tumor protein p53 (p53, monoclonal mouse anti-human p53 M7001, DAKO)",Antibody with catalog number not detected,,AI validation - Sonnet 4.5
35af7d58-d530-4021-9ff6-0a12e11bbd2d,p21 antibody,,,,,PMID:32948135,methods,1.0,"p21, monoclonal mouse anti-human p21 WAF1/Cip1 , M7202, DAKO",Antibody with catalog number not detected,,AI validation - Sonnet 4.5
6d299082-f868-4ae2-a7d3-c4d92545d12b,bcl2 antibody,,,,,PMID:32948135,methods,1.0,"B-cell lymphoma 2 (bcl2, monoclonal mouse anti-human bcl2 oncoprotein, M887, DAKO)",Antibody with catalog number not detected,,AI validation - Sonnet 4.5
4ef6d199-66a0-4302-9bd9-d32ccc889437,bcl6 antibody,,,,,PMID:32948135,methods,1.0,"B-cell lymphoma 6 (bcl6, monoclonal mouse anti-human bcl6 protein, M7211, DAKO)",Antibody with catalog number not detected,,AI validation - Sonnet 4.5
278881d5-7114-4ee2-9178-6761ce78ee9c,cyclin D1 antibody,,,,,PMID:32948135,methods,1.0,"cyclin D1 (monoclonal rabbit anti-human cyclin D1, M3642, DAKO)",Antibody with catalog number not detected,,AI validation - Sonnet 4.5
9f18cec4-41a9-48ab-ac66-7dd3f5649c87,goat anti-collagen IV,,,,,PMID:33078583,methods,1.0,The primary antibodies and dilutions used were goat anti-collagen IV (Millipore AB769; 1:500),Antibody naming pattern with vendor info not captured,,AI validation - Sonnet 4.5
7e9911a7-97c7-4f46-afec-4281cf1d9785,mouse anti-MyHC type 1,,,,,PMID:33078583,methods,1.0,mouse anti-MyHC type 1 (DSHB BA-D5; 1:500),Antibody naming pattern with vendor info not captured,,AI validation - Sonnet 4.5
796c9226-1b60-4c96-b734-903f831f88bd,mouse anti-MyHC type 2A,,,,,PMID:33078583,methods,1.0,mouse anti-MyHC type 2A (DSHB SC-71; 1:200),Antibody naming pattern with vendor info not captured,,AI validation - Sonnet 4.5
a8afd335-8321-453b-b4fb-fa9474c5d14a,rabbit anti-laminin,,,,,PMID:33078583,methods,1.0,rabbit anti-laminin (Sigma-Aldrich L9393; 1:500),Antibody naming pattern with vendor info not captured,,AI validation - Sonnet 4.5
fdc33ec9-7923-4a02-9d59-76101b89eb0b,mouse anti-Pax7,,,,,PMID:33078583,methods,1.0,mouse anti-Pax7 (DSHB Pax7; 1:10),Antibody naming pattern with vendor info not captured,,AI validation - Sonnet 4.5
13ba47ab-ebd6-4d34-9bc9-ffd607271973,mouse anti-myosin heavy chain,,,,,PMID:33078583,methods,1.0,mouse anti-myosin heavy chain (Sigma-Aldrich 05-716; 1:1000),Antibody naming pattern with vendor info not captured,,AI validation - Sonnet 4.5
e7b5003c-1d59-4bf1-8ecf-077d7c86b067,anti-beta III tubulin antibody,,,,,PMID:33078583,methods,1.0,anti-beta III tubulin antibody (Sigma-Aldrich AB9354; 1:500),Antibody naming pattern with vendor info not captured,,AI validation - Sonnet 4.5
fcd58d1d-969a-4127-9c1b-c1b6ed98d37e,anti-perilipin A/B antibody,,,,,PMID:33078583,methods,1.0,anti-perilipin A/B antibody (Sigma-Aldrich p1873; 1:250),Antibody naming pattern with vendor info not captured,,AI validation - Sonnet 4.5
4bcf59f4-87a2-4c0c-a015-adca1dec7376,rabbit anti-PPARG,,,,,PMID:33078583,methods,1.0,Antibodies used were rabbit anti-PPARG (Cell Signaling Technology 2443),Antibody naming pattern with vendor info not captured,,AI validation - Sonnet 4.5
dfe1ab26-c8ce-4b1f-9f2e-12ff68c863ed,rabbit anti-phosphor (pThr172) AMPKa,,,,,PMID:33078583,methods,1.0,rabbit anti-phosphor (pThr172) AMPKa (Cell Signaling Technology 2535),Antibody naming pattern with vendor info not captured,,AI validation - Sonnet 4.5
193378f0-c3cc-4f27-a980-20169d15bed8,rabbit anti-AMPK α,,,,,PMID:33078583,methods,1.0,rabbit anti-AMPK α (Cell Signaling Technology 2532),Antibody naming pattern with vendor info not captured,,AI validation - Sonnet 4.5
d845d378-81c3-40d5-abdb-f1e249198bb6,mouse anti-β-actin,,,,,PMID:33078583,methods,1.0,mouse anti-β-actin (Cell Signaling Technology 58169),Antibody naming pattern with vendor info not captured,,AI validation - Sonnet 4.5
3124c1fb-0fd2-4600-a5d3-13a4c4d452b6,mouse anti-β-tubulin,,,,,PMID:33078583,methods,1.0,mouse anti-β-tubulin (Sigma-Aldrich T8328),Antibody naming pattern with vendor info not captured,,AI validation - Sonnet 4.5
ac43d458-7edf-4558-a823-4c807457d94b,rabbit anti-phosphor (s235/236) S6,,,,,PMID:33078583,methods,1.0,rabbit anti-phosphor (s235/236) S6 (Cell Signaling Technology 4858),Antibody naming pattern with vendor info not captured,,AI validation - Sonnet 4.5
b09b3d9e-c980-450d-95e6-d10cd3600720,mouse anti-MyHC type 2B,,,,,PMID:33078583,methods,1.0,mouse anti-MyHC type 2B (DSHB BF-F3),Antibody naming pattern with vendor info not captured,,AI validation - Sonnet 4.5
673cf6fd-d1db-4741-8d95-fb2c4e3d938b,rabbit anti-phosphor (Ser473) AKT,,,,,PMID:33078583,methods,1.0,"rabbit anti-phosphor (Ser473) AKT (Cell Signaling, #9271; 1:1000)",Antibody naming pattern with vendor info not captured,,AI validation - Sonnet 4.5
5ab5fd69-579b-41c9-8820-6db043f9bd99,rabbit anti-phospho (Ser1101) IRS-1,,,,,PMID:33078583,methods,1.0,"rabbit anti-phospho (Ser1101) IRS-1 (Cell Signaling, #2385; 1:1000)",Antibody naming pattern with vendor info not captured,,AI validation - Sonnet 4.5
952bde5b-1fd7-4fbc-ba23-78cde1921ba5,rabbit anti-phospho (Ser636/639) IRS-1,,,,,PMID:33078583,methods,1.0,"rabbit anti-phospho (Ser636/639) IRS-1 (Cell Signaling, #2388; 1:1000)",Antibody naming pattern with vendor info not captured,,AI validation - Sonnet 4.5
663bd83e-198f-4207-a000-ff6fc729e06c,anti-DIG-Fab antibody,,,,,PMID:33078583,methods,1.0,"incubated with anti-DIG-Fab antibody coupled to alkaline phosphatase (Roche, 11093274910)",Antibody naming pattern with vendor info not captured,,AI validation - Sonnet 4.5
313a3c3b-a0ad-415b-bb44-c884432a9153,s-100b antibody,,,,,PMID:33160273,methods,0.9,Schwann cells were incubated with antibody against s-100b (Sigma) as the primary overnight at 1:400 ratio,"Antibody target name not detected, vendor information present (Sigma)",,AI validation - Sonnet 4.5
680eb689-90f0-41a6-b69a-2b1774d629ad,anti-rabbit IgG,,,,,PMID:33160273,methods,0.85,"treated with anti-rabbit IgG as secondary (Alexa Fluro 594, Invitrogen) for 2 hours at 1:1000 ratio",Secondary antibody with vendor information (Invitrogen) not detected,,AI validation - Sonnet 4.5
96bb7cd3-7186-4b96-9e18-e24b97b4dc7f,ERBB3 antibody,,,,,PMID:33273014,methods,1.0,"Antibodies recognizing ERRB3 Y1197, ERBB3, EPHA2 S897, NDRG1 T346, Akt S473, Akt T308, Akt, p70S6K T389",Antibody target names not captured as antibodies,,AI validation - Sonnet 4.5
c314780d-be96-4e67-a19d-4752a1d75c92,Akt antibody,,,,,PMID:33273014,methods,1.0,"Antibodies recognizing ERRB3 Y1197, ERBB3, EPHA2 S897, NDRG1 T346, Akt S473, Akt T308, Akt, p70S6K T389",Antibody target names not captured as antibodies,,AI validation - Sonnet 4.5
eeb47ea8-d246-4738-9b39-4de677cd8af6,IGF1R antibody,,,,,PMID:33273014,methods,1.0,"IGF1R Y1135/36/IR Y1150/51, IGF1R, FOXO1/3a T24/T32, and FOXO3 were from Cell Signaling",Antibody target names not captured as antibodies,,AI validation - Sonnet 4.5
5e98d7bb-f439-475b-b941-11a90e62d0d7,GAPDH antibody,,,,,PMID:33273014,methods,1.0,"Other antibodies included EPHA2 (Santa Cruz), secreted form of NRG1 (R&D Systems), NDRG1 (Abcam), and GAPDH (EMD Millipore)",Antibody target names not captured as antibodies,,AI validation - Sonnet 4.5
38220fbf-c8c3-4dbd-83ed-121fa67464bb,NF2/merlin antibody,,,,,PMID:33273014,methods,1.0,Anti-NF2/merlin polyclonal antibody has been previously described,Custom antibody not captured,,AI validation - Sonnet 4.5
23d16d5a-1cf0-4013-838b-5b0b439e9300,S100,,,,,PMID:33356508,abstract,1.0,"Immunostaining with markers such as S100, β-tubulin III, Foxp3, CD45, Vimentin, and Ki67 confirmed low-grade tumor formation",Antibody marker not recognized in immunostaining context,,AI validation - Sonnet 4.5
3258aba5-a9c9-4611-8576-3fb43ae59295,β-tubulin III,,,,,PMID:33356508,abstract,1.0,"Immunostaining with markers such as S100, β-tubulin III, Foxp3, CD45, Vimentin, and Ki67 confirmed low-grade tumor formation",Antibody marker not recognized in immunostaining context,,AI validation - Sonnet 4.5
7f6a11b4-e24f-4ea8-b64a-fde1b7935b2c,Foxp3,,,,,PMID:33356508,abstract,1.0,"Immunostaining with markers such as S100, β-tubulin III, Foxp3, CD45, Vimentin, and Ki67 confirmed low-grade tumor formation",Antibody marker not recognized in immunostaining context,,AI validation - Sonnet 4.5
d6f5e482-f586-462a-85d8-3eb3a5b772aa,CD45,,,,,PMID:33356508,abstract,1.0,"Immunostaining with markers such as S100, β-tubulin III, Foxp3, CD45, Vimentin, and Ki67 confirmed low-grade tumor formation",Antibody marker not recognized in immunostaining context,,AI validation - Sonnet 4.5
5ccf2025-f261-4ea2-91ed-5f7f52c5d2e6,Vimentin,,,,,PMID:33356508,abstract,1.0,"Immunostaining with markers such as S100, β-tubulin III, Foxp3, CD45, Vimentin, and Ki67 confirmed low-grade tumor formation",Antibody marker not recognized in immunostaining context,,AI validation - Sonnet 4.5
b1a883e4-d3f6-47c2-ab9c-387217fc857e,Ki67,,,,,PMID:33356508,abstract,1.0,"Immunostaining with markers such as S100, β-tubulin III, Foxp3, CD45, Vimentin, and Ki67 confirmed low-grade tumor formation",Antibody marker not recognized in immunostaining context,,AI validation - Sonnet 4.5
e3c580f4-27da-4ec4-9b6a-21e992a79cf9,GFAP,,,,,PMID:33356508,methods,1.0,"labeled overnight at room temperature with the following conjugated primary antibodies: S100-FITC, Vimentin-FTIC, CD45-APC, Ki67-APC, and GFAP-APC.",Additional antibody marker found in detailed methods not captured in abstract,,AI validation - Sonnet 4.5
779f0b04-9cef-49bc-9f90-e8fa76812f30,rabbit anti-SMA,,,,,PMID:33413690,methods,1.0,"...incubated with primary antibodies [rabbit anti-SMA (Novus, NB600-531); rabbit anti-COL11A1...",Antibody with vendor and catalog number not detected by mining patterns,,AI validation - Sonnet 4.5
4ccf4474-a81e-42ba-a41d-04f24abae0da,rabbit anti-COL11A1,,,,,PMID:33413690,methods,1.0,"...rabbit anti-SMA (Novus, NB600-531); rabbit anti-COL11A1 (ThermoScientific; PA5-68410); rabbit anti-FAP...",Antibody with vendor and catalog number not detected by mining patterns,,AI validation - Sonnet 4.5
83191265-4410-40d0-ac53-141b5dc992a6,rabbit anti-FAP,,,,,PMID:33413690,methods,1.0,...rabbit anti-COL11A1 (ThermoScientific; PA5-68410); rabbit anti-FAP (Abcam; ab53066); rabbit anti-collagen VI...,Antibody with vendor and catalog number not detected by mining patterns,,AI validation - Sonnet 4.5
a8b708cf-7123-4d8e-a029-16ed51beaefe,rabbit anti-collagen VI,,,,,PMID:33413690,methods,1.0,...rabbit anti-FAP (Abcam; ab53066); rabbit anti-collagen VI (Abcam; ab6588)] diluted in 3% donkey serum...,Antibody with vendor and catalog number not detected by mining patterns,,AI validation - Sonnet 4.5
0af94b06-a322-4c59-8620-9c33f08b5fd9,MKK3 antibody (Cell Signaling #5674),,,,,PMID:33436083,methods,1.0,"...incubated at 4°C overnight in primary antibody; MKK3 (Cell Signaling #5674), p38 (Cell Signaling #9219)...",Specific antibody with catalog number not caught by mining patterns,,AI validation - Sonnet 4.5
6a209175-3016-4779-a573-3a92c42f6a03,p38 antibody (Cell Signaling #9219),,,,,PMID:33436083,methods,1.0,"...MKK3 (Cell Signaling #5674), p38 (Cell Signaling #9219), phospho-p38 (Cell Signaling # 4511)...",Specific antibody with catalog number not caught by mining patterns,,AI validation - Sonnet 4.5
4c146799-1cc2-41df-9eb8-00a813a6c02f,phospho-p38 antibody (Cell Signaling #4511),,,,,PMID:33436083,methods,1.0,"...p38 (Cell Signaling #9219), phospho-p38 (Cell Signaling # 4511), phospho-ERK1/2 (Cell Signaling #9101)...",Specific antibody with catalog number not caught by mining patterns,,AI validation - Sonnet 4.5
c4f1d472-9091-4261-8444-1e581189544d,phospho-ERK1/2 antibody (Cell Signaling #9101),,,,,PMID:33436083,methods,1.0,"...phospho-p38 (Cell Signaling # 4511), phospho-ERK1/2 (Cell Signaling #9101), and β-Actin (Cell Signaling #3700)...",Specific antibody with catalog number not caught by mining patterns,,AI validation - Sonnet 4.5
715ffc16-a34d-45ae-8586-28a472658d45,β-Actin antibody (Cell Signaling #3700),,,,,PMID:33436083,methods,1.0,"...phospho-ERK1/2 (Cell Signaling #9101), and β-Actin (Cell Signaling #3700). Densitometry was done in ImageJ...",Specific antibody with catalog number not caught by mining patterns,,AI validation - Sonnet 4.5
dd661dab-2f33-4dd1-897a-b3857bf2cbe6,α-tubulin antibody,,,,,PMID:33574490,methods,1.0,"Cells were incubated with α-tubulin (Invitrogen, 1:1000) and NGFR (Advance Targeting systems, 1:100) antibodies",Antibody with vendor and dilution information,,AI validation - Sonnet 4.5
c15ee2f3-bfac-44ba-b4f7-d0f7c78169ee,NGFR antibody,,,,,PMID:33574490,methods,1.0,"Cells were incubated with α-tubulin (Invitrogen, 1:1000) and NGFR (Advance Targeting systems, 1:100) antibodies",Antibody with vendor and dilution information,,AI validation - Sonnet 4.5
6a83ad33-22ae-4133-8097-aaabc5ed9506,P-ERK 1/2 antibody,,,,,PMID:33574490,methods,1.0,All antibodies used were diluted in 3% non-fat dry milk and include P-ERK 1/2 (Cell Signalling diluted 1:2000),Antibody with vendor and dilution information,,AI validation - Sonnet 4.5
979c59d8-beed-4030-804a-66fba495aeae,ERK 1/2 antibody,,,,,PMID:33574490,methods,1.0,"ERK 1/2 (Millipore diluted 1:1000), P-PKA α/β (Invitrogen diluted 1ug/ml)",Antibody with vendor and dilution information,,AI validation - Sonnet 4.5
811cf54e-5297-42c6-8789-4b62372da4b6,P-PKA α/β antibody,,,,,PMID:33574490,methods,1.0,"P-PKA α/β (Invitrogen diluted 1ug/ml), PKA α/β (Termo Fisher Scientific diluted 1:500)",Antibody with vendor and dilution information,,AI validation - Sonnet 4.5
d76da225-f017-44bd-8ae7-3e86b557169d,PKA α/β antibody,,,,,PMID:33574490,methods,1.0,PKA α/β (Termo Fisher Scientific diluted 1:500) NF1 c-terminal (Bethyl diluted 1:1000),Antibody with vendor and dilution information,,AI validation - Sonnet 4.5
93bbf983-7104-4863-b390-c3131f0c7366,NF1 c-terminal antibody,,,,,PMID:33574490,methods,1.0,"NF1 c-terminal (Bethyl diluted 1:1000), NF1 n-terminal (Santa Cruz diluted 1:500)",Antibody with vendor and dilution information,,AI validation - Sonnet 4.5
9503684b-560a-4d8b-87ac-ece2689ac4de,NF1 n-terminal antibody,,,,,PMID:33574490,methods,1.0,NF1 n-terminal (Santa Cruz diluted 1:500) and α-Tubulin (Sigma Aldrich 1:1000),Antibody with vendor and dilution information,,AI validation - Sonnet 4.5
992bf30d-43e9-44e8-b208-17cc21fc64e3,β-actin antibody (#13E5),,,,,PMID:34011935,methods,1.0,"Antibodies used in western blotting targeting β-actin (#13E5), MEK1/2, Akt, c-Raf, ERK, phospho-MEK1/2 (#41G9)","Specific antibody with clone number, clearly used for Western blotting",,AI validation - Sonnet 4.5
fa60e3c3-2869-44ef-b897-7c70cad44460,NF1 antibody (#D7R7D),,,,,PMID:34011935,methods,1.0,"phospho-ERK (#D13.14.4E), MMP1 (#E9S9N), and NF1 (#D7R7D), as well as anti-rabbit IgG HRP-linked antibody were purchased from Cell Signaling Technology",Specific antibody with clone number from Cell Signaling Technology,,AI validation - Sonnet 4.5
3b1a6ba1-adaa-4275-b953-b1980daa4f49,MMP1 antibody (#E9S9N),,,,,PMID:34011935,methods,1.0,"phospho-ERK (#D13.14.4E), MMP1 (#E9S9N), and NF1 (#D7R7D), as well as anti-rabbit IgG HRP-linked antibody","Specific antibody with clone number, key target protein of the study",,AI validation - Sonnet 4.5
c69cedc8-9846-4d7d-830d-00dd82428bc2,phospho-MEK1/2 antibody (#41G9),,,,,PMID:34011935,methods,1.0,"Antibodies used in western blotting targeting β-actin (#13E5), MEK1/2, Akt, c-Raf, ERK, phospho-MEK1/2 (#41G9)",Phospho-specific antibody with clone number for pathway analysis,,AI validation - Sonnet 4.5
50e85e92-3b62-454b-a726-8275ea7059b9,phospho-Akt antibody (#D9E),,,,,PMID:34011935,methods,1.0,"phospho-MEK1/2 (#41G9), phospho-Akt (#D9E), phospho-c-Raf (#56A6), phospho-ERK (#D13.14.4E)",Phospho-specific antibody with clone number,,AI validation - Sonnet 4.5
1ff9ce17-4ae5-47a1-90e7-07714d2ecd62,phospho-c-Raf antibody (#56A6),,,,,PMID:34011935,methods,1.0,"phospho-Akt (#D9E), phospho-c-Raf (#56A6), phospho-ERK (#D13.14.4E), MMP1 (#E9S9N)",Phospho-specific antibody with clone number,,AI validation - Sonnet 4.5
219d9baa-e082-4897-a13a-e8da50df751a,phospho-ERK antibody (#D13.14.4E),,,,,PMID:34011935,methods,1.0,"phospho-c-Raf (#56A6), phospho-ERK (#D13.14.4E), MMP1 (#E9S9N), and NF1 (#D7R7D)",Phospho-specific antibody with clone number,,AI validation - Sonnet 4.5
777c6598-79f8-4593-90ca-4f16c4ac22af,Aryl hydrocarbon receptor antibody (#H-211),,,,,PMID:34011935,methods,1.0,"Antibody for Aryl hydrocarbon receptor (AHR, #H-211) was from Santa Cruz Biotechnology (Dallas, TX, USA)",Specific antibody with clone number from Santa Cruz,,AI validation - Sonnet 4.5
14f54247-6cfb-46e0-ba1b-2401e8d1f87e,collagen I antibody (#EPR7785),,,,,PMID:34011935,methods,1.0,"that for collagen I (#EPR7785) was from Abcam. For immunohistochemical analysis, anti-collagen antibody",Specific antibody with clone number from Abcam,,AI validation - Sonnet 4.5
3223c67f-4cdb-4342-8954-3b091c097902,anti-S100 protein antibody,,,,,PMID:34011935,methods,1.0,"anti-collagen antibody (Nichirei Biosciences Inc.), anti-MMP1 antibody (Nichirei Biosciences Inc.), anti-S100 protein antibody (Nichirei Biosciences Inc.)",Specific antibody used for immunohistochemical analysis,,AI validation - Sonnet 4.5
8168f8fb-25f6-4679-9bcf-c7c78fded65a,Alexa Fluor488 goat anti-rabbit IgG H+L,,,,,PMID:34011935,methods,1.0,Alexa Fluor488 goat anti-rabbit IgG H+L was purchased from Thermo Fisher Scientific,Secondary antibody with specific fluorophore,,AI validation - Sonnet 4.5
e08fa69a-c4d4-4d37-a089-84b69060a7f4,anti-CD11a neutralizing antibody,,,,,PMID:34043012,abstract,0.9,...while LGG growth in mice was assessed using anti-CD11a neutralizing antibody treatment of Neurofibromatosis...,Antibody with functional descriptor not detected - may need patterns for 'anti-target neutralizing antibody',,AI validation - Sonnet 4.5
496609d3-9a49-4e4e-871b-fd562ea3a314,mAb21,,,,,PMID:34257279,methods,0.95,incubated with 200μl of mAb21 anti-Nf1 monoclonal antibody supernatant,Antibody clone name not recognized - specific monoclonal antibody,,AI validation - Sonnet 4.5
6e589e9a-f6ad-48d1-bf8e-9cfb5d80cd11,anti-phospho-ERK,,,,,PMID:34257279,methods,0.95,"anti-phospho-ERK (mouse, Sigma M8159, 1:2500)",Antibody target name not recognized - includes catalog number,,AI validation - Sonnet 4.5
c2ae3d15-876f-4a44-9e80-67d3797e686d,anti-β-tubulin,,,,,PMID:34257279,methods,0.95,"anti-β-tubulin (mouse, Developmental Studies Hybridoma Bank E7, 1:10,000)",Antibody target name not recognized - includes source and catalog,,AI validation - Sonnet 4.5
8e5b9dbf-0a40-474f-a22a-1628d6ad37fa,rabbit anti-GFP,,,,,PMID:34257279,methods,0.95,"rabbit anti-GFP (Invitrogen, A11122, 1:4000)","Antibody specification not recognized - includes species, vendor, catalog",,AI validation - Sonnet 4.5
01714db8-6106-4af9-8923-da617a928462,pERK antibody,,,,,PMID:34428430,methods,1.0,"primary antibody (pERK, Cell Signaling Technology, #4370, 1:1000",Primary antibody with vendor and catalog number for Western blot,,AI validation - Sonnet 4.5
69764951-bcfc-497b-8606-a78fabf8bdb2,ERK antibody,,,,,PMID:34428430,methods,1.0,"ERK, Cell Signaling Technology, #4696, 1:1000 or Cell Signaling Technology, #4695, 1:1000",Primary antibody with vendor and catalog numbers for Western blot,,AI validation - Sonnet 4.5
60d1cbbc-ec5c-42c5-8ad4-e9b7ffa9d155,β-actin antibody,,,,,PMID:34428430,methods,1.0,"β-actin, Cell Signaling Technology, #3700, 1:1000",Primary antibody with vendor and catalog number for Western blot,,AI validation - Sonnet 4.5
8746b5bf-4f0a-485c-aa82-86acb8911dcf,Nkx2.2 antibody,,,,,PMID:34428430,methods,1.0,"Nkx2.2, Abcam, #ab191077, 1:1000",Primary antibody with vendor and catalog number for immunohistochemistry,,AI validation - Sonnet 4.5
477c9681-062d-4ae3-aa46-07638655e44d,GFAP antibody,,,,,PMID:34428430,methods,1.0,"GFAP, Agilent, #Z0334, 1:2000",Primary antibody with vendor and catalog number for immunohistochemistry,,AI validation - Sonnet 4.5
ff26bcec-d4fc-4556-8b70-2e485e620074,PDGFRα antibody,,,,,PMID:34428430,methods,1.0,"PDGFRα, R&D Systems, #AF1062, 1:1000",Primary antibody with vendor and catalog number for immunohistochemistry,,AI validation - Sonnet 4.5
7817a221-9dec-4ebe-b6ee-9e38dc8449f4,Myrf antibody,,,,,PMID:34428430,methods,1.0,"Myrf, ABclonal, #A16355, 1:1000",Primary antibody with vendor and catalog number for immunohistochemistry,,AI validation - Sonnet 4.5
8a6a22a3-f9f1-4213-8471-14d690ab6091,Monoclonal ANTI-FLAG M2 antibody,,,,,PMID:36420221,methods,1.0,"Flag expression was assessed by western blot (Monoclonal ANTI-FLAG M2 antibody, Sigma-Aldrich, St. Louis, MO).",Antibody with clone designation and vendor not captured,,AI validation - Sonnet 4.5
1e1baea8-1ee4-494e-ba2d-842fe188039c,Phalloidin,,,,,PMID:36420221,methods,1.0,"An actin immunocytochemistry assay was performed to study the cytoskeletal organization after PMO treatment using Phalloidin (Molecular Probes [Eugene, OR], Invitrogen [Waltham, MA]).",Fluorescent probe for actin staining with vendor not captured,,AI validation - Sonnet 4.5
d19feb3e-a84c-4af0-a191-45df296c3bbb,pERK antibody,,,,,PMID:36730269,methods,1.0,The following antibodies were purchased from Cell signaling Technologies: pERK (Catalogue # 4370),Antibody with specific catalog number from Cell Signaling Technologies,,AI validation - Sonnet 4.5
89a7171e-56c6-4117-abec-d3de359aae7d,total ERK antibody,,,,,PMID:36730269,methods,1.0,The following antibodies were purchased from Cell signaling Technologies: total ERK (Catalogue # 9102),Antibody with specific catalog number from Cell Signaling Technologies,,AI validation - Sonnet 4.5
f7a34ce0-9938-4b12-a385-1507e7c1d81c,pAKT antibody,,,,,PMID:36730269,methods,1.0,The following antibodies were purchased from Cell signaling Technologies: pAKT (Catalogue # 4060),Antibody with specific catalog number from Cell Signaling Technologies,,AI validation - Sonnet 4.5
2a757124-3805-4603-9a85-9454f942a77a,total AKT antibody,,,,,PMID:36730269,methods,1.0,The following antibodies were purchased from Cell signaling Technologies: total AKT (Catalogue # 4691),Antibody with specific catalog number from Cell Signaling Technologies,,AI validation - Sonnet 4.5
cd667087-0dc1-41ad-af58-48e1da05af4a,Ubiquitin antibody,,,,,PMID:36730269,methods,1.0,The following antibodies were purchased from Cell signaling Technologies: Ubiquitin (Catalogue # 4289),Antibody with specific catalog number from Cell Signaling Technologies,,AI validation - Sonnet 4.5
f848f1b1-ce67-4a30-92e5-137375e72818,MYC antibody,,,,,PMID:36730269,methods,1.0,The following antibodies were purchased from Cell signaling Technologies: MYC (Catalogue # 18583),Antibody with specific catalog number from Cell Signaling Technologies,,AI validation - Sonnet 4.5
26c3d2cf-93cc-4120-ae3e-1cb9d5ea57a7,pCHEK1 S296 antibody,,,,,PMID:36730269,methods,1.0,The following antibodies were purchased from Cell signaling Technologies: pCHEK1 S296 (Catalogue # 90178),Antibody with specific catalog number from Cell Signaling Technologies,,AI validation - Sonnet 4.5
05ebfbd7-2bd7-49b6-822f-0e84be990612,BMI1 antibody,,,,,PMID:36730269,methods,1.0,The following antibodies were purchased from Cell signaling Technologies: BMI1 (Catalogue # 5856),Antibody with specific catalog number from Cell Signaling Technologies,,AI validation - Sonnet 4.5
1cba3247-113c-4a99-9705-237465f9550b,H3K27Ac antibody,,,,,PMID:36730269,methods,1.0,The following antibodies were purchased from Cell signaling Technologies: H3K27Ac (Catalogue # 8173),Antibody with specific catalog number from Cell Signaling Technologies,,AI validation - Sonnet 4.5
727c47d0-0927-468f-8a6b-953298a4c923,total H3 antibody,,,,,PMID:36730269,methods,1.0,The following antibodies were purchased from Cell signaling Technologies: total H3 (Catalogue # 14269),Antibody with specific catalog number from Cell Signaling Technologies,,AI validation - Sonnet 4.5
