_pmid,_doi,_publicationTitle,_year,_toolName,_toolType,_usageType,publicationId,resourceId,usageId
PMID:38216123,10.1016/j.molmet.2024.101876,NF1 deficiency drives metabolic reprogramming in ER+ breast cancer.,,Matrigel spheroids,advanced_cellular_models,Experimental Usage,,,
PMID:25851896,10.3988/jcn.2015.11.2.172,Preclinical assessment of the anticancer drug response of plexiform neurofibroma tissue using primary cultures.,,primary cultures derived from plexiform neurofibromas,advanced_cellular_models,Experimental Usage,,,
PMID:32461556,10.1038/s41467-020-16432-0,Assessing the origin of high-grade serous ovarian cancer using CRISPR-modification of mouse organoids.,,oviductal organoids,advanced_cellular_models,Development,,,
PMID:32461556,10.1038/s41467-020-16432-0,Assessing the origin of high-grade serous ovarian cancer using CRISPR-modification of mouse organoids.,,OSE organoids,advanced_cellular_models,Development,,,
PMID:41022755 | PMID:26904939,10.1038/s41467-025-63619-4 | 10.1016/j.celrep.2016.01.074,Development of an adeno-associated virus vector for gene replacement therapy of NF1-related tumors. | Insertional Mutagenesis Identifies a STAT3/Arid1b/β-catenin Pathway Driving Neurofibroma Initiation.,,neurofibromaspheres,advanced_cellular_models,Experimental Usage,,,
PMID:23328114,10.18632/oncotarget.793,Genomic imbalance of HMMR/RHAMM regulates the sensitivity and response of malignant peripheral nerve sheath tumour cells to aurora kinase inhibition.,,S462 spheres,advanced_cellular_models,Experimental Usage,,,
PMID:25772366,10.1016/j.celrep.2015.02.041,Mouse low-grade gliomas contain cancer stem cells with unique molecular and functional properties.,,optic glioma neurospheres,advanced_cellular_models,Experimental Usage,,,
PMID:37990867,10.1242/dmm.049861,Neurofibromin 1 mutations impair the function of human induced pluripotent stem cell-derived microglia.,,hiMGL cells,advanced_cellular_models,Development,,,
PMID:36730269,10.1371/journal.pone.0277305,Identification of therapeutic sensitivities in a spheroid drug combination screen of Neurofibromatosis Type I associated High Grade Gliomas.,,spheroid culture system,advanced_cellular_models,Experimental Usage,,,
PMID:40862755,10.3390/cells14161276,Fibroblasts Attenuate Anti-Tumor Drug Efficacy in Tumor Cells via Paracrine Interactions with Tumor Cells in 3D Plexiform Neurofibroma Cultures.,,TAME chips,advanced_cellular_models,Experimental Usage,,,
PMID:40025578,10.1186/s40478-025-01965-6,Development of CAR-T cell therapy for NF1/SWN-related nerve sheath tumor treatment.,,3D tumor spheroid model,advanced_cellular_models,Experimental Usage,,,
PMID:18451155,10.1158/0008-5472.CAN-07-6867,Pten haploinsufficiency accelerates formation of high-grade astrocytomas.,,neurosphere cultures,advanced_cellular_models,Experimental Usage,,,
PMID:39061138,10.3390/cancers16142498,A Fibroblast-Derived Secretome Stimulates the Growth and Invasiveness of 3D Plexiform Neurofibroma Spheroids.,,3D rBM overlay model,advanced_cellular_models,Experimental Usage,,,
PMID:26904939,10.1016/j.celrep.2016.01.074,Insertional Mutagenesis Identifies a STAT3/Arid1b/β-catenin Pathway Driving Neurofibroma Initiation.,,embryonic mouse spheres,advanced_cellular_models,Experimental Usage,,,
PMID:38175707,10.1172/jci.insight.168826,Unbalancing cAMP and Ras/MAPK pathways as a therapeutic strategy for cutaneous neurofibromas.,,neurofibromasphere model,advanced_cellular_models,Experimental Usage,,,
PMID:38744290,10.1016/j.crmeth.2024.100772,A platform for rapid patient-derived cutaneous neurofibroma organoid establishment and screening.,,cNF organoids,advanced_cellular_models,Development,,,
PMID:37246765,10.1093/neuonc/noad097,Ex vivo to in vivo model of malignant peripheral nerve sheath tumors for precision oncology.,,3D microtissues,advanced_cellular_models,Development,,,
PMID:24371224,10.1158/0008-5472.CAN-13-2062,Tumor suppressor alterations cooperate to drive aggressive mesotheliomas with enriched cancer stem cells via a p53-miR-34a-c-Met axis.,,BioCoat Matrigel invasion chambers (Becton Dickinson),advanced_cellular_models,Experimental Usage,,,
PMID:28392281,10.1016/j.expneurol.2017.04.001,Human stem cell modeling in neurofibromatosis type 1 (NF1).,,NF1 patient-derived induced pluripotent stem cells (iPSCs),advanced_cellular_models,Experimental Usage,,,
PMID:31545171,10.7554/eLife.48983,Optical dopamine monitoring with dLight1 reveals mesolimbic phenotypes in a mouse model of neurofibromatosis type 1.,,129T2/SvEmsJ::C57Bl/6NTac Nf1+/- and Nf1+/+,animal_models,Experimental Usage,,,
PMID:32642734,10.1093/noajnl/vdz026,Whole exome sequencing reveals the maintained polyclonal nature from primary to metastatic malignant peripheral nerve sheath tumor in two patients with NF1.,,C57BL6/J Nf1+/−;Trp53+/−,animal_models,Experimental Usage,,,
PMID:35589737,10.1038/s41467-022-30466-6,Neuronal hyperexcitability drives central and peripheral nervous system tumor progression in models of neurofibromatosis-1.,,Nf1 c.5425 C > T ; Arg1809Cys,animal_models,Experimental Usage,,,
PMID:35589737,10.1038/s41467-022-30466-6,Neuronal hyperexcitability drives central and peripheral nervous system tumor progression in models of neurofibromatosis-1.,,R681X Nf1,animal_models,Experimental Usage,,,
PMID:35589737,10.1038/s41467-022-30466-6,Neuronal hyperexcitability drives central and peripheral nervous system tumor progression in models of neurofibromatosis-1.,,Nf1 flox/flox ; Hoxb7-Cre,animal_models,Experimental Usage,,,
PMID:35589737,10.1038/s41467-022-30466-6,Neuronal hyperexcitability drives central and peripheral nervous system tumor progression in models of neurofibromatosis-1.,,Nf1 f/neo ; hGFAP-Cre,animal_models,Experimental Usage,,,
PMID:38216123,10.1016/j.molmet.2024.101876,NF1 deficiency drives metabolic reprogramming in ER+ breast cancer.,,Nf1-IF,animal_models,Experimental Usage,,,
PMID:38216123,10.1016/j.molmet.2024.101876,NF1 deficiency drives metabolic reprogramming in ER+ breast cancer.,,Nf1-PS,animal_models,Experimental Usage,,,
PMID:38216123,10.1016/j.molmet.2024.101876,NF1 deficiency drives metabolic reprogramming in ER+ breast cancer.,,Nf1-IFPS,animal_models,Experimental Usage,,,
PMID:20200958,10.1002/jbmr.42,Local low-dose lovastatin delivery improves the bone-healing defect caused by Nf1 loss of function in osteoblasts.,,Nf1(ob) (-/-),animal_models,Experimental Usage,,,
PMID:20200958,10.1002/jbmr.42,Local low-dose lovastatin delivery improves the bone-healing defect caused by Nf1 loss of function in osteoblasts.,,2.3-kb α1(I) collagen-cre Nf1 flox/flox,animal_models,Experimental Usage,,,
PMID:36890585 | PMID:40684195 | PMID:19191334 | PMID:21439418 | PMID:34935315 | PMID:25772366 | PMID:29847659 | PMID:29787563 | PMID:28525381 | PMID:25535838 | PMID:20200958,10.1186/s40478-023-01525-w | 10.1186/s40478-025-02075-z | 10.1002/glia.20845 | 10.1016/j.bone.2011.03.760 | 10.1117/1.JBO.26.12.125001 | 10.1016/j.celrep.2015.02.041 | 10.1167/iovs.17-22588 | 10.1371/journal.pone.0190001 | 10.18632/oncotarget.17589 | 10.7554/eLife.05151 | 10.1002/jbmr.42,Neurofibromatosis type 1-dependent alterations in mouse microglia function are not cell-intrinsic. | Unraveling the development of cutaneous neurofibromas in neurofibromatosis type 1. | Microarray analyses reveal regional astrocyte heterogeneity with implications for neurofibromatosis type 1 (NF1)-regulated glial proliferation. | Primary osteopathy of vertebrae in a neurofibromatosis type 1 murine model. | Analysis of muscle tissue in vivo using fiber-optic autofluorescence and diffuse reflectance spectroscopy. | Mouse low-grade gliomas contain cancer stem cells with unique molecular and functional properties. | Neurofibromin Deficiency Induces Endothelial Cell Proliferation and Retinal Neovascularization. | Graph complexity analysis identifies an ETV5 tumor-specific network in human and murine low-grade glioma. | The cell of origin dictates the temporal course of neurofibromatosis-1 (Nf1) low-grade glioma formation. | Transient inhibition of the ERK pathway prevents cerebellar developmental defects and improves long-term motor functions in murine models of neurofibromatosis type 1. | Local low-dose lovastatin delivery improves the bone-healing defect caused by Nf1 loss of function in osteoblasts.,,Nf1 flox/flox,animal_models,Experimental Usage,,,
PMID:33078583 | PMID:21681782 | PMID:21551250 | PMID:21726432,10.1002/jcsm.12632 | 10.1002/ajh.22035 | 10.1158/0008-5472.CAN-10-4577 | 10.1186/1741-7015-9-82,Cell autonomous requirement of neurofibromin (Nf1) for postnatal muscle hypertrophic growth and metabolic homeostasis. | Nf1 mutant mice with p19ARF gene loss develop accelerated hematopoietic disease resembling acute leukemia with a variable phenotype. | Susceptible stages in Schwann cells for NF1-associated plexiform neurofibroma development. | MIA is a potential biomarker for tumour load in neurofibromatosis type 1.,,Nf1 flox,animal_models,Experimental Usage,,,
PMID:32781282 | PMID:21199799 | PMID:8582272 | PMID:21949590 | PMID:40590220 | PMID:36890585 | PMID:40684195 | PMID:23071067 | PMID:26190969 | PMID:21439418 | PMID:25772366 | PMID:29847659 | PMID:18242513 | PMID:28525381 | PMID:16835260 | PMID:18632543,10.1016/j.trsl.2020.08.001 | 10.1158/0008-5472.CAN-10-2732 | 10.1242/dev.121.11.3583 | 10.2478/v10134-010-0025-8 | 10.1172/JCI188932 | 10.1186/s40478-023-01525-w | 10.1186/s40478-025-02075-z | 10.1158/0008-5472.CAN-12-1728 | 10.3389/fncel.2015.00234 | 10.1016/j.bone.2011.03.760 | 10.1016/j.celrep.2015.02.041 | 10.1167/iovs.17-22588 | 10.1016/j.ccr.2008.01.003 | 10.18632/oncotarget.17589 | 10.1093/hmg/ddl165 | 10.1001/jama.300.3.287,"Nf1 heterozygous mice recapitulate the anthropometric and metabolic features of human neurofibromatosis type 1. | Dose-dependent effects of focal fractionated irradiation on secondary malignant neoplasms in Nf1 mutant mice. | Neurofibromin-deficient fibroblasts fail to form perineurium in vitro. | ALTERED CALCIUM CURRENTS AND AXONAL GROWTH IN Nf1 HAPLOINSUFFICIENT MICE. | A haploinsufficiency restoration strategy corrects neurobehavioral deficits in Nf1+/- mice. | Neurofibromatosis type 1-dependent alterations in mouse microglia function are not cell-intrinsic. | Unraveling the development of cutaneous neurofibromas in neurofibromatosis type 1. | Genetically mediated Nf1 loss in mice promotes diverse radiation-induced tumors modeling second malignant neoplasms. | In vivo synaptic transmission and morphology in mouse models of Tuberous sclerosis, Fragile X syndrome, Neurofibromatosis type 1, and Costello syndrome. | Primary osteopathy of vertebrae in a neurofibromatosis type 1 murine model. | Mouse low-grade gliomas contain cancer stem cells with unique molecular and functional properties. | Neurofibromin Deficiency Induces Endothelial Cell Proliferation and Retinal Neovascularization. | The loss of Nf1 transiently promotes self-renewal but not tumorigenesis by neural crest stem cells. | The cell of origin dictates the temporal course of neurofibromatosis-1 (Nf1) low-grade glioma formation. | Nf1+/- mast cells induce neurofibroma like phenotypes through secreted TGF-beta signaling. | Effect of simvastatin on cognitive functioning in children with neurofibromatosis type 1: a randomized controlled trial.",,Nf1+/-,animal_models,Experimental Usage,,,
PMID:24595234,10.1371/journal.pone.0090853,In vivo functional analysis of the human NF2 tumor suppressor gene in Drosophila.,,y w Mer4,animal_models,Experimental Usage,,,
PMID:24595234,10.1371/journal.pone.0090853,In vivo functional analysis of the human NF2 tumor suppressor gene in Drosophila.,,4/FM7; T80-Gal4 y w Mer4,animal_models,Experimental Usage,,,
PMID:30479396,10.1038/s41467-018-07452-y,NF1 heterozygosity fosters de novo tumorigenesis but impairs malignant transformation.,,PLP CreERT2; Nf1 f/−; ROSA-LacZ,animal_models,Experimental Usage,,,
PMID:34935315 | PMID:24465906 | PMID:21726432,10.1117/1.JBO.26.12.125001 | 10.1371/journal.pone.0086115 | 10.1186/1741-7015-9-82,"Analysis of muscle tissue in vivo using fiber-optic autofluorescence and diffuse reflectance spectroscopy. | Multiscale, converging defects of macro-porosity, microstructure and matrix mineralization impact long bone fragility in NF1. | MIA is a potential biomarker for tumour load in neurofibromatosis type 1.",,Nf1Prx1-/-,animal_models,Experimental Usage,,,
PMID:21963652 | PMID:19191334 | PMID:23225063 | PMID:25772366,10.1016/j.expneurol.2011.09.005 | 10.1002/glia.20845 | 10.1002/ana.23793 | 10.1016/j.celrep.2015.02.041,PET imaging for attention deficit preclinical drug testing in neurofibromatosis-1 mice. | Microarray analyses reveal regional astrocyte heterogeneity with implications for neurofibromatosis type 1 (NF1)-regulated glial proliferation. | Dopamine deficiency underlies learning deficits in neurofibromatosis-1 mice. | Mouse low-grade gliomas contain cancer stem cells with unique molecular and functional properties.,,Nf1+/− GFAP CKO,animal_models,Experimental Usage,,,
PMID:21439418,10.1016/j.bone.2011.03.760,Primary osteopathy of vertebrae in a neurofibromatosis type 1 murine model.,,Nf1(flox/-);Col2.3Cre(+),animal_models,Development,,,
PMID:38502231 | PMID:34010628,10.1172/JCI176748 | 10.1016/j.stem.2021.04.029,STING activation reprograms the microenvironment to sensitize NF1-related malignant peripheral nerve sheath tumors for immunotherapy. | Stem-like cells drive NF1-associated MPNST functional heterogeneity and tumor progression.,,cisNP,animal_models,Experimental Usage,,,
PMID:39129390,10.1002/1878-0261.13704,Inhibition of autophagy as a novel treatment for neurofibromatosis type 1 tumors.,,y [1] sc[*] v [1] sev [21]; P{y[+t7.7] v[+t1.8] = TKO.GS01796}attP40,animal_models,Experimental Usage,,,
PMID:39129390,10.1002/1878-0261.13704,Inhibition of autophagy as a novel treatment for neurofibromatosis type 1 tumors.,,P{ KK101909 }VIE‐260B,animal_models,Experimental Usage,,,
PMID:30571760,10.1371/journal.pone.0208835,Neurofibromin haploinsufficiency results in altered spermatogenesis in a mouse model of neurofibromatosis type 1.,,Nf1Dsk9/+,animal_models,Experimental Usage,,,
PMID:29408605,10.1016/j.neuroscience.2018.01.054,Nf2 Mutation in Schwann Cells Delays Functional Neural Recovery Following Injury.,,P0SchΔ39-121,animal_models,Experimental Usage,,,
PMID:38931352,10.3390/ph17060685,PET Imaging of Neurofibromatosis Type 1 with a Fluorine-18 Labeled Tryptophan Radiotracer.,,"Trp53, Nf1, Suz12 triple mutant",animal_models,Experimental Usage,,,
PMID:8582272,10.1242/dev.121.11.3583,Neurofibromin-deficient fibroblasts fail to form perineurium in vitro.,,C57BL/6J,animal_models,Experimental Usage,,,
PMID:33442015 | PMID:31527226 | PMID:33658640 | PMID:38127282,10.1038/s41591-020-01193-6 | 10.1158/1535-7163.MCT-19-0123 | 10.1038/s41416-021-01270-8 | 10.1158/1078-0432.CCR-23-2548,"Cabozantinib for neurofibromatosis type 1-related plexiform neurofibromas: a phase 2 trial. | Ketotifen Modulates Mast Cell Chemotaxis to Kit-Ligand, but Does Not Impact Mast Cell Numbers, Degranulation, or Tumor Behavior in Neurofibromas of | Exploring transcriptional regulators Ref-1 and STAT3 as therapeutic targets in malignant peripheral nerve sheath tumours. | Spatial Gene-Expression Profiling Unveils Immuno-oncogenic Programs of NF1-Associated Peripheral Nerve Sheath Tumor Progression.",,Nf1flox/flox;PostnCre,animal_models,Experimental Usage,,,
PMID:36322658,10.1126/sciadv.abo5442,Single-cell multiomics identifies clinically relevant mesenchymal stem-like cells and key regulators for MPNST malignancy.,,NF1 fl/fl Tp53 fl/fl Eed fl/fl;Dhh-Cre,animal_models,Experimental Usage,,,
PMID:37520682,10.1016/j.omtn.2023.06.018,Combining nonsense mutation suppression therapy with nonsense-mediated decay inhibition in neurofibromatosis type 1.,,NF1 R1947/+,animal_models,Development,,,
PMID:34040258,10.1038/s41586-021-03580-6,NF1 mutation drives neuronal activity-dependent initiation of optic glioma.,,Nf1fl/fl,animal_models,Experimental Usage,,,
PMID:34040258,10.1038/s41586-021-03580-6,NF1 mutation drives neuronal activity-dependent initiation of optic glioma.,,OPG Nf1fl/mut (Nf1+/−),animal_models,Experimental Usage,,,
PMID:22901811,10.1016/j.cell.2012.06.034,ERK inhibition rescues defects in fate specification of Nf1-deficient neural progenitors and brain abnormalities.,,Nf1 hGFAP CKO,animal_models,Experimental Usage,,,
PMID:22901811,10.1016/j.cell.2012.06.034,ERK inhibition rescues defects in fate specification of Nf1-deficient neural progenitors and brain abnormalities.,,Nf1 NcreER CKO,animal_models,Experimental Usage,,,
PMID:21681782,10.1002/ajh.22035,Nf1 mutant mice with p19ARF gene loss develop accelerated hematopoietic disease resembling acute leukemia with a variable phenotype.,,Nf1 fcr,animal_models,Experimental Usage,,,
PMID:36730269,10.1371/journal.pone.0277305,Identification of therapeutic sensitivities in a spheroid drug combination screen of Neurofibromatosis Type I associated High Grade Gliomas.,,NPcis,animal_models,Experimental Usage,,,
PMID:20554030,10.1016/j.jneuroim.2010.05.002,CXCL12 alone is insufficient for gliomagenesis in Nf1 mutant mice.,,"Nf1 flox/mut; GFAP-Cre, Nf1+/− GFAP CKO",animal_models,Experimental Usage,,,
PMID:34257279,10.1038/s41467-021-24505-x,Neurofibromin regulates metabolic rate via neuronal mechanisms in Drosophila.,,Nf1 P1,animal_models,Experimental Usage,,,
PMID:41444363,10.1038/s41598-025-32031-9,Focused ultrasound-mediated drug delivery of bevacizumab in treating NF2-related schwannomatosis in an animal model.,,Postn-Cre; Nf2flox/flox,animal_models,Experimental Usage,,,
PMID:41444363 | PMID:24817309,10.1038/s41598-025-32031-9 | 10.1371/journal.pone.0097320,Focused ultrasound-mediated drug delivery of bevacizumab in treating NF2-related schwannomatosis in an animal model. | Nf2/Merlin controls spinal cord neural progenitor function in a Rac1/ErbB2-dependent manner.,,Nf2flox/flox,animal_models,Experimental Usage,,,
PMID:41036607,10.1158/1535-7163.MCT-24-1053,Pharmacogenomic Synthetic Lethal Screens Reveal Hidden Vulnerabilities and New Therapeutic Approaches for Treatment of NF1-Associated Tumors.,,"Dhh::Cre, Nf1fl/fl, Pten",animal_models,Experimental Usage,,,
PMID:18451155,10.1158/0008-5472.CAN-07-6867,Pten haploinsufficiency accelerates formation of high-grade astrocytomas.,,Mut3,animal_models,Experimental Usage,,,
PMID:18451155,10.1158/0008-5472.CAN-07-6867,Pten haploinsufficiency accelerates formation of high-grade astrocytomas.,,Mut4,animal_models,Experimental Usage,,,
PMID:21216928 | PMID:26883872 | PMID:20551058,10.1158/1535-7163.MCT-10-0654 | 10.1016/j.jprot.2016.02.004 | 10.1158/0008-5472.CAN-09-3769,Interpreting mammalian target of rapamycin and cell growth inhibition in a genetically engineered mouse model of Nf1-deficient astrocytes. | 3-D imaging mass spectrometry of protein distributions in mouse Neurofibromatosis 1 (NF1)-associated optic glioma. | Cyclic AMP suppression is sufficient to induce gliomagenesis in a mouse model of neurofibromatosis-1.,,Nf1 flox/flox; GFAP-Cre,animal_models,Experimental Usage,,,
PMID:28029918,10.1056/NEJMoa1605943,Activity of Selumetinib in Neurofibromatosis Type 1-Related Plexiform Neurofibromas.,,DhhCre;Nf1fl/fl,animal_models,Experimental Usage,,,
PMID:24465906,10.1371/journal.pone.0086115,"Multiscale, converging defects of macro-porosity, microstructure and matrix mineralization impact long bone fragility in NF1.",,Nf1Col1,animal_models,Experimental Usage,,,
PMID:28256556 | PMID:26904939,10.1038/srep43315 | 10.1016/j.celrep.2016.01.074,An inflammatory gene signature distinguishes neurofibroma Schwann cells and macrophages from cells in the normal peripheral nervous system. | Insertional Mutagenesis Identifies a STAT3/Arid1b/β-catenin Pathway Driving Neurofibroma Initiation.,,Nf1fl/fl;DhhCre,animal_models,Experimental Usage,,,
PMID:26904939,10.1016/j.celrep.2016.01.074,Insertional Mutagenesis Identifies a STAT3/Arid1b/β-catenin Pathway Driving Neurofibroma Initiation.,,Stat3(fl/fl);Nf1(fl/fl);DhhCre,animal_models,Experimental Usage,,,
PMID:34010628,10.1016/j.stem.2021.04.029,Stem-like cells drive NF1-associated MPNST functional heterogeneity and tumor progression.,,Nf1f/f;Trp53f/f;Nes-TK,animal_models,Experimental Usage,,,
PMID:34010628,10.1016/j.stem.2021.04.029,Stem-like cells drive NF1-associated MPNST functional heterogeneity and tumor progression.,,Nf1f/f;Trp53f/f;CGD,animal_models,Experimental Usage,,,
PMID:32839340 | PMID:18242513,10.1073/pnas.2008391117 | 10.1016/j.ccr.2008.01.003,Brain-wide structural and functional disruption in mice with oligodendrocyte-specific | The loss of Nf1 transiently promotes self-renewal but not tumorigenesis by neural crest stem cells.,,Nf1 fl/+,animal_models,Experimental Usage,,,
PMID:18242513,10.1016/j.ccr.2008.01.003,The loss of Nf1 transiently promotes self-renewal but not tumorigenesis by neural crest stem cells.,,Nf1/p53-/-,animal_models,Experimental Usage,,,
PMID:24386979,10.1186/1471-2407-14-6,"Modulation of Ras signaling alters the toxicity of hydroquinone, a benzene metabolite and component of cigarette smoke.",,"Mx1-Cre, Nf1 flox/flox",animal_models,Experimental Usage,,,
PMID:25917366,10.1038/mp.2015.48,HCN channels are a novel therapeutic target for cognitive dysfunction in Neurofibromatosis type 1.,,9a−/9a− Nf1,animal_models,Experimental Usage,,,
PMID:29787563,10.1371/journal.pone.0190001,Graph complexity analysis identifies an ETV5 tumor-specific network in human and murine low-grade glioma.,,Nf1flox/null; GFAP-Cre,animal_models,Experimental Usage,,,
PMID:29787563,10.1371/journal.pone.0190001,Graph complexity analysis identifies an ETV5 tumor-specific network in human and murine low-grade glioma.,,Nf1flox/R681*; GFAP-Cre,animal_models,Experimental Usage,,,
PMID:29787563,10.1371/journal.pone.0190001,Graph complexity analysis identifies an ETV5 tumor-specific network in human and murine low-grade glioma.,,Nf1flox/null; Ptenflox/wt; GFAP-Cre,animal_models,Experimental Usage,,,
PMID:29787563,10.1371/journal.pone.0190001,Graph complexity analysis identifies an ETV5 tumor-specific network in human and murine low-grade glioma.,,Nf1flox/null; Olig2-Cre,animal_models,Experimental Usage,,,
PMID:35393510,10.1038/s41418-022-00991-4,Tumor growth of neurofibromin-deficient cells is driven by decreased respiration and hampered by NAD,,cis Nf1+/−;P53+/−,animal_models,Experimental Usage,,,
PMID:17924978 | PMID:38945076,10.1111/j.1750-3639.2007.00105.x | 10.1016/j.redox.2024.103249,Natural history of meningioma development in mice reveals: a synergy of Nf2 and p16(Ink4a) mutations. | Selective nitration of Hsp90 acts as a metabolic switch promoting tumor cell proliferation.,,Nf2 flox2/flox2,animal_models,Experimental Usage,,,
PMID:17924978,10.1111/j.1750-3639.2007.00105.x,Natural history of meningioma development in mice reveals: a synergy of Nf2 and p16(Ink4a) mutations.,,Nf2 flox2/flox2 ;p16 Ink4a*/*,animal_models,Experimental Usage,,,
PMID:37140985,10.1172/JCI168227,Basement membrane proteins in extracellular matrix characterize NF1 neurofibroma development and response to MEK inhibitor.,,H7;Nf1mut,animal_models,Experimental Usage,,,
PMID:24375753 | PMID:20551058 | PMID:28525381,10.1002/ana.24093 | 10.1158/0008-5472.CAN-09-3769 | 10.18632/oncotarget.17589,Sex Is a major determinant of neuronal dysfunction in neurofibromatosis type 1. | Cyclic AMP suppression is sufficient to induce gliomagenesis in a mouse model of neurofibromatosis-1. | The cell of origin dictates the temporal course of neurofibromatosis-1 (Nf1) low-grade glioma formation.,,Nf1flox/mut;GFAP-Cre,animal_models,Experimental Usage,,,
PMID:38127282,10.1158/1078-0432.CCR-23-2548,Spatial Gene-Expression Profiling Unveils Immuno-oncogenic Programs of NF1-Associated Peripheral Nerve Sheath Tumor Progression.,,DhhCre,animal_models,Experimental Usage,,,
PMID:38127282,10.1158/1078-0432.CCR-23-2548,Spatial Gene-Expression Profiling Unveils Immuno-oncogenic Programs of NF1-Associated Peripheral Nerve Sheath Tumor Progression.,,Nf1flox/flox;Arf flox/flox;PostnCre+,animal_models,Experimental Usage,,,
PMID:28525381,10.18632/oncotarget.17589,The cell of origin dictates the temporal course of neurofibromatosis-1 (Nf1) low-grade glioma formation.,,Nf1flox/wt,animal_models,Experimental Usage,,,
PMID:28525381,10.18632/oncotarget.17589,The cell of origin dictates the temporal course of neurofibromatosis-1 (Nf1) low-grade glioma formation.,,Nf1flox/mut,animal_models,Experimental Usage,,,
PMID:28525381,10.18632/oncotarget.17589,The cell of origin dictates the temporal course of neurofibromatosis-1 (Nf1) low-grade glioma formation.,,Nf1flox/flox; Olig2-Cre,animal_models,Experimental Usage,,,
PMID:28525381,10.18632/oncotarget.17589,The cell of origin dictates the temporal course of neurofibromatosis-1 (Nf1) low-grade glioma formation.,,Nf1flox/mut; Olig2-Cre,animal_models,Experimental Usage,,,
PMID:28525381,10.18632/oncotarget.17589,The cell of origin dictates the temporal course of neurofibromatosis-1 (Nf1) low-grade glioma formation.,,Nf1flox/flox; Prom1-CreER,animal_models,Experimental Usage,,,
PMID:28525381,10.18632/oncotarget.17589,The cell of origin dictates the temporal course of neurofibromatosis-1 (Nf1) low-grade glioma formation.,,Nf1flox/mut; Prom1-CreER,animal_models,Experimental Usage,,,
PMID:35789380,10.1158/2159-8290.CD-21-1671,PRC2-Inactivating Mutations in Cancer Enhance Cytotoxic Response to DNMT1-Targeted Therapy via Enhanced Viral Mimicry.,,PLP-CreERT:: Nf1 f/f ; Cdkn2a f/f,animal_models,Experimental Usage,,,
PMID:36148553,10.1093/brain/awac342,Inhibition of YAP/TAZ-driven TEAD activity prevents growth of NF2-null schwannoma and meningioma.,,Periostin-CRE;NF2 fl/fl,animal_models,Experimental Usage,,,
