resourceId,resourceName,resourceType,synonyms,rrid,description,aiSummary,usageRequirements,howToAcquire,dateAdded,dateModified,animalModelId,antibodyId,cellLineId,geneticReagentId,biobankId,_pmid,_doi,_publicationTitle,_year,_confidence,_toolType
14909473-2fb4-5ed1-b829-ff132be20653,SNF96.2,Cell Line,,RRID:CVCL_K281,,,,,,,,,,,,PMID:39269317 | PMID:23175151 | PMID:29438698 | PMID:40025578 | PMID:36322658 | PMID:35511749 | PMID:32642733 | PMID:38216572,10.1158/1078-0432.CCR-24-1750 | 10.1038/bjc.2012.518 | 10.1016/j.ccell.2018.01.005 | 10.1186/s40478-025-01965-6 | 10.1126/sciadv.abo5442 | 10.1158/1535-7163.MCT-21-0947 | 10.1093/noajnl/vdz061 | 10.1038/s41467-024-44755-9,MEK Inhibitors Lead to PDGFR Pathway Upregulation and Sensitize Tumors to RAF Dimer Inhibitors in NF1-Deficient Malignant Peripheral Nerve Sheath Tumor. | MicroRNA profiling of peripheral nerve sheath tumours identifies miR-29c as a tumour suppressor gene involved in tumour progression. | Programming of Schwann Cells by Lats1/2-TAZ/YAP Signaling Drives Malignant Peripheral Nerve Sheath Tumorigenesis. | Development of CAR-T cell therapy for NF1/SWN-related nerve sheath tumor treatment. | Single-cell multiomics identifies clinically relevant mesenchymal stem-like cells and key regulators for MPNST malignancy. | A High-Throughput Screening Platform Identifies Novel Combination Treatments for Malignant Peripheral Nerve Sheath Tumors. | KIF11 and KIF15 mitotic kinesins are potential therapeutic vulnerabilities for malignant peripheral nerve sheath tumors. | Functional interactions between neurofibromatosis tumor suppressors underlie Schwann cell tumor de-differentiation and treatment resistance.,,0.95,cell_line
733801bc-7188-503b-8116-384c9879b9f3,ST88-14,Cell Line,,RRID:CVCL_8916,,,,,,,,,,,,PMID:38201517 | PMID:41022755 | PMID:39269317 | PMID:18367665 | PMID:37246765 | PMID:33658640 | PMID:24824755 | PMID:39129390 | PMID:18413802 | PMID:24681606 | PMID:23685747 | PMID:20049725 | PMID:32642733 | PMID:18483311 | PMID:38127282 | PMID:38216572 | PMID:38203448 | PMID:23535903 | PMID:41036607 | PMID:33032988,10.3390/cancers16010089 | 10.1038/s41467-025-63619-4 | 10.1158/1078-0432.CCR-24-1750 | 10.1124/jpet.107.135830 | 10.1093/neuonc/noad097 | 10.1038/s41416-021-01270-8 | 10.1371/journal.pone.0096733 | 10.1002/1878-0261.13704 | 10.1158/1535-7163.MCT-07-0518 | 10.18632/oncotarget.1609 | 10.1038/ng.2641 | 10.1002/emmm.200900027 | 10.1093/noajnl/vdz061 | 10.1158/1535-7163.MCT-07-2335 | 10.1158/1078-0432.CCR-23-2548 | 10.1038/s41467-024-44755-9 | 10.3390/ijms25010277 | 10.1158/2159-8290.CD-13-0081 | 10.1158/1535-7163.MCT-24-1053 | 10.1158/0008-5472.CAN-20-1365,"Synergistic Suppression of NF1 Malignant Peripheral Nerve Sheath Tumor Cell Growth in Culture and Orthotopic Xenografts by Combinational Treatment with Statin and Prodrug Farnesyltransferase Inhibitor PAMAM G4 Dendrimers. | Development of an adeno-associated virus vector for gene replacement therapy of NF1-related tumors. | MEK Inhibitors Lead to PDGFR Pathway Upregulation and Sensitize Tumors to RAF Dimer Inhibitors in NF1-Deficient Malignant Peripheral Nerve Sheath Tumor. | Induction of apoptosis in neurofibromatosis type 1 malignant peripheral nerve sheath tumor cell lines by a combination of novel farnesyl transferase inhibitors and lovastatin. | Ex vivo to in vivo model of malignant peripheral nerve sheath tumors for precision oncology. | Exploring transcriptional regulators Ref-1 and STAT3 as therapeutic targets in malignant peripheral nerve sheath tumours. | BNIP3 regulates AT101 [(-)-gossypol] induced death in malignant peripheral nerve sheath tumor cells. | Inhibition of autophagy as a novel treatment for neurofibromatosis type 1 tumors. | Sorafenib inhibits growth and mitogen-activated protein kinase signaling in malignant peripheral nerve sheath cells. | Co-targeting the MAPK and PI3K/AKT/mTOR pathways in two genetically engineered mouse models of schwann cell tumors reduces tumor grade and multiplicity. | Forward genetic screen for malignant peripheral nerve sheath tumor formation identifies new genes and pathways driving tumorigenesis. | Integrative genomic analyses of neurofibromatosis tumours identify SOX9 as a biomarker and survival gene. | KIF11 and KIF15 mitotic kinesins are potential therapeutic vulnerabilities for malignant peripheral nerve sheath tumors. | Effective in vivo targeting of the mammalian target of rapamycin pathway in malignant peripheral nerve sheath tumors. | Spatial Gene-Expression Profiling Unveils Immuno-oncogenic Programs of NF1-Associated Peripheral Nerve Sheath Tumor Progression. | Functional interactions between neurofibromatosis tumor suppressors underlie Schwann cell tumor de-differentiation and treatment resistance. | FT895 Impairs Mitochondrial Function in Malignant Peripheral Nerve Sheath Tumor Cells. | Canonical Wnt/β-catenin signaling drives human schwann cell transformation, progression, and tumor maintenance. | Pharmacogenomic Synthetic Lethal Screens Reveal Hidden Vulnerabilities and New Therapeutic Approaches for Treatment of NF1-Associated Tumors. | Combined Inhibition of SHP2 and MEK Is Effective in Models of NF1-Deficient Malignant Peripheral Nerve Sheath Tumors.",,0.95,cell_line
d101dfd6-6d34-512a-8c60-671a059abad3,ST88-3,Cell Line,,RRID:CVCL_IU70,,,,,,,,,,,,PMID:18483311,10.1158/1535-7163.MCT-07-2335,Effective in vivo targeting of the mammalian target of rapamycin pathway in malignant peripheral nerve sheath tumors.,,0.9,cell_line
857f7dbe-27ac-5f60-80de-aa12f7080a95,STS26T,Cell Line,,RRID:CVCL_8917,,,,,,,,,,,,PMID:36322658 | PMID:37164978 | PMID:24681606 | PMID:23685747 | PMID:20049725 | PMID:32642733 | PMID:18483311 | PMID:38203448 | PMID:37410426 | PMID:23535903 | PMID:35511749 | PMID:33032988,10.1126/sciadv.abo5442 | 10.1038/s41467-023-38432-6 | 10.18632/oncotarget.1609 | 10.1038/ng.2641 | 10.1002/emmm.200900027 | 10.1093/noajnl/vdz061 | 10.1158/1535-7163.MCT-07-2335 | 10.3390/ijms25010277 | 10.1158/1078-0432.CCR-23-0749 | 10.1158/2159-8290.CD-13-0081 | 10.1158/1535-7163.MCT-21-0947 | 10.1158/0008-5472.CAN-20-1365,"Single-cell multiomics identifies clinically relevant mesenchymal stem-like cells and key regulators for MPNST malignancy. | Multiplatform molecular profiling uncovers two subgroups of malignant peripheral nerve sheath tumors with distinct therapeutic vulnerabilities. | Co-targeting the MAPK and PI3K/AKT/mTOR pathways in two genetically engineered mouse models of schwann cell tumors reduces tumor grade and multiplicity. | Forward genetic screen for malignant peripheral nerve sheath tumor formation identifies new genes and pathways driving tumorigenesis. | Integrative genomic analyses of neurofibromatosis tumours identify SOX9 as a biomarker and survival gene. | KIF11 and KIF15 mitotic kinesins are potential therapeutic vulnerabilities for malignant peripheral nerve sheath tumors. | Effective in vivo targeting of the mammalian target of rapamycin pathway in malignant peripheral nerve sheath tumors. | FT895 Impairs Mitochondrial Function in Malignant Peripheral Nerve Sheath Tumor Cells. | CDK4/6-MEK Inhibition in MPNSTs Causes Plasma Cell Infiltration, Sensitization to PD-L1 Blockade, and Tumor Regression. | Canonical Wnt/β-catenin signaling drives human schwann cell transformation, progression, and tumor maintenance. | A High-Throughput Screening Platform Identifies Novel Combination Treatments for Malignant Peripheral Nerve Sheath Tumors. | Combined Inhibition of SHP2 and MEK Is Effective in Models of NF1-Deficient Malignant Peripheral Nerve Sheath Tumors.",,0.9,cell_line
33995551-b2f8-566f-bbba-cb638a12ba6b,T265,Cell Line,,RRID:CVCL_S805,,,,,,,,,,,,PMID:36322658 | PMID:37164978 | PMID:24681606 | PMID:23685747 | PMID:30055648 | PMID:41001593 | PMID:38203448 | PMID:32948135 | PMID:23535903,10.1126/sciadv.abo5442 | 10.1038/s41467-023-38432-6 | 10.18632/oncotarget.1609 | 10.1038/ng.2641 | 10.1186/s13104-018-3630-0 | 10.1080/23723556.2025.2561292 | 10.3390/ijms25010277 | 10.1186/s12885-020-07397-w | 10.1158/2159-8290.CD-13-0081,"Single-cell multiomics identifies clinically relevant mesenchymal stem-like cells and key regulators for MPNST malignancy. | Multiplatform molecular profiling uncovers two subgroups of malignant peripheral nerve sheath tumors with distinct therapeutic vulnerabilities. | Co-targeting the MAPK and PI3K/AKT/mTOR pathways in two genetically engineered mouse models of schwann cell tumors reduces tumor grade and multiplicity. | Forward genetic screen for malignant peripheral nerve sheath tumor formation identifies new genes and pathways driving tumorigenesis. | Testing ATRA and MEK inhibitor PD0325901 effectiveness in a nude mouse model for human MPNST xenografts. | Loss of Schwann cell's normal rhythmic core clock gene expression and gain of rhythmic expression of oncogenic driver genes in malignant NF1-associated peripheral nerve sheath tumor. | FT895 Impairs Mitochondrial Function in Malignant Peripheral Nerve Sheath Tumor Cells. | Anti-cancer agent 3-bromopyruvate reduces growth of MPNST and inhibits metabolic pathways in a representative in-vitro model. | Canonical Wnt/β-catenin signaling drives human schwann cell transformation, progression, and tumor maintenance.",,0.9,cell_line
bcd30b69-1586-5ceb-abe5-4b9e19466fe4,T265-2c,Cell Line,,RRID:CVCL_S805,,,,,,,,,,,,PMID:24824755,10.1371/journal.pone.0096733,BNIP3 regulates AT101 [(-)-gossypol] induced death in malignant peripheral nerve sheath tumor cells.,,0.9,cell_line
d6faa9df-da18-5590-9ecc-1f9eee8532f9,T265p21,Cell Line,,RRID:CVCL_S805,,,,,,,,,,,,PMID:18483311,10.1158/1535-7163.MCT-07-2335,Effective in vivo targeting of the mammalian target of rapamycin pathway in malignant peripheral nerve sheath tumors.,,0.9,cell_line
3549582f-ff39-5bfd-9c26-00e57d7805ae,T98G,Cell Line,,RRID:CVCL_0556,,,,,,,,,,,,PMID:38714355,10.1158/1535-7163.MCT-23-0510,MEK Inhibition Enhances the Antitumor Effect of Radiotherapy in NF1-Deficient Glioblastoma.,,0.8,cell_line
ac5786d9-0742-5caf-a7fc-62296288ec15,tail-tip fibroblasts (TTFs),Cell Line,,,,,,,,,,,,,,PMID:28392281,10.1016/j.expneurol.2017.04.001,Human stem cell modeling in neurofibromatosis type 1 (NF1).,,0.9,cell_line
520833a7-34e9-5a8b-aa08-c19e79dc0612,TC620 human oligodendroglioma,Cell Line,,,,,,,,,,,,,,PMID:29715273,10.1371/journal.pone.0196726,Neurofibromatosis type 2 tumor suppressor protein is expressed in oligodendrocytes and regulates cell proliferation and process formation.,,0.9,cell_line
274be0a0-e9df-5860-8892-72cb9887d099,TM-31,Cell Line,,RRID:CVCL_6735,,,,,,,,,,,,PMID:36730269,10.1371/journal.pone.0277305,Identification of therapeutic sensitivities in a spheroid drug combination screen of Neurofibromatosis Type I associated High Grade Gliomas.,,0.95,cell_line
295395e8-095c-58b4-bd92-9b5178a341a4,Tni-FNL,Cell Line,,RRID:CVCL_RY32,,,,,,,,,,,,PMID:31836666,10.1074/jbc.RA119.010934,Biochemical and structural analyses reveal that the tumor suppressor neurofibromin (NF1) forms a high-affinity dimer.,,0.9,cell_line
90ede777-afc9-5311-b681-ce6333eae4cb,TOP-10F',Cell Line,,,,,,,,,,,,,,PMID:12057013,10.1186/1471-2164-3-13,Complex splicing pattern generates great diversity in human NF1 transcripts.,,0.85,cell_line
07eab8f2-f28c-5ea9-b326-a0c94aa93543,U251,Cell Line,,RRID:CVCL_0021,,,,,,,,,,,,PMID:32419643 | PMID:33934112 | PMID:25043298,10.1177/1533033820919759 | 10.1038/s41419-021-03716-6 | 10.1038/onc.2014.185,Long Noncoding RNA WT1-AS Inhibit Cell Malignancy via miR-494-3p in Glioma. | HIF1α-dependent induction of the mitochondrial chaperone TRAP1 regulates bioenergetic adaptations to hypoxia. | Oncogenic role of Merlin/NF2 in glioblastoma.,,0.9,cell_line
13cfbf4b-7b85-5529-81fd-0799e3d00ab7,U2OS,Cell Line,,RRID:CVCL_0042,,,,,,,,,,,,PMID:30531922,10.1038/s41591-018-0263-8,The molecular landscape of glioma in patients with Neurofibromatosis 1.,,0.85,cell_line
9bffcee2-110a-5f30-a83f-5349091ab434,U87-MG,Cell Line,,RRID:CVCL_0022,,,,,,,,,,,,PMID:28166733,10.1186/s12864-017-3519-7,A machine learning classifier trained on cancer transcriptomes detects NF1 inactivation signal in glioblastoma.,,0.95,cell_line
2286ee1a-9330-5bf4-ab3c-c46362e5d070,WM3918,Cell Line,,RRID:CVCL_C279,,,,,,,,,,,,PMID:33032988,10.1158/0008-5472.CAN-20-1365,Combined Inhibition of SHP2 and MEK Is Effective in Models of NF1-Deficient Malignant Peripheral Nerve Sheath Tumors.,,0.85,cell_line
00a4afb5-a6d7-5227-9041-942a7781cddc,WT-1 hiPSC line,Cell Line,,,,,,,,,,,,,,PMID:38481529,10.3389/fcell.2024.1359561,Generation of heterozygous and homozygous NF1 lines from human-induced pluripotent stem cells using CRISPR/Cas9 to investigate bone defects associated with neurofibromatosis type 1.,,0.85,cell_line
6ea53b58-c0ec-519b-8b9d-eff75a906795,WT-2 hiPSC line,Cell Line,,,,,,,,,,,,,,PMID:38481529,10.3389/fcell.2024.1359561,Generation of heterozygous and homozygous NF1 lines from human-induced pluripotent stem cells using CRISPR/Cas9 to investigate bone defects associated with neurofibromatosis type 1.,,0.85,cell_line
73fcc875-6ee3-59bb-8aa3-9fe75b50d858,YST1,Cell Line,,,,,,,,,,,,,,PMID:20049725 | PMID:18483311,10.1002/emmm.200900027 | 10.1158/1535-7163.MCT-07-2335,Integrative genomic analyses of neurofibromatosis tumours identify SOX9 as a biomarker and survival gene. | Effective in vivo targeting of the mammalian target of rapamycin pathway in malignant peripheral nerve sheath tumors.,,0.9,cell_line
e569d9f6-0608-5741-ba68-3259feacc272,φNX packaging,Cell Line,,,,,,,,,,,,,,PMID:21072183,10.1371/journal.pone.0013791,p21-Activated kinases are required for transformation in a cell-based model of neurofibromatosis type 2.,,0.85,cell_line
bd963f64-921c-550d-9232-3c624b167c15,BoN (Burden of NF1) questionnaire,Clinical Assessment Tool,,,,,,,,,,,,,,PMID:31053133,10.1186/s13023-019-1067-8,Burden of adult neurofibromatosis 1: development and validation of a burden assessment tool.,,0.95,clinical_assessment_tool
e4d24f91-9ec0-5c15-bccb-11594e0f2602,Cardiff acuity cards,Clinical Assessment Tool,,,,,,,,,,,,,,PMID:38990917,10.1371/journal.pone.0305548,Optical coherence tomography of the macular ganglion cell layer in children with neurofibromatosis type 1 is a useful tool in the assessment for optic pathway gliomas.,,0.85,clinical_assessment_tool
57f38f1c-aef0-5b8b-a0d6-1150edeeab07,Cirrus HD-OCT,Clinical Assessment Tool,,,,,,,,,,,,,,PMID:38990917,10.1371/journal.pone.0305548,Optical coherence tomography of the macular ganglion cell layer in children with neurofibromatosis type 1 is a useful tool in the assessment for optic pathway gliomas.,,0.9,clinical_assessment_tool
41690aa7-93cc-5c85-8579-9367d647b0b1,cNF-Skindex,Clinical Assessment Tool,,,,,,,,,,,,,,PMID:38811427,10.1186/s41687-024-00732-w,Quality of life in individuals with neurofibromatosis type 1 associated cutaneous neurofibromas: validation of the Dutch cNF-Skindex.,,0.95,clinical_assessment_tool
d3b1dfbf-71ee-5e64-aa45-833969852d65,Dermatology Life Quality Index (DLQI),Clinical Assessment Tool,,,,,,,,,,,,,,PMID:31053133,10.1186/s13023-019-1067-8,Burden of adult neurofibromatosis 1: development and validation of a burden assessment tool.,,0.9,clinical_assessment_tool
cbb461af-25d6-591f-864c-b4808d7d6989,Humphrey Field Analyzer perimetry,Clinical Assessment Tool,,,,,,,,,,,,,,PMID:38990917,10.1371/journal.pone.0305548,Optical coherence tomography of the macular ganglion cell layer in children with neurofibromatosis type 1 is a useful tool in the assessment for optic pathway gliomas.,,0.9,clinical_assessment_tool
8d085b33-a06f-5476-957f-c1d438011c8c,Impact of NF1 on Quality Of Life (INF1-QOL) questionnaire,Clinical Assessment Tool,,,,,,,,,,,,,,PMID:28193237,10.1186/s12955-017-0607-y,Evaluation of quality of life in adults with neurofibromatosis 1 (NF1) using the Impact of NF1 on Quality Of Life (INF1-QOL) questionnaire.,,0.95,clinical_assessment_tool
dd140fcf-1389-5b90-94da-8978ca70bf86,KM (Konstantin Moutakis) cards,Clinical Assessment Tool,,,,,,,,,,,,,,PMID:38990917,10.1371/journal.pone.0305548,Optical coherence tomography of the macular ganglion cell layer in children with neurofibromatosis type 1 is a useful tool in the assessment for optic pathway gliomas.,,0.85,clinical_assessment_tool
71b9e485-eb19-5321-b8b5-cccda706fe04,Lea cards,Clinical Assessment Tool,,,,,,,,,,,,,,PMID:38990917,10.1371/journal.pone.0305548,Optical coherence tomography of the macular ganglion cell layer in children with neurofibromatosis type 1 is a useful tool in the assessment for optic pathway gliomas.,,0.85,clinical_assessment_tool
5b689dd7-5fc9-567b-9415-ba38fc1d245c,Likert scale questionnaire,Clinical Assessment Tool,,,,,,,,,,,,,,PMID:40737523,10.2196/71728,Clinician Perspectives of a Magnetic Resonance Imaging-Based 3D Volumetric Analysis Tool for Neurofibromatosis Type 2-Related Schwannomatosis: Qualitative Pilot Study.,,0.85,clinical_assessment_tool
1b6e2a2a-af7b-595c-ac77-fca8a5b13e5d,PlexiQoL,Clinical Assessment Tool,,,,,,,,,,,,,,PMID:33085177 | PMID:38499890,10.1002/mgg3.1530 | 10.1186/s41687-024-00714-y,"The development of the PlexiQoL: A patient-reported outcome measure for adults with neurofibromatosis type 1-associated plexiform neurofibromas. | The PlexiQoL, a patient-reported outcome measure on quality of life in neurofibromatosis type 1-associated plexiform neurofibroma: translation, cultural adaptation and validation into the Dutch language for the Netherlands.",,0.95,clinical_assessment_tool
cd5ce5c7-6228-5faf-9949-4ca03c7e99c1,SF12,Clinical Assessment Tool,,,,,,,,,,,,,,PMID:31053133,10.1186/s13023-019-1067-8,Burden of adult neurofibromatosis 1: development and validation of a burden assessment tool.,,0.9,clinical_assessment_tool
36ba0734-10fe-5733-b761-fed8ba10b043,Teller acuity cards,Clinical Assessment Tool,,,,,,,,,,,,,,PMID:38990917,10.1371/journal.pone.0305548,Optical coherence tomography of the macular ganglion cell layer in children with neurofibromatosis type 1 is a useful tool in the assessment for optic pathway gliomas.,,0.85,clinical_assessment_tool
814144de-175f-512e-9299-125ece9cc7e4,World Health Organization Categories of Childhood VI scale,Clinical Assessment Tool,,,,,,,,,,,,,,PMID:38990917,10.1371/journal.pone.0305548,Optical coherence tomography of the macular ganglion cell layer in children with neurofibromatosis type 1 is a useful tool in the assessment for optic pathway gliomas.,,0.9,clinical_assessment_tool
4a49f884-8997-5884-939d-d32a027ba173,DINs (Deep Interactive Networks),Computational Tool,,,,,,,,,,,,,,PMID:34106871,10.1109/JBHI.2021.3087735,DINs: Deep Interactive Networks for Neurofibroma Segmentation in Neurofibromatosis Type 1 on Whole-Body MRI.,,0.95,computational_tool
f6f44b1b-1184-59e7-83fd-bc9eade2284f,RENOVO-NF1,Computational Tool,,,,,,,,,,,,,,PMID:40887659,10.1186/s40246-025-00803-z,RENOVO-NF1 accurately predicts NF1 missense variant pathogenicity.,,0.95,computational_tool
7efb0f81-781b-508c-8b51-bd1bc42050d0,1276P NF1 GRD,Genetic Reagent,,,,,,,,,,,,,,PMID:16835260,10.1093/hmg/ddl165,Nf1+/- mast cells induce neurofibroma like phenotypes through secreted TGF-beta signaling.,,0.9,genetic_reagent
3e26c266-237c-50ce-bf42-389a5d88cff1,Cas9 and sgRNAs targeting Nf1+Cdkn2a,Genetic Reagent,,,,,,,,,,,,,,PMID:37410426,10.1158/1078-0432.CCR-23-0749,"CDK4/6-MEK Inhibition in MPNSTs Causes Plasma Cell Infiltration, Sensitization to PD-L1 Blockade, and Tumor Regression.",,0.9,genetic_reagent
6a54cddc-272f-5cfc-b063-48f9969606ab,dNf1,Genetic Reagent,,,,,,,,,,,,,,PMID:39129390,10.1002/1878-0261.13704,Inhibition of autophagy as a novel treatment for neurofibromatosis type 1 tumors.,,0.9,genetic_reagent
e27b27fb-155e-5921-902e-5e9db24a264a,HA-Merlin,Genetic Reagent,,,,,,,,,,,,,,PMID:25043298,10.1038/onc.2014.185,Oncogenic role of Merlin/NF2 in glioblastoma.,,0.9,genetic_reagent
2af24a58-4a08-5f34-b39a-00372f6d22a8,human neurofibromin,Genetic Reagent,,,,,,,,,,,,,,PMID:40590220,10.1172/JCI188932,A haploinsufficiency restoration strategy corrects neurobehavioral deficits in Nf1+/- mice.,,0.95,genetic_reagent
83ecd84b-4ddc-52b4-9b65-26baf7f4e30d,Merlin,Genetic Reagent,,,,,,,,,,,,,,PMID:32457840,10.3389/fonc.2020.00687,"TGFβ Signaling Increases Net Acid Extrusion, Proliferation and Invasion in Panc-1 Pancreatic Cancer Cells: SMAD4 Dependence and Link to Merlin/NF2 Signaling.",,0.9,genetic_reagent
58f25ef1-d11b-59e3-9649-436ff28ce3e7,Merlin isoform 1,Genetic Reagent,,,,,,,,,,,,,,PMID:24882693,10.1016/j.jmb.2014.05.011,Molecular conformation of the full-length tumor suppressor NF2/Merlin--a small-angle neutron scattering study.,,0.85,genetic_reagent
cbc093da-7e68-5b32-818b-f5c9fa24b551,Merlin siRNA,Genetic Reagent,,,,,,,,,,,,,,PMID:25043298,10.1038/onc.2014.185,Oncogenic role of Merlin/NF2 in glioblastoma.,,0.85,genetic_reagent
35b70a2e-944e-5366-90e3-312dccf7dd9b,Merlin(S518D) and Merlin(S518E) mutants,Genetic Reagent,,,,,,,,,,,,,,PMID:24882693,10.1016/j.jmb.2014.05.011,Molecular conformation of the full-length tumor suppressor NF2/Merlin--a small-angle neutron scattering study.,,0.8,genetic_reagent
a7926f94-fdf4-5cc2-8b55-e3a892f2de94,neurofibromin 2,Genetic Reagent,,,,,,,,,,,,,,PMID:20195187,10.1097/MAO.0b013e3181d2777f,Merlin knockdown in human Schwann cells: clues to vestibular schwannoma tumorigenesis.,,0.95,genetic_reagent
182aad93-5fa7-51dc-b298-2c359c28371f,Nf1,Genetic Reagent,,,,,,,,,,,,,,PMID:32461556 | PMID:38481529 | PMID:39890807 | PMID:34646065 | PMID:37446790 | PMID:34011935 | PMID:29670214 | PMID:37140985 | PMID:36241865,10.1038/s41467-020-16432-0 | 10.3389/fcell.2024.1359561 | 10.1038/s41598-024-84493-y | 10.1155/2021/9386823 | 10.3390/molecules28135128 | 10.1038/s41419-021-03802-9 | 10.1038/s41598-018-24310-5 | 10.1172/JCI168227 | 10.1038/s12276-022-00850-9,Assessing the origin of high-grade serous ovarian cancer using CRISPR-modification of mouse organoids. | Generation of heterozygous and homozygous NF1 lines from human-induced pluripotent stem cells using CRISPR/Cas9 to investigate bone defects associated with neurofibromatosis type 1. | Global proteomics and affinity mass spectrometry analysis of human Schwann cells indicates that variation in and loss of neurofibromin (NF1) alters protein expression and cellular and mitochondrial metabolism. | Survival and | Icariin Promotes Osteogenic Differentiation in a Cell Model with NF1 Gene Knockout by Activating the cAMP/PKA/CREB Pathway. | Metalloproteinase 1 downregulation in neurofibromatosis 1: Therapeutic potential of antimalarial hydroxychloroquine and chloroquine. | Restoring functional neurofibromin by protein transduction. | Basement membrane proteins in extracellular matrix characterize NF1 neurofibroma development and response to MEK inhibitor. | Transplanting neurofibromatosis-1 gene knockout neural stem cells improve functional recovery in rats with spinal cord injury by enhancing the mTORC2 pathway.,,0.95,genetic_reagent
6aef8f45-05fd-54b2-a19a-73f1688f586e,NF1 capture probes,Genetic Reagent,,,,,,,,,,,,,,PMID:27999334,10.3390/genes7120133,Hybridization Capture-Based Next-Generation Sequencing to Evaluate Coding Sequence and Deep Intronic Mutations in the NF1 Gene.,,0.9,genetic_reagent
01acf277-b66a-501f-9790-86b8b22e9a4a,NF1 DLR,Genetic Reagent,,,,,,,,,,,,,,PMID:37520682,10.1016/j.omtn.2023.06.018,Combining nonsense mutation suppression therapy with nonsense-mediated decay inhibition in neurofibromatosis type 1.,,0.95,genetic_reagent
fce11210-d4af-59a8-9332-478ee203fab0,Nf1 flox,Genetic Reagent,,,,,,,,,,,,,,PMID:22901811,10.1016/j.cell.2012.06.034,ERK inhibition rescues defects in fate specification of Nf1-deficient neural progenitors and brain abnormalities.,,0.95,genetic_reagent
bca1003e-cc07-5aef-bafa-63c5c19414f9,NF1 gRNA,Genetic Reagent,,,,,,,,,,,,,,PMID:38216123,10.1016/j.molmet.2024.101876,NF1 deficiency drives metabolic reprogramming in ER+ breast cancer.,,0.85,genetic_reagent
06cfd3ee-3729-5709-b480-369992a65417,NF1 isoform 2,Genetic Reagent,,RRID:Addgene_70423,,,,,,,,,,,,PMID:31836666 | PMID:36689660,10.1074/jbc.RA119.010934 | 10.1073/pnas.2208960120,Biochemical and structural analyses reveal that the tumor suppressor neurofibromin (NF1) forms a high-affinity dimer. | Destabilizing NF1 variants act in a dominant negative manner through neurofibromin dimerization.,,0.9,genetic_reagent
9eac762d-fe39-5dd6-92f3-8ef4b951e1c2,Nf1 KO,Genetic Reagent,,,,,,,,,,,,,,PMID:22901811,10.1016/j.cell.2012.06.034,ERK inhibition rescues defects in fate specification of Nf1-deficient neural progenitors and brain abnormalities.,,0.9,genetic_reagent
e38aa0ec-2c20-56e8-a848-a9dc9af01121,NF1-GRD,Genetic Reagent,,,,,,,,,,,,,,PMID:24509877 | PMID:35393510 | PMID:16835260 | PMID:38000020,10.1038/onc.2013.506 | 10.1038/s41418-022-00991-4 | 10.1093/hmg/ddl165 | 10.1126/sciadv.adg8876,MAF mediates crosstalk between Ras-MAPK and mTOR signaling in NF1. | Tumor growth of neurofibromin-deficient cells is driven by decreased respiration and hampered by NAD | Nf1+/- mast cells induce neurofibroma like phenotypes through secreted TGF-beta signaling. | CDK4/6 inhibition enhances SHP2 inhibitor efficacy and is dependent upon RB function in malignant peripheral nerve sheath tumors.,,0.9,genetic_reagent
47c4dd20-2b55-5df4-8b68-67057a9b3504,NF1-targeting TALEN,Genetic Reagent,,,,,,,,,,,,,,PMID:37520682,10.1016/j.omtn.2023.06.018,Combining nonsense mutation suppression therapy with nonsense-mediated decay inhibition in neurofibromatosis type 1.,,0.85,genetic_reagent
