antibodyId,targetAntigen,hostOrganism,clonality,vendor,catalogNumber,_pmid,_foundIn,_confidence,_contextSnippet,_whyMissed,_reasoning,_source
ce699649-7924-4f24-80df-c9da9b2315c4,GAPDH antibody,,,,,PMID:28775147,methods,1.0,"glyceraldehyde-3-phosphate dehydrogenase (GAPDH; #365062, Santa Cruz Biotechnology)",Antibody with catalog number not captured,,AI validation - Sonnet 4.5
298b6de0-8971-47f0-ba9d-aca4f00c32bb,NF-κB (p65) primary antibody,,,,,PMID:30348676,methods,0.95,"Esophageal cancer cells were incubated with 5 μM DAF-FM probe and 1 μg/mL NF-κB (p65) primary antibody (Abcam, ab16502)",Antibody with catalog number not captured,,AI validation - Sonnet 4.5
255402df-946c-47af-b3fb-ca310cd972fb,Cy3-labeled secondary antibody,,,,,PMID:30348676,methods,0.95,"then incubated with Cy3-labeled secondary antibody (Abcam, ab6939) for 1 hour",Secondary antibody with catalog number not captured,,AI validation - Sonnet 4.5
284795c5-09b3-425c-bb2f-4e9ab553ad6a,K1 antibody,,,,,PMID:30479396,methods,1.0,"The following primary antibodies were used in the immunohistochemistry studies: K1 (BioLegend, 905601, 1:100)",Antibody with catalog number not detected,,AI validation - Sonnet 4.5
6484c3fd-3e42-446c-8490-9e711c9cf5e2,NF1 antibody,,,,,PMID:30479396,methods,1.0,"NF1 (Santa Cruz; sc-67, 1:100)",Antibody with vendor and catalog info not captured,,AI validation - Sonnet 4.5
12d465b1-89c2-4815-80a6-a004a0dc395a,H3K27Me3 antibody,,,,,PMID:30479396,methods,1.0,"H3K27Me3 (Cell Signaling, 9733 S, 1:500)",Histone modification antibody not detected,,AI validation - Sonnet 4.5
3413999c-f33d-4a40-b28c-e2134238ad6d,S100 antibody,,,,,PMID:30479396,methods,1.0,"S100 (DAKO, Z0311, 1:5000)",Protein marker antibody not captured,,AI validation - Sonnet 4.5
0500bbbf-5ecf-4246-8691-df7572255895,LUMICAN antibody,,,,,PMID:30479396,methods,1.0,"LUMICAN (Santa Cruz; sc-166871, 1:200)",Western blot antibody not detected,,AI validation - Sonnet 4.5
7681cffe-0336-4e43-91da-77468b5a3002,anti-CD3 antibody,,,,,PMID:30479396,methods,1.0,precoated with indicated doses of anti-CD3 Ab (eBioscience; cat. no. 16-0031-86),Flow cytometry/functional antibody not captured,,AI validation - Sonnet 4.5
a12059eb-4e8a-4096-98d1-39d807fb17ce,anti-CD28 antibody,,,,,PMID:30479396,methods,1.0,anti-CD28 mAb (eBioscience; cat. no. 16-0281-85),T cell stimulation antibody not detected,,AI validation - Sonnet 4.5
35fbbb35-86a6-444c-954f-3a96fa2f83df,FITC-anti-CD69 antibody,,,,,PMID:30479396,methods,1.0,LN cells were stained with FITC-anti-CD69 mAb (eBioscience; cat. no. 11-0691-85; 1:100),Fluorescent-conjugated antibody not captured,,AI validation - Sonnet 4.5
269d8584-205a-437a-a3be-0e4681309fbd,CD4 antibody,,,,,PMID:30479396,methods,1.0,CD4 [eBioscience; cat. no. 17-0042-83; 1:100],T cell marker antibody not detected,,AI validation - Sonnet 4.5
911acf3d-3fa5-4b2d-8b5f-45ba53c84b39,CD8 antibody,,,,,PMID:30479396,methods,1.0,CD8 [Lifetech; cat. no. A15836; 1:100],T cell marker antibody not captured,,AI validation - Sonnet 4.5
1af13248-14ef-4426-9328-b01c9e6b36cf,FoxP3 antibody,,,,,PMID:30479396,methods,1.0,FoxP3 [eBioscience; cat. no. 12-57773-80; 1:100],Regulatory T cell marker antibody not detected,,AI validation - Sonnet 4.5
7f630c23-a930-473f-9339-791bfbe577c8,B220 antibody,,,,,PMID:30479396,methods,1.0,B-cell (B220 [eBioscience; cat. no. 11-0452-85; 1:100]),B cell marker antibody not captured,,AI validation - Sonnet 4.5
84823167-8571-4036-8252-ec4ac99e806c,CD45 antibody,,,,,PMID:30479396,methods,1.0,pan hematopoietic (CD45 [eBioscience; cat. no. 25-0451-82; 1:100),Pan-hematopoietic marker antibody not detected,,AI validation - Sonnet 4.5
926b5ad2-1e3b-4542-8b91-47f3e54c74ee,P-cadherin antibody,,,,,PMID:28465357,methods,1.0,"P-cadherin (R&D Systems, AF761)",Antibody with vendor and catalog number not captured,,AI validation - Sonnet 4.5
946dddbf-8a94-4111-8fa7-0ed8bc5bd1a4,DCT antibody,,,,,PMID:28465357,methods,1.0,"DCT (PEP8h; gift from Dr. Vincent Hearing, National Institutes of Health)",Antibody with clone name and source not captured,,AI validation - Sonnet 4.5
a812e5d2-2956-4752-ad13-9066632438b7,K14 antibody,,,,,PMID:28465357,methods,1.0,"K14 (biotin-labeled, Thermo, clone LL002)","Antibody with modification, vendor, and clone not captured",,AI validation - Sonnet 4.5
9faa786b-72d8-47c3-832b-9e7cddf44deb,LacZ antibody,,,,,PMID:28465357,methods,1.0,"LacZ (Abcam, ab9361)",Antibody with vendor and catalog number not captured,,AI validation - Sonnet 4.5
a2f89aa4-18f1-488f-867c-5a11b0100974,GFP/YFP antibody,,,,,PMID:28465357,methods,1.0,"GFP/YFP (Aves, 1020)",Dual-specificity antibody with vendor and catalog not captured,,AI validation - Sonnet 4.5
372eb8db-27cf-436f-b619-6f08588be40b,Krox20 antibody,,,,,PMID:28465357,methods,1.0,"Krox20 (Covance, PRB-236P)",Antibody with vendor and catalog number not captured,,AI validation - Sonnet 4.5
507afab3-9690-4a09-94a3-bfe2b780abfd,KIT antibody,,,,,PMID:28465357,methods,1.0,"KIT (Cell Signaling, 3074)",Antibody with vendor and catalog number not captured,,AI validation - Sonnet 4.5
fc7485d7-9011-44fb-a99b-51c1d5354c42,TRIM23 antibody,,,,,PMID:32642734,methods,1.0,"Immunohistochemical stain for TRIM23 (ThermoFisher, PA5-34624, 1:150, rabbit polyclonal)",Specific antibody with catalog number and dilution not captured,,AI validation - Sonnet 4.5
2fc9aaef-9e60-4854-ac0f-1e0bb91faa1d,H3K27me3 antibody,,,,,PMID:32642734,methods,1.0,"Immunohistochemistry for histone 3 lysine trimethylation (H3K27 me3) was performed using rabbit monoclonal antibodies (C36B11, 1:50 dilution; Cell Signaling Technology)",Specific antibody with clone and catalog info not captured,,AI validation - Sonnet 4.5
956c6ad9-03af-435c-85ec-46355924a73c,Cleaved-caspase 3 antibody,,,,,PMID:32642734,methods,1.0,"Immunohistochemical staining for Cleaved-caspase 3 at 1:500 (Cell Signaling Technology, Danvers, MA)",Specific antibody with dilution and vendor not captured,,AI validation - Sonnet 4.5
5e267ce6-5451-4e76-8328-23c8104d5c3e,Ki67 antibody,,,,,PMID:32642734,methods,1.0,prediluted Ki67 (790-4286; Ventana),Specific antibody with catalog number not captured,,AI validation - Sonnet 4.5
4bd8bf2a-788b-41c7-bf47-601686b106ec,β-actin antibody,,,,,PMID:32642734,methods,1.0,β-actin (Santa Cruz; sc-47778; 1:500; 37°C 45min),Specific antibody with catalog number and conditions not captured,,AI validation - Sonnet 4.5
3eb6c423-b6f2-47b1-ba23-fbc83d7407bb,anti-HK2 antibody,,,,,PMID:32383545,methods,1.0,"primary goat polyclonal anti‐HK2 (sc‐6521, Santa Cruz) antibodies",Antibody with catalog number not captured,,AI validation - Sonnet 4.5
aa7fc67c-b5a0-4ef6-bae5-c314ff90ac2f,anti-MPP2 antibody,,,,,PMID:32383545,methods,1.0,"rabbit monoclonal anti‐MPP2 (ab92536, Abcam) antibodies",Antibody with vendor information not detected,,AI validation - Sonnet 4.5
876eb7d4-39e4-469c-a1b1-0ff44853d1bc,anti-GAPDH antibody,,,,,PMID:32383545,methods,1.0,"anti‐GAPDH (#2118, Cell Signaling)",Antibody with catalog number format not recognized,,AI validation - Sonnet 4.5
a9dd1e01-f8b1-4ef1-a601-ac8d4d3f984c,ATP5A antibody,,,,,PMID:32383545,methods,1.0,"ATP5A (ab14748, Abcam)",Antibody target name without 'anti-' prefix not captured,,AI validation - Sonnet 4.5
dc7a2a25-ea09-48fa-b3d8-2ee085767f93,anti-UQCRC2 antibody,,,,,PMID:32383545,methods,1.0,"anti‐UQCRC2 (ab14745, Abcam)",Complex protein target name not recognized,,AI validation - Sonnet 4.5
ab796cfd-370d-4ba2-8423-e84b14735e18,anti-MMP2 antibody,,,,,PMID:32383545,methods,1.0,"rabbit monoclonal anti‐MMP2 (ab92536, Abcam)",Antibody with full description not detected,,AI validation - Sonnet 4.5
3883812a-8796-4f1b-b2b9-d5ca4d08ab4a,anti-MMP9 antibody,,,,,PMID:32383545,methods,1.0,"rabbit monoclonal anti‐MMP9 (ab137867, Abcam)",Similar antibody pattern not captured,,AI validation - Sonnet 4.5
48d59727-a610-4e86-8782-a0adc425d8f2,TOM20 antibody,,,,,PMID:32383545,methods,1.0,"TOM20 (sc‐11415, Santa Cruz) antibodies",Antibody without 'anti-' prefix not recognized,,AI validation - Sonnet 4.5
d84faa8e-4191-4158-9bc4-7bd96da69e35,Anti-FLAG,,,,,PMID:33585982,methods,1.0,Anti-FLAG Merck #F3165,Standard antibody naming with catalog number - should be detected by antibody patterns,,AI validation - Sonnet 4.5
8d4d7db5-6f69-4b04-84a3-e75e913c023a,Anti-FGFR1,,,,,PMID:33585982,methods,1.0,Anti-FGFR1 Abcam #ab76464,Standard antibody naming with vendor and catalog number,,AI validation - Sonnet 4.5
e29d892e-620d-442b-ab4a-3d7113d1c196,Anti-phospho-FGFR1 Tyr653/654,,,,,PMID:33585982,methods,1.0,Anti-phospho-FGFR1 Tyr653/654 Cell Signaling Technology #52928,Phospho-specific antibody with full vendor information,,AI validation - Sonnet 4.5
a2649d49-3f78-4c02-9e6c-66e76b49ead7,RBPMS antibody,,,,,PMID:33816648,methods,1.0,"Cells derived on D1 were additionally stained with RBPMS antibody (Abcam ab194213, 1:200)",Antibody with catalog number and dilution,,AI validation - Sonnet 4.5
b65166f3-22bc-413c-a8b4-416daf6bed20,L1cam antibody,,,,,PMID:33816648,methods,1.0,"RGCs were isolated using...the L1cam (CD171) antibody (Biolegend 826701, 1:100)",Antibody with vendor and catalog number,,AI validation - Sonnet 4.5
c1aab9c0-a90b-4e22-9053-1554dcc933a5,S100B antibody,,,,,PMID:34237737,methods,0.9,The successful dissection of the cNF tissue from the overlying skin was confirmed by the 2.21-fold expression of the Schwann cell marker S100B in cNFs compared to skin,Antibody mentioned as Schwann cell marker but not explicitly stated as antibody in methods,,AI validation - Sonnet 4.5
74b3ff5d-78d7-422d-9118-9f91d882394c,CD117 antibody,,,,,PMID:34237737,abstract,0.95,"The tumors were immunolabeled for the mast cell markers CD117, tryptase, and chymase",Immunolabeling markers mentioned but not captured as antibodies,,AI validation - Sonnet 4.5
1f4dd179-74fb-461d-9d89-a6297c6e5179,tryptase antibody,,,,,PMID:34237737,abstract,0.95,"The tumors were immunolabeled for the mast cell markers CD117, tryptase, and chymase",Immunolabeling markers mentioned but not captured as antibodies,,AI validation - Sonnet 4.5
451a747d-c126-477b-aab0-e1f7f2eeb57d,chymase antibody,,,,,PMID:34237737,abstract,0.95,"The tumors were immunolabeled for the mast cell markers CD117, tryptase, and chymase",Immunolabeling markers mentioned but not captured as antibodies,,AI validation - Sonnet 4.5
adf7e30f-9756-49cf-9d74-5e08c65c2aa2,CONFIRM anti-Ki67 (clone 30-9) rabbit monoclonal primary antibody,,,,,PMID:34237737,methods,1.0,followed by a 12-min incubation with the CONFIRM anti-Ki67 (clone 30-9) rabbit monoclonal primary antibody (Roche),Specific antibody with clone information and vendor not captured,,AI validation - Sonnet 4.5
0da7ff2a-9dd5-4e13-993a-2ad69e25db5a,polyclonal anti-collagen XV,,,,,PMID:34237737,methods,1.0,"followed by an incubation with polyclonal anti-collagen XV (Sigma-Aldrich, HPA017913, 1:1000)",Specific antibody with catalog number and vendor not captured,,AI validation - Sonnet 4.5
6310c8d5-7a76-4e9a-b8af-dba5bf98872c,monoclonal anti-collagen XVIII,,,,,PMID:34237737,methods,1.0,"or in-house monoclonal anti-collagen XVIII (ref. [46], DB144-N2, 7 μg/ml) primary antibody",In-house antibody with clone information not captured,,AI validation - Sonnet 4.5
5a8838c2-9bb0-4c9e-9476-30e73063b006,p-RB1-S807/811 antibody,,,,,PMID:34065204,methods,1.0,"Antibodies included those specific for p-RB1-S807/811 (1:1000, no. 8516) and RB1 (no. 9309 and no. 9313, 1:500) from Cell Signaling Technology",Specific phospho-antibody with catalog number and dilution - research antibody,,AI validation - Sonnet 4.5
5846b63e-aa4e-444b-a4ea-c13d9d7809e1,RB1 antibody,,,,,PMID:34065204,methods,1.0,"Antibodies included those specific for p-RB1-S807/811 (1:1000, no. 8516) and RB1 (no. 9309 and no. 9313, 1:500) from Cell Signaling Technology",Specific antibody with catalog numbers and dilution - research antibody,,AI validation - Sonnet 4.5
914d37eb-9fb3-46dd-b339-7fb474fba123,p16 antibody (human),,,,,PMID:34065204,methods,1.0,"human p16 (ab108349, 1:1000) and GAPDH (1:5000, no. Ab8245) from Abcam",Specific antibody with catalog number and dilution - research antibody,,AI validation - Sonnet 4.5
9190e905-f424-4dee-8de0-bd79aea84796,GAPDH antibody,,,,,PMID:34065204,methods,1.0,"human p16 (ab108349, 1:1000) and GAPDH (1:5000, no. Ab8245) from Abcam",Loading control antibody with catalog number and dilution - research antibody,,AI validation - Sonnet 4.5
a6897033-4e6b-4735-b2d2-0b82a2c8959f,p16 antibody (mouse),,,,,PMID:34065204,methods,1.0,"mouse p16 (sc-1207, 1:200) from Santa Cruz Biotechnology",Species-specific antibody with catalog number and dilution - research antibody,,AI validation - Sonnet 4.5
94c0ffa1-afd7-4829-89e3-e9bdbd7e2bb4,RABL6A antibody,,,,,PMID:34065204,methods,1.0,RABL6A antibodies (monoclonal and polyclonal) were produced in the Quelle laboratory,Custom antibody produced in laboratory - research antibody,,AI validation - Sonnet 4.5
b9699991-2321-4e9a-9c29-936f511cdc3f,Phospho-p44/42 ERK1/2 antibody,,,,,PMID:33978635,methods,1.0,Primary antibodies against Phospho-p44/42 ERK1/2 (p-ERK) (Cell Signaling Technologies #4370S) and p44/42 ERK1/2 (ERK) (Cell Signaling Technologies #4695S) were used at 1:100 dilution,Specific antibody with catalog number not detected,,AI validation - Sonnet 4.5
c5097b94-d75b-4b36-a977-20bb1c203d46,p44/42 ERK1/2 antibody,,,,,PMID:33978635,methods,1.0,Primary antibodies against Phospho-p44/42 ERK1/2 (p-ERK) (Cell Signaling Technologies #4370S) and p44/42 ERK1/2 (ERK) (Cell Signaling Technologies #4695S) were used at 1:100 dilution,Total ERK antibody with catalog number not detected,,AI validation - Sonnet 4.5
8f298b6e-26f2-43a6-81d7-9484b6d41b72,phosphor-p44/p42 MAPK antibody,,,,,PMID:33978635,methods,1.0,"Immunohistochemical staining for phosphor-p44/p42 MAPK (ERK1/2) (Thr202/Tyr204) (Cell Signaling Technology Catalog #4370, Rabbit mAb, 1:100 dilution)",IHC antibody with detailed specifications not detected,,AI validation - Sonnet 4.5
02f6446d-c395-49fb-a0c1-56c3b4d47a9f,anti-TRAP1 (BD #612344),,,,,PMID:33934112,methods,1.0,Mouse monoclonal anti-rodent TRAP1 was from Becton Dickinson (Cat. #612344),Antibody with catalog number not detected,,AI validation - Sonnet 4.5
e73cd53c-b47d-4f06-a066-790fb7c756d1,anti-TRAP1 (Santa Cruz #sc-73604),,,,,PMID:33934112,methods,1.0,mouse monoclonal anti-human TRAP1 was from Santa Cruz (Cat. #sc-73604),Antibody with catalog number not detected,,AI validation - Sonnet 4.5
24fbadb5-b19e-4cba-a6a4-b69b2a9fb852,anti-β actin (Santa Cruz #sc-47778),,,,,PMID:33934112,methods,1.0,mouse monoclonal anti-β actin was from Santa Cruz (Cat. #sc-47778),Antibody with catalog number not detected,,AI validation - Sonnet 4.5
2a57779e-1345-4a2d-b646-2c1b02e3b760,anti-citrate synthetase (Abcam #ab96600),,,,,PMID:33934112,methods,1.0,rabbit polyclonal anti-citrate synthetase was from Abcam (Cat. #ab96600),Antibody with catalog number not detected,,AI validation - Sonnet 4.5
53a4efc1-bc0a-482c-8508-b6b9c07f280e,anti-HIF1α (Novus #NB100-449),,,,,PMID:33934112,methods,1.0,rabbit polyclonal anti-HIF1α was from Novus Biologicals (Cat. #NB100-449),Antibody with catalog number not detected,,AI validation - Sonnet 4.5
91074184-6d2e-4e2e-bb2c-6d420a4c9cbf,anti-HIF1α (GeneTex #GTX131826),,,,,PMID:33934112,methods,1.0,rabbit polyclonal anti-HIF1α was from GeneTex (Cat. #GTX131826),Antibody with catalog number not detected,,AI validation - Sonnet 4.5
124adf56-38cd-4724-9ece-40f0093efd44,anti-phospho-ERK1/2 (Cell Signaling #9101),,,,,PMID:33934112,methods,1.0,rabbit polyclonal anti-phospho-ERK1/2 was from Cell Signaling (Cat. #9101),Antibody with catalog number not detected,,AI validation - Sonnet 4.5
b2ddec53-7016-4642-aa09-870cd40dd71b,anti-GLUT1 (Abcam #ab652),,,,,PMID:33934112,methods,1.0,rabbit polyclonal anti-glucose transporter GLUT1 was from Abcam (Cat. #ab652),Antibody with catalog number not detected,,AI validation - Sonnet 4.5
cc06b715-ffaa-420c-8ad0-1e0cd46035a6,ATRX antibody,,,,,PMID:31462295,methods,1.0,"Immunohistochemical studies were systematically performed in most cases using an ATRX antibody (Rabbit polyclonal, 1:200 dilution, catalog# HPA001906 Sigma-Aldrich)",Clear antibody mention with catalog number and vendor - should have been caught by antibody patterns,,AI validation - Sonnet 4.5
f79f98ca-1043-46f6-b65e-680941609f2b,DAXX antibody,,,,,PMID:31462295,methods,1.0,"Immunohistochemistry for DAXX (Rabbit polyclonal, 1:100 dilution, catalog# HPA008736, Atlas Antibodies) was performed manually",Clear antibody mention with catalog number and vendor - should have been caught by antibody patterns,,AI validation - Sonnet 4.5
379f1d8a-9503-42bd-8e54-64de74831da4,H3K27me3 antibody,,,,,PMID:31462295,methods,1.0,"Immunohistochemistry for H3K27me3 was performed manually in whole tissue sections using a mouse monoclonal antibody (Abcam, Cat# ab6002, Cambridge, MA) at 1:1600 dilution",Clear antibody mention with catalog number and vendor - should have been caught by antibody patterns,,AI validation - Sonnet 4.5
22f1346b-bf19-4ab4-a1d4-034f9c4a8f94,anti-Cy3/Cy5 antibody,,,,,PMID:31462295,methods,1.0,"incubated with a monoclonal anti-Cy3/Cy5 antibody (ab52060, Abcam, 1:2500) for 1 h at room temperature",Clear antibody mention with catalog number and vendor - should have been caught by antibody patterns,,AI validation - Sonnet 4.5
f656d835-0e2c-441d-8c46-30dc7621c4d8,IBA-1 antibody,,,,,PMID:32088262,methods,0.95,"IBA-1 Rabbit 1:1000 Cell Signaling Technology 17,198",Antibody with catalog number not captured,,AI validation - Sonnet 4.5
7bb7ed65-a183-462e-b678-80d0fd2f8c24,TRAP1 antibody,,,,,PMID:32088262,methods,0.95,"TRAP1 Mouse 1:1000 BD Biosciences 612,344",Antibody with catalog number not captured,,AI validation - Sonnet 4.5
75af5b43-3385-42da-ad19-29eabf812e5e,CD206 antibody,,,,,PMID:32088262,methods,0.95,CD206 Rabbit 1:1000 Invitrogen PA5-114370,Antibody with catalog number not captured,,AI validation - Sonnet 4.5
18146d92-e020-42fc-b5ba-3b2d2d970627,ARG-1 antibody,,,,,PMID:32088262,methods,0.95,"ARG-1 Rabbit 1:1000 Cell Signaling Technology 93,668S",Antibody with catalog number not captured,,AI validation - Sonnet 4.5
8b3dc6eb-75ab-4c24-8634-2cacefa652c8,anti-rabbit γ-H2AX antibody,,,,,PMID:34242740,methods,0.9,"Subsequently, cells were cultured with anti-rabbit γ-H2AX antibody and the nuclear staining solution 4, 6-Diamidino-2-phenylindole dihydrochloride (DAPI) overnight",Antibody mention not detected by mining patterns,,AI validation - Sonnet 4.5
f3578bb3-5097-4bdc-8dd1-e77e6ef10ffa,Goat anti-Mouse IgG,,,,,PMID:34242740,methods,0.9,"After incubation with primary antibodies at 4°C overnight, membranes were washed and probed with horseradish peroxidase (HRP)-conjugated secondary antibodies: Goat anti-Mouse IgG or Goat anti-Rabbit IgG (1:4000) (Proteintech, China)",Secondary antibody not detected,,AI validation - Sonnet 4.5
26231d85-559c-4d5f-9bc6-c18d1c203d57,Goat anti-Rabbit IgG,,,,,PMID:34242740,methods,0.9,"After incubation with primary antibodies at 4°C overnight, membranes were washed and probed with horseradish peroxidase (HRP)-conjugated secondary antibodies: Goat anti-Mouse IgG or Goat anti-Rabbit IgG (1:4000) (Proteintech, China)",Secondary antibody not detected,,AI validation - Sonnet 4.5
5da5c64e-ccba-4603-881f-298522f2e62f,ATRX antibody,,,,,PMID:29796169,methods,0.98,"Immunohistochemical stain for ATRX (Sigma, HPA001906, 1:300, rabbit polyclonal) was performed with appropriate positive and negative controls.","Specific antibody with vendor (Sigma), catalog number (HPA001906), dilution (1:300), and type (rabbit polyclonal) clearly described in methods section",,AI validation - Sonnet 4.5
15a6a632-67ac-424b-89b8-0b61f01fbb2f,β-III-spectrin antibody,,,,,PMID:29596596,title,0.9,β-III-spectrin immunohistochemistry as a potential diagnostic tool,"Title clearly mentions immunohistochemistry for β-III-spectrin, which requires specific antibody, but no publication content was available for mining",,AI validation - Sonnet 4.5
8300e33e-7c3f-42ca-ab72-ab86873c813a,YAP antibody (#14074; CST),,,,,PMID:36148553,methods,1.0,YAP (1:100; #14074; CST),Antibody with catalog number and vendor not detected,,AI validation - Sonnet 4.5
a7f45096-6f61-44ba-8989-9a21201d453c,TAZ antibody (sc-48805; Santa Cruz),,,,,PMID:36148553,methods,1.0,TAZ (1:100; sc-48805; Santa Cruz),Antibody with catalog number and vendor not detected,,AI validation - Sonnet 4.5
b019f9d3-5041-4080-8ae5-95e893d014a6,ALDH1A1 antibody (ab52492; Abcam),,,,,PMID:36148553,methods,1.0,ALDH1A1 (1:200; ab52492; Abcam),Antibody with catalog number and vendor not detected,,AI validation - Sonnet 4.5
88f88414-5a60-4d1d-8eb8-91379d9869c8,Ki67 antibody (ab15580; Abcam),,,,,PMID:36148553,methods,1.0,Ki67 (1:100; ab15580; Abcam),Antibody with catalog number and vendor not detected,,AI validation - Sonnet 4.5
1ca05b2b-4fe4-4a46-97f0-4a5f4ac59445,Neurofilament antibody (ab4680; Abcam),,,,,PMID:36148553,methods,1.0,Neurofilament (1:1000; ab4680; Abcam),Antibody with catalog number and vendor not detected,,AI validation - Sonnet 4.5
f0d67f02-c147-48fd-ac7b-e24f0eedc525,Pan-TEAD antibody (#13295; CST),,,,,PMID:36148553,methods,1.0,Pan-TEAD (1:1000; #13295; CST),Antibody with catalog number and vendor not detected,,AI validation - Sonnet 4.5
14fbf64c-1099-4fc9-bc56-a04a33f8add9,GAPDH antibody (AB2302; Merck),,,,,PMID:36148553,methods,1.0,GAPDH (1:5000; AB2302; Merck),Loading control antibody not detected,,AI validation - Sonnet 4.5
764be708-ae00-4dd4-9362-b79cf1d4765d,S100 antibody (GA504; Dako),,,,,PMID:36148553,methods,1.0,S100 (pre-diluted; GA504; Dako),Antibody with catalog number and vendor not detected,,AI validation - Sonnet 4.5
7017a8bd-ac1d-43f3-ab24-2701e4cab4c3,Brn3a-FITC,,,,,PMID:34930951,methods,0.9,"labeled overnight at room temperature with the following conjugated primary antibodies: Brn3a-FITC, RBPMS-APC, Thy1.1-APC",Antibody with fluorophore conjugate not detected - needs antibody-fluorophore patterns,,AI validation - Sonnet 4.5
7e3cdc9b-9735-4e18-9640-674e3c347f5b,RBPMS-APC,,,,,PMID:34930951,methods,0.9,"labeled overnight at room temperature with the following conjugated primary antibodies: Brn3a-FITC, RBPMS-APC, Thy1.1-APC",Antibody with fluorophore conjugate not detected,,AI validation - Sonnet 4.5
1990901e-9ea1-40a6-a1ff-957f189e45d2,Thy1.1-APC,,,,,PMID:34930951,methods,0.9,"Thy1.1-APC (ganglion cell marker), Caspase9-FITC (apoptosis marker), Ki67-FITC (proliferation marker)",Antibody with fluorophore conjugate not detected,,AI validation - Sonnet 4.5
ad53154c-c525-4d11-a456-6e551fab996f,Caspase9-FITC,,,,,PMID:34930951,methods,0.9,"Caspase9-FITC (apoptosis marker), Ki67-FITC (proliferation marker), Cmyc-FITC",Antibody with fluorophore conjugate not detected,,AI validation - Sonnet 4.5
a6c03b67-9a4f-4926-a65d-2aef67edbc85,Ki67-FITC,,,,,PMID:34930951,methods,0.9,"Ki67-FITC (proliferation marker), Cmyc-FITC, Oct4-APC (stemness markers)",Antibody with fluorophore conjugate not detected,,AI validation - Sonnet 4.5
9a63cb5d-cf3a-4c8a-a7ac-6ae8ba9073b1,STEM121-FITC,,,,,PMID:34930951,methods,0.9,STEM121-FITC (human cytoplasmic marker with no cross-reactivity with rats),Specialized antibody marker not detected,,AI validation - Sonnet 4.5
464728cb-d9fa-4b19-9e89-24ff69c4945a,DAPI-VioBlue,,,,,PMID:34930951,methods,0.85,"secondary antibodies (goat-derived anti-rabbit and anti-mouse, DAPI-VioBlue) were diluted 1:200",Nuclear stain with fluorophore not detected,,AI validation - Sonnet 4.5
3f8191b5-8554-420e-9fdd-211468af97f2,ERK1/2 antibody,,,,,PMID:35945271,methods,1.0,"...incubated with primary antibodies against ERK1/2 (Cell Signaling Technology), phospho-ERK1/2 (Cell Signaling Technology)...",Antibody target name without 'antibody' keyword not caught,,AI validation - Sonnet 4.5
07c68ad8-e877-4e0b-b342-b94870bc9200,phospho-ERK1/2 antibody,,,,,PMID:35945271,methods,1.0,"...primary antibodies against ERK1/2 (Cell Signaling Technology), phospho-ERK1/2 (Cell Signaling Technology), Neurofibromin (Novus Biologicals)...",Phospho-specific antibody name not recognized,,AI validation - Sonnet 4.5
a256b7d7-aba3-48c2-96d8-ab674402ef7f,Neurofibromin antibody,,,,,PMID:35945271,methods,1.0,"...phospho-ERK1/2 (Cell Signaling Technology), Neurofibromin (Novus Biologicals), AMPD3 (Novus Biologicals)...",Protein target name without explicit 'antibody' term,,AI validation - Sonnet 4.5
7188a157-b5de-4edf-ad25-23b23ac964b9,AMPD3 antibody,,,,,PMID:35945271,methods,1.0,"...Neurofibromin (Novus Biologicals), AMPD3 (Novus Biologicals), TGFBR3 (Cell Signaling Technology)...",Protein target with vendor but no 'antibody' keyword,,AI validation - Sonnet 4.5
f3e36cc6-1bf0-45b9-88b5-ae7947823965,TGFBR3 antibody,,,,,PMID:35945271,methods,1.0,"...AMPD3 (Novus Biologicals), TGFBR3 (Cell Signaling Technology), β-actin (Santa Cruz Biotechnology)...",Protein target name with vendor information not caught,,AI validation - Sonnet 4.5
c7754ecd-60bc-405f-a3a4-53ad5581b7d1,β-actin antibody,,,,,PMID:35945271,methods,1.0,"...TGFBR3 (Cell Signaling Technology), β-actin (Santa Cruz Biotechnology), and GAPDH (Santa Cruz Biotechnology)...",Loading control antibody not recognized,,AI validation - Sonnet 4.5
ef0ac93a-1e0f-4147-9b5c-b588109c408f,GAPDH antibody,,,,,PMID:35945271,methods,1.0,"...β-actin (Santa Cruz Biotechnology), and GAPDH (Santa Cruz Biotechnology). Secondary antibodies used were goat anti-rabbit...",Common loading control antibody missed,,AI validation - Sonnet 4.5
0d4b7b04-ddd8-462d-bfb5-603c6a77a068,N-Terminal NF1 antibody,,,,,PMID:34694046,methods,1.0,Primary antibodies included N-Terminal NF1 (Cell Signaling cat# D7R7D 1:1000),Antibody with catalog number not detected by mining patterns,,AI validation - Sonnet 4.5
13267307-eed8-44b9-9e32-f8066143f9af,beta-actin antibody,,,,,PMID:34694046,methods,1.0,beta-actin (Cell Signaling cat# 3700 1:10000),Antibody with catalog number not detected by mining patterns,,AI validation - Sonnet 4.5
